id,conversation_id,created_at,date,time,timezone,user_id,username,name,place,tweet,language,mentions,urls,photos,replies_count,retweets_count,likes_count,hashtags,cashtags,link,retweet,quote_url,video,thumbnail,near,geo,source,user_rt_id,user_rt,retweet_id,reply_to,retweet_date,translate,trans_src,trans_dest
1095321775846641664,1095321775846641664,2019-02-12 19:30:36 IST,2019-02-12,19:30:36,+0530,700411569419771904,wec_chile,World Energy Council (WEC) Chile,,#SET19 Más de 420 startups aplicaron al Start Up Energy Transition con el fin de crear distintos proyectos basados en la #Energía⚡sustentable. Ahora el jurado👨‍⚖️ evaluará cada solicitud ¡Nos vemos en el SET Tech Festival en abril!🤩  https://t.co/UsvWh5oshE,es,[],[],['https://pbs.twimg.com/tweet_video_thumb/DzNdQ9fWoAAj2T5.jpg'],0,3,8,"['set19', 'energía']",[],https://twitter.com/WEC_Chile/status/1095321775846641664,False,,1,https://pbs.twimg.com/tweet_video_thumb/DzNdQ9fWoAAj2T5.jpg,,,,,,,[],,,,
1095077725319163904,1095077725319163904,2019-02-12 03:20:49 IST,2019-02-12,03:20:49,+0530,842323117,whycocomaghec,WEC,,"Our Grade 5/6 class here at WEC is part of a provincial pilot program  @GreenSchools_NS to bring awareness to energy consumption in our daily lives and ways in which we can conserve energy. Here is our class in a ""lights off, blinds up"" Challenge.  https://t.co/wmOSVguhLq",en,"[{'screen_name': 'greenschools_ns', 'name': 'green schools ns', 'id': '2777017710'}]",[],['https://pbs.twimg.com/media/DzJ-4eNXcAIz0SO.jpg'],1,0,10,[],[],https://twitter.com/WhycocomaghEC/status/1095077725319163904,False,,1,https://pbs.twimg.com/media/DzJ-4eNXcAIz0SO.jpg,,,,,,,[],,,,
1094259488524259328,1094259488524259328,2019-02-09 21:09:27 IST,2019-02-09,21:09:27,+0530,2531981676,lebanongasoil,Lebanon Gas and Oil,,"We are proud of our Content researcher @Marc_Ayoub chosen among the 18 Future #Energy Leaders of #Lebanon #FELL18 Program hosted by the @WECouncil, which will propose solutions to the country's main energy challenges. Best of Luck! Booklet 👉  https://t.co/x32LbVGG2F #FEL100 #WEC  https://t.co/xWwthL10Z1",en,"[{'screen_name': 'marc_ayoub', 'name': 'marc n. ayoub', 'id': '954006157'}, {'screen_name': 'wecouncil', 'name': 'world energy council', 'id': '101695222'}]",['http://bit.ly/FELL-18Booklet'],['https://pbs.twimg.com/media/Dy-XMPFWoAAZ3vO.jpg'],0,8,26,"['energy', 'lebanon', 'fell18', 'fel100', 'wec']",[],https://twitter.com/LebanonGasOil/status/1094259488524259328,False,,1,https://pbs.twimg.com/media/Dy-XMPFWoAAZ3vO.jpg,,,,,,,[],,,,
1094181531483029508,1094181531483029508,2019-02-09 15:59:40 IST,2019-02-09,15:59:40,+0530,953882681875550209,melhem_fady,Fady Y. MELHEM | فادي ملحم 🇱🇧,,Smart Cities: We're All In This Together What is a #SmartCity? And why should you care about these emerging technologies?  Watch the video to find out!  #SmartCity #SmartGrid #FELL18 #Energy #Leaders #Lebanon @WECFELs @WEC_LEBANON @WECouncil  https://t.co/GypxDwGDWm,en,"[{'screen_name': 'wecfels', 'name': 'future energy leaders', 'id': '1416049675'}, {'screen_name': 'wec_lebanon', 'name': 'wec_lebanon', 'id': '2989767256'}, {'screen_name': 'wecouncil', 'name': 'world energy council', 'id': '101695222'}]",[],[],0,3,10,"['smartcity', 'smartcity', 'smartgrid', 'fell18', 'energy', 'leaders', 'lebanon']",[],https://twitter.com/melhem_fady/status/1094181531483029508,False,,1,https://pbs.twimg.com/ext_tw_video_thumb/1094177371786276864/pu/img/wMu0J4QT1u0WJm9G.jpg,,,,,,,[],,,,
1094180072754499584,1094180072754499584,2019-02-09 15:53:52 IST,2019-02-09,15:53:52,+0530,1093589854913552386,extractivesj,energy miner,,It is privilege and honor to be selected for #future #energyleaders of #lebanon 🇱🇧🇱🇧🇱🇧 program #FELL18. I look forward to joining my colleagues in shaping the #energy vision for the future generations to follow @WEC_LEBANON @WECouncil @LCECtweets  @PierreElKhoury2  @CEPMLP,en,"[{'screen_name': 'wec_lebanon', 'name': 'wec_lebanon', 'id': '2989767256'}, {'screen_name': 'wecouncil', 'name': 'world energy council', 'id': '101695222'}, {'screen_name': 'lcectweets', 'name': 'lcec', 'id': '459993237'}, {'screen_name': 'pierreelkhoury2', 'name': 'pierre el khoury', 'id': '408330663'}, {'screen_name': 'cepmlp', 'name': 'cepmlp', 'id': '75256789'}]",[],[],0,1,8,"['future', 'energyleaders', 'lebanon', 'fell18', 'energy']",[],https://twitter.com/ExtractivesJ/status/1094180072754499584,False,https://twitter.com/WEC_LEBANON/status/1093556719224016898,0,,,,,,,,[],,,,
1094142583578726402,1094142583578726402,2019-02-09 13:24:54 IST,2019-02-09,13:24:54,+0530,2989767256,wec_lebanon,WEC_Lebanon,,The 18 Future Energy Leaders of Lebanon are now selected and many activities will be kicked off very soon! Get to know about the #FELL18 team. Click on the link below to find out more! #FEL100 #Lebanon    https://t.co/dEYRH0MaYJ,en,[],['http://bit.ly/FELL-18Booklet'],[],0,4,12,"['fell18', 'fel100', 'lebanon']",[],https://twitter.com/WEC_LEBANON/status/1094142583578726402,False,,0,,,,,,,,[],,,,
1093829870105309185,1093829870105309185,2019-02-08 16:42:18 IST,2019-02-08,16:42:18,+0530,954006157,marc_ayoub,Marc N. Ayoub,,Glad to be selected on board on the FELL18 program which will help 🇱🇧 in Shaping #Energy Solutions of Tomorrow.  Full Booklet:  https://t.co/oRTQr09SBl  #Lebanon #Energy #FELL18 #FEL100 #WEC @WECFELs @WECouncil,en,"[{'screen_name': 'wecfels', 'name': 'future energy leaders', 'id': '1416049675'}, {'screen_name': 'wecouncil', 'name': 'world energy council', 'id': '101695222'}]",['http://bit.ly/FELL-18Booklet'],[],5,4,26,"['energy', 'lebanon', 'energy', 'fell18', 'fel100', 'wec']",[],https://twitter.com/Marc_Ayoub/status/1093829870105309185,False,https://twitter.com/WEC_LEBANON/status/1093504805098668037,0,,,,,,,,[],,,,
1093829068171198464,1093829068171198464,2019-02-08 16:39:06 IST,2019-02-08,16:39:06,+0530,324855667,ifi_aub,IFI at AUB,,Congrats to IFI researcher @Marc_Ayoub for being selected as one of the 18 Future #Energy Leaders of #Lebanon #FELL18 This program is designed to inspire &amp; grow Lebanon’s energy future leaders &amp; influence Lebanon’s energy landscape. #FEL100 @WEC   https://t.co/uLrZaFm0xM  https://t.co/XFwXhaIywg,en,"[{'screen_name': 'marc_ayoub', 'name': 'marc n. ayoub', 'id': '954006157'}, {'screen_name': 'wec', 'name': 'web-empowered church', 'id': '14144884'}]",['https://goo.gl/8R777E'],['https://pbs.twimg.com/media/Dy4PWTyWsAEqUFc.jpg'],5,20,54,"['energy', 'lebanon', 'fell18', 'fel100']",[],https://twitter.com/ifi_aub/status/1093829068171198464,False,,1,https://pbs.twimg.com/media/Dy4PWTyWsAEqUFc.jpg,,,,,,,[],,,,
1093750461419716609,1093750461419716609,2019-02-08 11:26:45 IST,2019-02-08,11:26:45,+0530,2989767256,wec_lebanon,WEC_Lebanon,,Rise and shine! Have you read about the 18 Future Energy Leaders of Lebanon? Check the #FELL18 booklet 2019 available on the WEC Lebanon website. #Lebanon #Energy #FEL100   https://t.co/dEYRH0MaYJ,en,[],['http://bit.ly/FELL-18Booklet'],[],0,6,13,"['fell18', 'lebanon', 'energy', 'fel100']",[],https://twitter.com/WEC_LEBANON/status/1093750461419716609,False,,0,,,,,,,,[],,,,
1093556719224016898,1093556719224016898,2019-02-07 22:36:53 IST,2019-02-07,22:36:53,+0530,2989767256,wec_lebanon,WEC_Lebanon,,"18 energy professionals in the field, 18 different backgrounds and 18 professions, meet the 18 Future Energy Leaders of Lebanon! Link below! #FELL18     https://t.co/dEYRH0MaYJ",en,[],['http://bit.ly/FELL-18Booklet'],[],0,5,10,['fell18'],[],https://twitter.com/WEC_LEBANON/status/1093556719224016898,False,,0,,,,,,,,[],,,,
1093504805098668037,1093504805098668037,2019-02-07 19:10:36 IST,2019-02-07,19:10:36,+0530,2989767256,wec_lebanon,WEC_Lebanon,,The FELL-18 Booklet 2019 is now available on the WEC Lebanon website!Get to know the 18 Future Energy Leaders of Lebanon for the year 2019. The booklet has list and the biographies of the 18 participants. Get to know more about them now! #FELL18    https://t.co/dEYRH0MaYJ,en,[],['http://bit.ly/FELL-18Booklet'],[],0,7,12,['fell18'],[],https://twitter.com/WEC_LEBANON/status/1093504805098668037,False,,0,,,,,,,,[],,,,
1093213014231269376,1093213014231269376,2019-02-06 23:51:08 IST,2019-02-06,23:51:08,+0530,1664424594,wec_deutschland,Weltenergierat,,"Again, a great pleasure to partner with @EworldEssen #Eworld2019 - thanks to our experts @EON_de @VDA_online @IWOeV &amp; Mitsubishi + startups @WELOVE_ENERGY @VPPlant_pl @INERATEC_global - see you next year! 👋👋  https://t.co/M3x1TXzx8A",en,"[{'screen_name': 'eworldessen', 'name': 'e-world energy & water', 'id': '2647373288'}, {'screen_name': 'eon_de', 'name': 'e.on', 'id': '40022234'}, {'screen_name': 'vda_online', 'name': 'vda', 'id': '2477982157'}, {'screen_name': 'iwoev', 'name': 'futurefuels', 'id': '196962229'}, {'screen_name': 'welove_energy', 'name': 'we love energy', 'id': '922478130593435648'}, {'screen_name': 'vpplant_pl', 'name': 'virtual power plant (vpplant)', 'id': '984945129919340544'}, {'screen_name': 'ineratec_global', 'name': 'ineratec', 'id': '1022382267237388289'}]",[],['https://pbs.twimg.com/media/DyvfcEzXQAIQUFL.jpg'],0,0,10,['eworld2019'],[],https://twitter.com/WEC_Deutschland/status/1093213014231269376,False,,1,https://pbs.twimg.com/media/DyvfcEzXQAIQUFL.jpg,,,,,,,[],,,,
1092765919829544960,1092765919829544960,2019-02-05 18:14:32 IST,2019-02-05,18:14:32,+0530,1091287782650204160,solarwalburga,Walburga Hemetsberger,,I’m looking forward to attending the ‘Women Leading the Energy Transition’ event on 28 February and to celebrate the Women Energy Club (WEC) 20th anniversary 🙌 #CleanEnergyEU  https://t.co/XriAWNJYO6,en,[],[],['https://pbs.twimg.com/media/DypIVHMWkAAsleN.jpg'],0,0,8,['cleanenergyeu'],[],https://twitter.com/SolarWalburga/status/1092765919829544960,False,,1,https://pbs.twimg.com/media/DypIVHMWkAAsleN.jpg,,,,,,,[],,,,
1091280411081261058,1091280411081261058,2019-02-01 15:51:39 IST,2019-02-01,15:51:39,+0530,1583153580,cfe_wec,CFE,,"Jeunes de moins de 35 ans ayant plus de 3 ans d'expérience dans l'#énergie et un niveau avancé d'anglais, vous avez jusqu'au 24 février 2019 pour postuler. 🌍#FEL100 - shaping #energy #future",fr,[],[],[],0,4,7,"['énergie', 'fel100', 'energy', 'future']",[],https://twitter.com/CFE_wec/status/1091280411081261058,False,https://twitter.com/WECFELs/status/1087388227978309632,0,,,,,,,,[],,,,
1088673795026628608,1088673795026628608,2019-01-25 11:13:53 IST,2019-01-25,11:13:53,+0530,2989767256,wec_lebanon,WEC_Lebanon,,Save the Date for the World Energy Week 2020 in BEIRUT: 4 to 8 October 2020!!  https://t.co/pzJqKMOOUX,en,[],['https://www.facebook.com/story.php?story_fbid=992437517633781&id=309739289236944'],[],0,2,7,[],[],https://twitter.com/WEC_LEBANON/status/1088673795026628608,False,,0,,,,,,,,[],,,,
1088496561976459264,1088496561976459264,2019-01-24 23:29:38 IST,2019-01-24,23:29:38,+0530,408330663,pierreelkhoury2,Pierre El Khoury,,Live from the #London Office of @WECouncil: Initiation of the preprations of the 2020 Beirut Energy Week. Bridging the worlds of sustainable energy and conventional energy. @WEC_LEBANON #WEW2020Beirut  https://t.co/q8PSkGUYJl,en,"[{'screen_name': 'wecouncil', 'name': 'world energy council', 'id': '101695222'}, {'screen_name': 'wec_lebanon', 'name': 'wec_lebanon', 'id': '2989767256'}]",[],['https://pbs.twimg.com/media/Dxsd2PgXgAIVWXx.jpg'],0,4,13,"['london', 'wew2020beirut']",[],https://twitter.com/PierreElKhoury2/status/1088496561976459264,False,,1,https://pbs.twimg.com/media/Dxsd2PgXgAIVWXx.jpg,,,,,,,[],,,,
1086291178008395777,1086291178008395777,2019-01-18 21:26:13 IST,2019-01-18,21:26:13,+0530,1854991568,g_escribano,Gonzalo Escribano,,The summary of the 2018 @CECME_WEC Annual Meeting is already available at @rielcano : Energy futures: the Middle East and regional energy transitions cc @Enerclub @CharlesTPowell @lazarotouza @HaizamAmirah @marialazaro @Maria_SolanasC  https://t.co/lTU31zKqIn,en,"[{'screen_name': 'cecme_wec', 'name': 'cecme', 'id': '727853145154568192'}, {'screen_name': 'rielcano', 'name': 'real instituto elcano', 'id': '301336546'}, {'screen_name': 'enerclub', 'name': 'club español energía', 'id': '934781545'}, {'screen_name': 'charlestpowell', 'name': 'charles powell ma dphil cmg', 'id': '424472952'}, {'screen_name': 'lazarotouza', 'name': 'lara lázaro touza', 'id': '146445088'}, {'screen_name': 'haizamamirah', 'name': 'haizam amirah-fernández', 'id': '268853546'}, {'screen_name': 'marialazaro', 'name': 'maría lázaro ávila', 'id': '62364167'}, {'screen_name': 'maria_solanasc', 'name': 'maría solanas', 'id': '529575476'}]",['http://www.realinstitutoelcano.org/wps/portal/rielcano_es/actividad?WCM_GLOBAL_CONTEXT=/elcano/elcano_es/calendario/actividades/cecme-energy-futures-middle-east-regional-energy-transitions'],[],0,6,6,[],[],https://twitter.com/g_escribano/status/1086291178008395777,False,,0,,,,,,,,[],,,,
1085824166396227586,1085824166396227586,2019-01-17 14:30:29 IST,2019-01-17,14:30:29,+0530,101695222,wecouncil,World Energy Council,,"During #WorldEnergyWeek in Milan, hosted by @WEC_Italia, we spoke to top minds across the #Energy industry. Here’s a compilation of their thoughts regarding the #GrandEnergyTransition:  https://t.co/vZwdFm57Cm  #TBT",en,"[{'screen_name': 'wec_italia', 'name': 'wec italia', 'id': '1205388186'}]",['http://ow.ly/6IoP30niG2E'],[],0,3,7,"['worldenergyweek', 'energy', 'grandenergytransition', 'tbt']",[],https://twitter.com/WECouncil/status/1085824166396227586,False,,0,,,,,,,,[],,,,
1084460247631228928,1084460247631228928,2019-01-13 20:10:45 IST,2019-01-13,20:10:45,+0530,36376430,marcomargheri,marco margheri,,Congrats @flacamera ! A well deserved new responsibility in a key role to foster renewable energies in the grand energy transition. Break a leg! @WEC_Italia @WECouncil,en,"[{'screen_name': 'flacamera', 'name': 'francesco la camera', 'id': '21860097'}, {'screen_name': 'wec_italia', 'name': 'wec italia', 'id': '1205388186'}, {'screen_name': 'wecouncil', 'name': 'world energy council', 'id': '101695222'}]",[],[],0,7,23,[],[],https://twitter.com/marcomargheri/status/1084460247631228928,False,https://twitter.com/IRENA/status/1084455346851201024,0,,,,,,,,[],,,,
1080365868993970176,1080365868993970176,2019-01-02 13:01:10 IST,2019-01-02,13:01:10,+0530,1664424594,wec_deutschland,Weltenergierat,,Happy New Year 2019 - very early bird here in the Berlin office. We wish all our members and partners a successful and sustainable energy year ahead and looking forward to work with you!  https://t.co/JAxw6zgeHX,en,[],[],['https://pbs.twimg.com/media/Dv47BnPXcAAHOP1.jpg'],0,0,12,[],[],https://twitter.com/WEC_Deutschland/status/1080365868993970176,False,,1,https://pbs.twimg.com/media/Dv47BnPXcAAHOP1.jpg,,,,,,,[],,,,
1075645920509902848,1075645920509902848,2018-12-20 12:25:46 IST,2018-12-20,12:25:46,+0530,2989767256,wec_lebanon,WEC_Lebanon,,#FELL 18 will enable you to build a rich professional network and interact with senior energy leaders on a local and international level. The FELL-18 programme will also connect you to a global network of future energy leaders through interactions with @WECouncil #FEL100.,en,"[{'screen_name': 'wecouncil', 'name': 'world energy council', 'id': '101695222'}]",[],[],0,7,8,"['fell', 'fel100']",[],https://twitter.com/WEC_LEBANON/status/1075645920509902848,False,https://twitter.com/WEC_LEBANON/status/1075645287211913216,0,,,,,,,,[],,,,
1075645287211913216,1075645287211913216,2018-12-20 12:23:15 IST,2018-12-20,12:23:15,+0530,2989767256,wec_lebanon,WEC_Lebanon,,"Lebanon's FELL18 will be granted access to @WEC_Lebanon 's events, B2B meetings and training activities. They will also participate and shape the programme of the international Beirut Energy Forum.",en,"[{'screen_name': 'wec_lebanon', 'name': 'wec_lebanon', 'id': '2989767256'}]",[],[],0,3,7,[],[],https://twitter.com/WEC_LEBANON/status/1075645287211913216,False,https://twitter.com/WEC_LEBANON/status/1075645106580058112,0,,,,,,,,[],,,,
1075645106580058112,1075645106580058112,2018-12-20 12:22:32 IST,2018-12-20,12:22:32,+0530,2989767256,wec_lebanon,WEC_Lebanon,,"Young Lebanese energy professionnals  between 25 and 35 years old are eligible to apply to the 18 Future Energy Leaders of Lebanon programme. #FELL18 is based on the @WECouncil FEL-100 programme and is designed to inspire, grow and develop Lebanon's energy leaders of tomorrow.",en,"[{'screen_name': 'wecouncil', 'name': 'world energy council', 'id': '101695222'}]",[],[],8,6,6,['fell18'],[],https://twitter.com/WEC_LEBANON/status/1075645106580058112,False,https://twitter.com/WEC_LEBANON/status/1075644029675757570,0,,,,,,,,[],,,,
1075394891906195456,1075394891906195456,2018-12-19 19:48:16 IST,2018-12-19,19:48:16,+0530,4928063343,ac_istanbul,Atlantic Council IN TURKEY,,Thank you to all speakers and attendees at our Renewable Energy conference in cooperation with @WEC_Turkey. We look forward to continuing our focus on energy and renewables in Turkey #Renewables #ACTurkey  https://t.co/qpFhwPzJ1M,en,"[{'screen_name': 'wec_turkey', 'name': 'wec turkey', 'id': '857492344240820225'}]",[],['https://pbs.twimg.com/media/DuyRJf1WsAADrQE.jpg'],0,3,10,"['renewables', 'acturkey']",[],https://twitter.com/AC_Istanbul/status/1075394891906195456,False,,1,https://pbs.twimg.com/media/DuyRJf1WsAADrQE.jpg,,,,,,,[],,,,
1075311143097380864,1075311143097380864,2018-12-19 14:15:29 IST,2018-12-19,14:15:29,+0530,4928063343,ac_istanbul,Atlantic Council IN TURKEY,,"The second panel of our renewable energy conference, together with @WEC_Turkey, featuring @kivanczaimler, @REArnadottir, @DLatAC, @johnemorton and @AkshatRathi starts now  #Renewables #ACTurkey  https://t.co/wDWhd0D3KR",en,"[{'screen_name': 'wec_turkey', 'name': 'wec turkey', 'id': '857492344240820225'}, {'screen_name': 'kivanczaimler', 'name': 'kıvanç zaimler', 'id': '210581713'}, {'screen_name': 'rearnadottir', 'name': 'ragnheiður elín', 'id': '515537480'}, {'screen_name': 'johnemorton', 'name': 'john e. morton', 'id': '274254157'}, {'screen_name': 'akshatrathi', 'name': 'akshat rathi', 'id': '13766492'}]",[],['https://pbs.twimg.com/media/DuxFu2WWoAAOxFi.jpg'],0,2,8,"['renewables', 'acturkey']",[],https://twitter.com/AC_Istanbul/status/1075311143097380864,False,,1,https://pbs.twimg.com/media/DuxFu2WWoAAOxFi.jpg,,,,,,,[],,,,
1075285907270443008,1075285907270443008,2018-12-19 12:35:12 IST,2018-12-19,12:35:12,+0530,80786880,defnesadiklar,Defne Sadiklar,,Proud to be co-hosting renewable energy conference together with deputy Energy Minister and WEC Turkey Chairman Alparslan Bayraktar @AtlanticCouncil @AC_Istanbul @WEC_Turkey  https://t.co/HV1MaZaN2x,en,"[{'screen_name': 'atlanticcouncil', 'name': 'atlantic council', 'id': '18267548'}, {'screen_name': 'ac_istanbul', 'name': 'atlantic council in turkey', 'id': '4928063343'}, {'screen_name': 'wec_turkey', 'name': 'wec turkey', 'id': '857492344240820225'}]",[],['https://pbs.twimg.com/media/Duwu005XQAAnDxs.jpg'],0,1,11,[],[],https://twitter.com/defnesadiklar/status/1075285907270443008,False,,1,https://pbs.twimg.com/media/Duwu005XQAAnDxs.jpg,,,,,,,[],,,,
1075284401469251584,1075284401469251584,2018-12-19 12:29:13 IST,2018-12-19,12:29:13,+0530,4928063343,ac_istanbul,Atlantic Council IN TURKEY,,.@TCEnerji Deputy Minister and @WEC_Turkey Chairman Alparslan Bayraktar talks about the remarkable development of renewable energy in Turkey and the government's proactive policies #Renewables #ACTurkey  https://t.co/BaNI8IkxXE,en,"[{'screen_name': 'tcenerji', 'name': 'enerji ve tabii kaynaklar bakanlığı', 'id': '1953691460'}, {'screen_name': 'wec_turkey', 'name': 'wec turkey', 'id': '857492344240820225'}]",[],['https://pbs.twimg.com/media/DuwtdK6W4AE5ocw.jpg'],0,3,7,"['renewables', 'acturkey']",[],https://twitter.com/AC_Istanbul/status/1075284401469251584,False,,1,https://pbs.twimg.com/media/DuwtdK6W4AE5ocw.jpg,,,,,,,[],,,,
1075265504821035008,1075265504821035008,2018-12-19 11:14:08 IST,2018-12-19,11:14:08,+0530,4928063343,ac_istanbul,Atlantic Council IN TURKEY,,Looking forward to our conference this morning in cooperation with @WEC_Turkey on renewable energy in Turkey. Kick off in less than an hour! #Renewablea #ACTurkey  https://t.co/pT1kDDCoyF,en,"[{'screen_name': 'wec_turkey', 'name': 'wec turkey', 'id': '857492344240820225'}]",[],['https://pbs.twimg.com/media/DuwcQoSWoAAVM09.jpg'],0,2,6,"['renewablea', 'acturkey']",[],https://twitter.com/AC_Istanbul/status/1075265504821035008,False,,1,https://pbs.twimg.com/media/DuwcQoSWoAAVM09.jpg,,,,,,,[],,,,
1074356612930899974,1074356612930899974,2018-12-16 23:02:31 IST,2018-12-16,23:02:31,+0530,261787559,dr_emma_sheehan,Emma Sheehan,,We cannot wait for this 2nd WEC to be installed. It will be the first opportunity we have had to monitor an array of wave energy converters @PlymUni @DrMJWitt @DrTonyBicknell @Dr_Luke_Holmes @ExeterMarine,en,"[{'screen_name': 'plymuni', 'name': 'university of plymouth', 'id': '49733413'}, {'screen_name': 'drmjwitt', 'name': 'drmjwitt', 'id': '2603348840'}, {'screen_name': 'drtonybicknell', 'name': 'tony bicknell', 'id': '247211457'}, {'screen_name': 'dr_luke_holmes', 'name': 'luke holmes', 'id': '855544395126513667'}, {'screen_name': 'exetermarine', 'name': 'exetermarine', 'id': '950759411978555392'}]",[],[],0,9,12,[],[],https://twitter.com/Dr_Emma_Sheehan/status/1074356612930899974,False,https://twitter.com/EMEC_Ltd/status/1071004564860690432,0,,,,,,,,[],,,,
1073221969770897408,1073221969770897408,2018-12-13 19:53:51 IST,2018-12-13,19:53:51,+0530,18331009,oxleyjc,Jonathan Oxley,,Delight to share coffee-fuelled high energy discussion with one of our 90+ Member Committees at #COP24. #EnergyExcitement ahead with @WECongress in 2019 &amp; #WorldEnergyWeek in Lebanon 2020  @WEC_LEBANON @alachkarani  https://t.co/HsdI0ESoyo,en,"[{'screen_name': 'wecongress', 'name': '25th world energy congress', 'id': '712196274'}, {'screen_name': 'wec_lebanon', 'name': 'wec_lebanon', 'id': '2989767256'}, {'screen_name': 'alachkarani', 'name': 'rani al achkar', 'id': '33121524'}]",[],['https://pbs.twimg.com/media/DuTZqeYWwAENmYg.jpg'],1,2,14,"['cop24', 'energyexcitement', 'worldenergyweek']",[],https://twitter.com/oxleyjc/status/1073221969770897408,False,,1,https://pbs.twimg.com/media/DuTZqeYWwAENmYg.jpg,,,,,,,[],,,,
1072914706002862080,1072914706002862080,2018-12-12 23:32:54 IST,2018-12-12,23:32:54,+0530,2302374314,extechchallenge,ExtremeTechChallenge,,"Congrats to @arrecifesystems 🎉 Selected by @OWCLarry of #XTC2019 sponsor @OWC as winner of the Sustainability Vertical, these #cleantech innovators capture waves’ power + transform it into electricity through wave energy converter (WEC) technology.  https://t.co/Xv0anCJcSk  https://t.co/0URNrUZGUj",en,"[{'screen_name': 'arrecifesystems', 'name': 'arrecife systems', 'id': '752627052277293057'}, {'screen_name': 'owclarry', 'name': ""larry o'connor"", 'id': '376359921'}, {'screen_name': 'owc', 'name': 'おわこ', 'id': '2527788559'}]",['http://buff.ly/2EfSuwM'],['https://pbs.twimg.com/media/DuPCPL7WwAA3UIT.jpg'],0,5,8,"['xtc2019', 'cleantech']",[],https://twitter.com/ExTechChallenge/status/1072914706002862080,False,,1,https://pbs.twimg.com/media/DuPCPL7WwAA3UIT.jpg,,,,,,,[],,,,
1072859917193596933,1072859917193596933,2018-12-12 19:55:11 IST,2018-12-12,19:55:11,+0530,33121524,alachkarani,Rani Al Achkar,,Young professionals working in the energy sector in #Lebanon now have the chance to be selected among @WEC_LEBANON's 18 Future Energy Leaders of Lebanon  #FELL18. More information here:   https://t.co/VYqyHwaruM   #FEL100 @WECFELs @WECouncil,en,"[{'screen_name': 'wec_lebanon', 'name': 'wec_lebanon', 'id': '2989767256'}, {'screen_name': 'wecfels', 'name': 'future energy leaders', 'id': '1416049675'}, {'screen_name': 'wecouncil', 'name': 'world energy council', 'id': '101695222'}]",['http://Bit.ly/FELL-18'],[],0,7,18,"['lebanon', 'fell18', 'fel100']",[],https://twitter.com/alachkarani/status/1072859917193596933,False,,0,,,,,,,,[],,,,
1070571119969746944,1070571119969746944,2018-12-06 12:20:19 IST,2018-12-06,12:20:19,+0530,2989767256,wec_lebanon,WEC_Lebanon,,Save the Date: 4-9 October 2020!! Beirut was selected as the host of the “2020 World Energy Week” during the Executive Assembly meeting of the World Energy Council (WEC) in Milan last...  https://t.co/24K2BadCMz,en,[],['https://www.facebook.com/permalink.php?story_fbid=962016024009264&id=309739289236944'],[],0,3,11,[],[],https://twitter.com/WEC_LEBANON/status/1070571119969746944,False,,0,,,,,,,,[],,,,
1070371462756950016,1070371462756950016,2018-12-05 23:06:57 IST,2018-12-05,23:06:57,+0530,1003189333967458304,oornisanna,Sanna Öörni,,"#Slush18 side event ""How AI and blockchain will change the energy sector"". WEC showing the plausible scenarios for blockchains in energy. Brilliant presentation.  https://t.co/sbS0U5Vxoa",en,[],[],['https://pbs.twimg.com/media/Dtq5H7cXcAU__Wx.jpg'],0,1,11,['slush18'],[],https://twitter.com/OorniSanna/status/1070371462756950016,False,,1,https://pbs.twimg.com/media/Dtq5H7cXcAU__Wx.jpg,,,,,,,[],,,,
1069939380956119042,1069939380956119042,2018-12-04 18:30:01 IST,2018-12-04,18:30:01,+0530,798135729503305728,wellowaveenergy,Wello Wave Energy,,"Meet Wello’s Penguin WEC-2, soon to be producing energy from the  power of the ocean waves. @EMEC_Ltd  https://t.co/mhRCM7HzeQ",en,"[{'screen_name': 'emec_ltd', 'name': 'emec', 'id': '566245695'}]",[],['https://pbs.twimg.com/media/Dtktr9MWwAATr_N.jpg'],0,8,23,[],[],https://twitter.com/WelloWaveEnergy/status/1069939380956119042,False,,1,https://pbs.twimg.com/media/Dtktr9MWwAATr_N.jpg,,,,,,,[],,,,
