id,conversation_id,created_at,date,time,timezone,user_id,username,name,place,tweet,language,mentions,urls,photos,replies_count,retweets_count,likes_count,hashtags,cashtags,link,retweet,quote_url,video,thumbnail,near,geo,source,user_rt_id,user_rt,retweet_id,reply_to,retweet_date,translate,trans_src,trans_dest
1170357518285062144,1170357518285062144,2019-09-07 20:55:51 IST,2019-09-07,20:55:51,+0530,417179435,mamedlej,Michel-Ange Medlej,,The @WECouncil is a global impartial network of experts promoting the sustainable supply and use of #energy for the greatest benefit of all!  @WEC_LEBANON will be at the 24th @WECongress in #AbuDhabi look for us at the ADNEC Hall 9 from Sep 9 to 12  https://t.co/pe4lHoXTV9,en,"[{'screen_name': 'wecouncil', 'name': 'world energy council', 'id': '101695222'}, {'screen_name': 'wec_lebanon', 'name': 'wec_lebanon', 'id': '2989767256'}, {'screen_name': 'wecongress', 'name': '25th world energy congress', 'id': '712196274'}]",['https://www.linkedin.com/posts/mamedlej_energy-energy-energy4prosperity-activity-6576120229565349888-muaI'],[],0,3,7,"['energy', 'abudhabi']",[],https://twitter.com/MAMedlej/status/1170357518285062144,False,,0,,,,,,,,[],,,,
1170340216042708992,1170340216042708992,2019-09-07 19:47:06 IST,2019-09-07,19:47:06,+0530,694624552496689152,busnzenergy,BusNZ Energy Council,,"We’re @ the World Energy Council @WECouncil Asia Regional meeting in #AbuDhabi #wec24 It’s only a year ago when we last met with the WEC community &amp; so much has happened. There’s a new set of scenarios, new energy trilemma methodology, new tool “pulse” exploring new energy issues  https://t.co/TOiD5SUUwD",en,"[{'screen_name': 'wecouncil', 'name': 'world energy council', 'id': '101695222'}]",[],"['https://pbs.twimg.com/media/ED3iLZHUYAEGGlU.jpg', 'https://pbs.twimg.com/media/ED3iLZKU0AAtgNP.jpg', 'https://pbs.twimg.com/media/ED3iLZKU8AMdA6p.jpg']",0,3,12,"['abudhabi', 'wec24']",[],https://twitter.com/BusNZEnergy/status/1170340216042708992,False,,1,https://pbs.twimg.com/media/ED3iLZHUYAEGGlU.jpg,,,,,,,[],,,,
1170326129368031233,1170326129368031233,2019-09-07 18:51:07 IST,2019-09-07,18:51:07,+0530,1664424594,wec_deutschland,Weltenergierat,,"The current and the future leader of the World Energy Council discussing the importance of an energy vocabulary, an open dialogue and then determined action to make a difference in the #EnergyTransition. @WECouncil @WECongress  https://t.co/I1G8ahSzI0",en,"[{'screen_name': 'wecouncil', 'name': 'world energy council', 'id': '101695222'}, {'screen_name': 'wecongress', 'name': '25th world energy congress', 'id': '712196274'}]",[],"['https://pbs.twimg.com/media/ED3VZ3oXkAEdxas.jpg', 'https://pbs.twimg.com/media/ED3VZ3lWsAYjhDW.jpg']",0,2,11,['energytransition'],[],https://twitter.com/WEC_Deutschland/status/1170326129368031233,False,,1,https://pbs.twimg.com/media/ED3VZ3oXkAEdxas.jpg,,,,,,,[],,,,
1170240151269892096,1170240151269892096,2019-09-07 13:09:28 IST,2019-09-07,13:09:28,+0530,1664424594,wec_deutschland,Weltenergierat,,"What will the #Hydrogen share be in the energy system by 2040? Predictions range between 1% and 50%, says Angela Wilkinson @WECouncil @WECongress #Energy4Prosperity  https://t.co/R7sQueCXZZ",en,"[{'screen_name': 'wecouncil', 'name': 'world energy council', 'id': '101695222'}, {'screen_name': 'wecongress', 'name': '25th world energy congress', 'id': '712196274'}]",[],"['https://pbs.twimg.com/media/ED2HNM7XsAAjj5B.jpg', 'https://pbs.twimg.com/media/ED2HNM2XkAAgqNN.jpg']",0,8,18,"['hydrogen', 'energy4prosperity']",[],https://twitter.com/WEC_Deutschland/status/1170240151269892096,False,,1,https://pbs.twimg.com/media/ED2HNM7XsAAjj5B.jpg,,,,,,,[],,,,
1170236619619753984,1170236619619753984,2019-09-07 12:55:26 IST,2019-09-07,12:55:26,+0530,33490698,toaderpasti,Mihai Toader-Pasti,,"The World Energy Council Executive Assembly has just started: Trends, Innovation, Storage, Blockchain3.0 &amp; Climate and Renewables, Investments &amp; more.  #wec24 #wec #fel100 #futureenergyleaders @WECouncil @WECongress @WECFELs  https://t.co/9RpkuO0yS7",en,"[{'screen_name': 'wecouncil', 'name': 'world energy council', 'id': '101695222'}, {'screen_name': 'wecongress', 'name': '25th world energy congress', 'id': '712196274'}, {'screen_name': 'wecfels', 'name': 'future energy leaders', 'id': '1416049675'}]",[],['https://pbs.twimg.com/media/ED2D_paWsAA3SX_.jpg'],0,5,12,"['wec24', 'wec', 'fel100', 'futureenergyleaders']",[],https://twitter.com/toaderpasti/status/1170236619619753984,False,,1,https://pbs.twimg.com/media/ED2D_paWsAA3SX_.jpg,,,,,,,[],,,,
1169548591876247552,1169548591876247552,2019-09-05 15:21:28 IST,2019-09-05,15:21:28,+0530,2989767256,wec_lebanon,WEC_Lebanon,,Human Capital Task force of @WEC_LEBANON #FELL18 meet Jessica Obeid Academy Associate of @ChathamHouse and independant energy consultant to discuss retaining talent in Lebanons #energy sector #FELL18  https://t.co/9ju2MzD1hm,en,"[{'screen_name': 'wec_lebanon', 'name': 'wec_lebanon', 'id': '2989767256'}, {'screen_name': 'chathamhouse', 'name': 'chatham house', 'id': '38630618'}]",[],['https://pbs.twimg.com/media/EDsSOE9XoAAx8dV.jpg'],0,0,16,"['fell18', 'energy', 'fell18']",[],https://twitter.com/WEC_LEBANON/status/1169548591876247552,False,,1,https://pbs.twimg.com/media/EDsSOE9XoAAx8dV.jpg,,,,,,,[],,,,
1167329531855888384,1167329531855888384,2019-08-30 12:23:42 IST,2019-08-30,12:23:42,+0530,1330798628,omar_k_alkaaki,Omar Kaaki,,"On 5 October, 2020, energy professionals and leaders from around the world will gather in Beirut to discuss the whole energy spectrum! #WEW2020Beirut #FELL18 @WECouncil @WEC_LEBANON  https://t.co/bl6a2HqsF7",en,"[{'screen_name': 'wecouncil', 'name': 'world energy council', 'id': '101695222'}, {'screen_name': 'wec_lebanon', 'name': 'wec_lebanon', 'id': '2989767256'}]",[],['https://pbs.twimg.com/media/EDMwBQcXkAAQaWS.jpg'],0,1,14,"['wew2020beirut', 'fell18']",[],https://twitter.com/Omar_K_AlKaaki/status/1167329531855888384,False,,1,https://pbs.twimg.com/media/EDMwBQcXkAAQaWS.jpg,,,,,,,[],,,,
1167325238872297475,1167325238872297475,2019-08-30 12:06:39 IST,2019-08-30,12:06:39,+0530,2989767256,wec_lebanon,WEC_Lebanon,,The official logo of the Beirut World Energy Week 2020 is now made public. Save the date for an outstanding event. #WEW2020Beirut  https://t.co/KFj3Mp6pE3,en,[],[],['https://pbs.twimg.com/media/EDMsHU6VAAAqOex.jpg'],2,9,28,['wew2020beirut'],[],https://twitter.com/WEC_LEBANON/status/1167325238872297475,False,,1,https://pbs.twimg.com/media/EDMsHU6VAAAqOex.jpg,,,,,,,[],,,,
1166978838989025281,1166978838989025281,2019-08-29 13:10:11 IST,2019-08-29,13:10:11,+0530,2989767256,wec_lebanon,WEC_Lebanon,,"11 Days to the World Energy Congress. @PierreElKhoury2 , President of the Board &amp; General Manager @LCECtweets  - Secretary of WEC, will be moderating the session 5 ""Promise of Solar"" from 14:30 - 15:45 on day 2 of the Congress, Sept 10, 2019. @WECongress @WECouncil  https://t.co/urhhbc5q4T",en,"[{'screen_name': 'pierreelkhoury2', 'name': 'pierre el khoury', 'id': '408330663'}, {'screen_name': 'lcectweets', 'name': 'lcec', 'id': '459993237'}, {'screen_name': 'wecongress', 'name': '25th world energy congress', 'id': '712196274'}, {'screen_name': 'wecouncil', 'name': 'world energy council', 'id': '101695222'}]",[],['https://pbs.twimg.com/media/EDHxBBXWsAIoXqi.jpg'],0,9,18,[],[],https://twitter.com/WEC_LEBANON/status/1166978838989025281,False,,1,https://pbs.twimg.com/media/EDHxBBXWsAIoXqi.jpg,,,,,,,[],,,,
1166950813593481216,1166950813593481216,2019-08-29 11:18:49 IST,2019-08-29,11:18:49,+0530,1330798628,omar_k_alkaaki,Omar Kaaki,,It's called the largest energy event in the world for a reason!  #WEC2019 #WEC24 #Energy4Prosperity #FELL18 @WECouncil @WEC_LEBANON @WECongress @WECFELs  https://t.co/9XbW0NCW4Y,en,"[{'screen_name': 'wecouncil', 'name': 'world energy council', 'id': '101695222'}, {'screen_name': 'wec_lebanon', 'name': 'wec_lebanon', 'id': '2989767256'}, {'screen_name': 'wecongress', 'name': '25th world energy congress', 'id': '712196274'}, {'screen_name': 'wecfels', 'name': 'future energy leaders', 'id': '1416049675'}]",[],['https://pbs.twimg.com/media/EDHXcbpXYAANhPl.jpg'],0,1,6,"['wec2019', 'wec24', 'energy4prosperity', 'fell18']",[],https://twitter.com/Omar_K_AlKaaki/status/1166950813593481216,False,,1,https://pbs.twimg.com/media/EDHXcbpXYAANhPl.jpg,,,,,,,[],,,,
1166397500141576194,1166397500141576194,2019-08-27 22:40:09 IST,2019-08-27,22:40:09,+0530,700411569419771904,wec_chile,World Energy Council (WEC) Chile,,🙋‍♀️👏Integrantes del Women in Energy participan de jornada de auto reconocimiento. Este programa se configura como una red de apoyo entre jóvenes líderes que están cumpliendo un rol relevante en energía hoy. #YosoyWomenInEnergy #EnergiaParaTodos 👉 https://t.co/mZynSR3o9T  https://t.co/kZOBNlLqq7,es,[],['http://bit.ly/2UaHQgL'],['https://pbs.twimg.com/media/EC_gVlMWsAA769q.png'],1,6,14,"['yosoywomeninenergy', 'energiaparatodos']",[],https://twitter.com/WEC_Chile/status/1166397500141576194,False,,1,https://pbs.twimg.com/media/EC_gVlMWsAA769q.png,,,,,,,[],,,,
1165857671704133632,1165857671704133632,2019-08-26 10:55:04 IST,2019-08-26,10:55:04,+0530,2989767256,wec_lebanon,WEC_Lebanon,,"Join the FELL-18 session at #IBEF2019 ""Session 3A- in partnership with WEC's FELL-18:Energy Leaders of Tomorrow: Fueling the Lebanese Energy Sector with New Promising Horizons"" on September 25 from 6:00 to 7:30 pm.",en,[],[],[],0,4,7,['ibef2019'],[],https://twitter.com/WEC_LEBANON/status/1165857671704133632,False,,0,,,,,,,,[],,,,
1165556673097949184,1165556673097949184,2019-08-25 14:59:00 IST,2019-08-25,14:59:00,+0530,408330663,pierreelkhoury2,Pierre El Khoury,,"Somewhere inside, a 120-sqm #Lebanese Pavilion is being built. Visit us to know about #Beirut #World #Energy Week 2020 #Lebanon #AbuDhabi #abudhabi2019 #wew2020beirut #WEC",en,[],[],[],1,3,14,"['lebanese', 'beirut', 'world', 'energy', 'lebanon', 'abudhabi', 'abudhabi2019', 'wew2020beirut', 'wec']",[],https://twitter.com/PierreElKhoury2/status/1165556673097949184,False,https://twitter.com/rosesophie/status/1164824751275036672,0,,,,,,,,[],,,,
1164713075351724033,1164713075351724033,2019-08-23 07:06:51 IST,2019-08-23,07:06:51,+0530,508572201,louoliva24,LouOliva,,Somos Women in Energy. Mujeres secas y con ganas de cambiar el mundo! #somoswomeninenergy @WEC_Chile #energy #women #womeninenergy vamos por más!  https://t.co/kyNFrG1xSQ,es,"[{'screen_name': 'wec_chile', 'name': 'world energy council (wec) chile', 'id': '700411569419771904'}]",[],['https://pbs.twimg.com/media/ECnkXTWX4AA7Xaa.jpg'],2,3,13,"['somoswomeninenergy', 'energy', 'women', 'womeninenergy']",[],https://twitter.com/LouOliva24/status/1164713075351724033,False,,1,https://pbs.twimg.com/media/ECnkXTWX4AA7Xaa.jpg,,,,,,,[],,,,
1164692970769137666,1164692970769137666,2019-08-23 05:46:57 IST,2019-08-23,05:46:57,+0530,700411569419771904,wec_chile,World Energy Council (WEC) Chile,,Ahora en Women in Energy! ⚡🙋‍♀️Speed Dating #energiaparatodos  https://t.co/MM8CFbBsps,en,[],[],"['https://pbs.twimg.com/media/ECnSC6rXUAAdEAW.jpg', 'https://pbs.twimg.com/media/ECnSDWqXkAA86u8.jpg', 'https://pbs.twimg.com/media/ECnSEAJW4AAiJ5t.jpg']",0,5,18,['energiaparatodos'],[],https://twitter.com/WEC_Chile/status/1164692970769137666,False,,1,https://pbs.twimg.com/media/ECnSC6rXUAAdEAW.jpg,,,,,,,[],,,,
1164673367083016193,1164673367083016193,2019-08-23 04:29:03 IST,2019-08-23,04:29:03,+0530,801604880578265089,ibaceta_nancy,Nancy Ibaceta,,"Partimos programa Women in Energy, WEC- Deloitte.!!!! @WEC_Chile @DeloitteCL @jaldunate  https://t.co/GQ6iIOvMGq",es,"[{'screen_name': 'wec_chile', 'name': 'world energy council (wec) chile', 'id': '700411569419771904'}, {'screen_name': 'deloittecl', 'name': 'deloitte chile', 'id': '201834351'}, {'screen_name': 'jaldunate', 'name': 'javiera aldunate', 'id': '31018748'}]",[],['https://pbs.twimg.com/media/ECnAO-gXsAYfWK-.jpg'],0,3,11,[],[],https://twitter.com/ibaceta_nancy/status/1164673367083016193,False,,1,https://pbs.twimg.com/media/ECnAO-gXsAYfWK-.jpg,,,,,,,[],,,,
1163789387018231808,1163789387018231808,2019-08-20 17:56:26 IST,2019-08-20,17:56:26,+0530,1330798628,omar_k_alkaaki,Omar Kaaki,,I'll have the honor to be part of the Lebanon Pavilion at the 24th World Energy Congress in Abu Dhabi (between 9 and 12 September 2019).  Looking forward to attend the largest energy event in the world!  @WECouncil @WEC_LEBANON #WEC24 #WEC2019,en,"[{'screen_name': 'wecouncil', 'name': 'world energy council', 'id': '101695222'}, {'screen_name': 'wec_lebanon', 'name': 'wec_lebanon', 'id': '2989767256'}]",[],[],0,1,9,"['wec24', 'wec2019']",[],https://twitter.com/Omar_K_AlKaaki/status/1163789387018231808,False,https://twitter.com/LCECtweets/status/1163737863411982337,0,,,,,,,,[],,,,
1162281995935703040,1162281995935703040,2019-08-16 14:06:36 IST,2019-08-16,14:06:36,+0530,316983370,javieralfayate,📊Javier Alfayate Gallardo,,"Valores 🔝 que salen de mis listas Europa600, US500 y Nasdaq100. Ordenados por %percentil de mayor a menor: --- 🇺🇸 $AMT - American Tower 🇺🇸 $WM - Waste Mng 🇺🇸 $CINF - Cincinati Fin 🇺🇸 $WEC - Wisconsin Energy 🇺🇸 $LMT - Lockheed Martin ... 🇪🇺 $DG - Vinci 🇪🇺 $BN - Danone ---  https://t.co/mzDQnB0Vxm",in,[],[],"['https://pbs.twimg.com/media/ECFBTt-U0AAZyBw.png', 'https://pbs.twimg.com/media/ECFBTt_UcAA7fZu.png', 'https://pbs.twimg.com/media/ECFBTt8UwAQVdWV.png', 'https://pbs.twimg.com/media/ECFBTt9UwAAJmIr.png']",2,5,21,[],"['amt', 'wm', 'cinf', 'wec', 'lmt', 'dg', 'bn']",https://twitter.com/JavierAlfayate/status/1162281995935703040,False,,1,https://pbs.twimg.com/media/ECFBTt-U0AAZyBw.png,,,,,,,[],,,,
1161279780072972288,1161279780072972288,2019-08-13 19:44:09 IST,2019-08-13,19:44:09,+0530,1097483566605324288,davidracercoach,Dame Mas Hot TV,,El equipo @Energy_espteam está buscando pilotos para entrar en los campeonatos de @lecesports y @C_WEC  Si tienenes nivel y un comportamiento serio en pista  https://t.co/T37qyBKXJE,es,"[{'screen_name': 'lecesports', 'name': 'lec esports', 'id': '977835767828500481'}, {'screen_name': 'c_wec', 'name': 'cvi7weco', 'id': '1320250740171046913'}]",[],['https://pbs.twimg.com/media/EB2xzAUXYAAEJ-h.jpg'],0,7,10,[],[],https://twitter.com/DavidRacerCoach/status/1161279780072972288,False,,1,https://pbs.twimg.com/media/EB2xzAUXYAAEJ-h.jpg,,,,,,,[],,,,
1160873439089106944,1160873439089106944,2019-08-12 16:49:30 IST,2019-08-12,16:49:30,+0530,1097483566605324288,davidracercoach,Dame Mas Hot TV,,Se acerca la nueva temporada del campeonato @C_WEC y el equipo @Energy_espteam está buscando pilotos con cierto nivel y serios en pista.  Contesta a este twitt o manda un MD  https://t.co/5JgyvAK14F,es,"[{'screen_name': 'c_wec', 'name': 'cvi7weco', 'id': '1320250740171046913'}]",[],['https://pbs.twimg.com/media/EBxAO_fXUAAVCfy.jpg'],1,6,6,[],[],https://twitter.com/DavidRacerCoach/status/1160873439089106944,False,,1,https://pbs.twimg.com/media/EBxAO_fXUAAVCfy.jpg,,,,,,,[],,,,
1160829170026500096,1160829170026500096,2019-08-12 13:53:35 IST,2019-08-12,13:53:35,+0530,1664424594,wec_deutschland,Weltenergierat,,Lively discussions about Baltic Energy Markets and NECPs during the 6th Baltic Sea Roundtable in Riga with Einari Kisel @WECouncil Kudos to the Latvian WEC and @Latvenergo  https://t.co/xMPzabTfUD,en,"[{'screen_name': 'wecouncil', 'name': 'world energy council', 'id': '101695222'}, {'screen_name': 'latvenergo', 'name': 'latvenergo', 'id': '216285865'}]",[],"['https://pbs.twimg.com/media/EBwX-ZbXYAAK0YU.jpg', 'https://pbs.twimg.com/media/EBwX-ZUWsAAIixs.jpg']",0,4,8,[],[],https://twitter.com/WEC_Deutschland/status/1160829170026500096,False,,1,https://pbs.twimg.com/media/EBwX-ZbXYAAK0YU.jpg,,,,,,,[],,,,
1159576010968457216,1159576010968457216,2019-08-09 02:53:59 IST,2019-08-09,02:53:59,+0530,1097483566605324288,davidracercoach,Dame Mas Hot TV,,Se acerca la nueva temporada 19/20 y grandes campeonatos como @lecesports y @C_WEC  y nos gustaría estar.  El equipo @Energy_espteam esta buscando pilotos para GtSport y con la posibilidad de crear otra sección en Project Cars2 e iRacing.  Interesados MD  https://t.co/pAWecYM32C,es,"[{'screen_name': 'lecesports', 'name': 'lec esports', 'id': '977835767828500481'}, {'screen_name': 'c_wec', 'name': 'cvi7weco', 'id': '1320250740171046913'}]",[],['https://pbs.twimg.com/media/EBekO7gX4AA2K2r.jpg'],2,7,8,[],[],https://twitter.com/DavidRacerCoach/status/1159576010968457216,False,,1,https://pbs.twimg.com/media/EBekO7gX4AA2K2r.jpg,,,,,,,[],,,,
1159495034108088320,1159495034108088320,2019-08-08 21:32:13 IST,2019-08-08,21:32:13,+0530,1097483566605324288,davidracercoach,Dame Mas Hot TV,,"¿Alguien quiere competir en el @C_WEC? ¿No tienes equipo?  El equipo @Energy_espteam está buscando pilotos con nivel, serios y comprendidos.  Te esperamos, manda un MD y hablamos  https://t.co/qeKynap4DJ",es,"[{'screen_name': 'c_wec', 'name': 'cvi7weco', 'id': '1320250740171046913'}]",[],['https://pbs.twimg.com/media/EBdalnvXkAcwKZh.jpg'],0,7,9,[],[],https://twitter.com/DavidRacerCoach/status/1159495034108088320,False,,1,https://pbs.twimg.com/media/EBdalnvXkAcwKZh.jpg,,,,,,,[],,,,
1159472397071921153,1159472397071921153,2019-08-08 20:02:16 IST,2019-08-08,20:02:16,+0530,1093589854913552386,extractivesj,energy miner,,Fruitful day presenting to interns @LCECtweets from An Economic angle on the current status of the Lebanese #Energy Market.  This was part of our first deliverables of the Human Capital Task force  educating young and upcoming Future energy Leaders #Fell18 @WEC_LEBANON @CEPMLP  https://t.co/uyhIS24ChS,en,"[{'screen_name': 'lcectweets', 'name': 'lcec', 'id': '459993237'}, {'screen_name': 'wec_lebanon', 'name': 'wec_lebanon', 'id': '2989767256'}, {'screen_name': 'cepmlp', 'name': 'cepmlp', 'id': '75256789'}]",[],['https://pbs.twimg.com/media/EBdF_peXUAEoIeY.jpg'],1,2,10,"['energy', 'fell18']",[],https://twitter.com/ExtractivesJ/status/1159472397071921153,False,,1,https://pbs.twimg.com/media/EBdF_peXUAEoIeY.jpg,,,,,,,[],,,,
1159140747939127296,1159140747939127296,2019-08-07 22:04:24 IST,2019-08-07,22:04:24,+0530,2989767256,wec_lebanon,WEC_Lebanon,,"The Future Energy Leaders of Lebanon (FELL-18) with H.E Mrs. Nada Boustany Khoury, Minster of Energy and Water. Great projects on the way, join the FELL-18 session at IBEF2019 at 6:00 pm to know more about them!  https://t.co/SjRSDd4UnU",en,[],[],['https://pbs.twimg.com/media/EBYYWOdXUAE0gdb.jpg'],0,5,19,[],[],https://twitter.com/WEC_LEBANON/status/1159140747939127296,False,,1,https://pbs.twimg.com/media/EBYYWOdXUAE0gdb.jpg,,,,,,,[],,,,
1159108957425811456,1159108957425811456,2019-08-07 19:58:05 IST,2019-08-07,19:58:05,+0530,1093589854913552386,extractivesj,energy miner,,Today @WECouncil  @WEC_LEBANON @WECFELs  Future #Energy Leaders of #Lebanon met her excellency @NadaBoustani. We are very grateful for your  support of this initiative in co-ordination with @LCECtweets led by Mr.@PierreElKhoury2 and his team.  @CEPMLP @ExtractivesHub  https://t.co/BGEd9cMvQ0,en,"[{'screen_name': 'wecouncil', 'name': 'world energy council', 'id': '101695222'}, {'screen_name': 'wec_lebanon', 'name': 'wec_lebanon', 'id': '2989767256'}, {'screen_name': 'wecfels', 'name': 'future energy leaders', 'id': '1416049675'}, {'screen_name': 'nadaboustani', 'name': 'nada boustani khoury', 'id': '508827981'}, {'screen_name': 'lcectweets', 'name': 'lcec', 'id': '459993237'}, {'screen_name': 'pierreelkhoury2', 'name': 'pierre el khoury', 'id': '408330663'}, {'screen_name': 'cepmlp', 'name': 'cepmlp', 'id': '75256789'}, {'screen_name': 'extractiveshub', 'name': 'extractives hub', 'id': '4832526885'}]",[],['https://pbs.twimg.com/media/EBX7cl4W4AE5jVZ.jpg'],0,3,13,"['energy', 'lebanon']",[],https://twitter.com/ExtractivesJ/status/1159108957425811456,False,,1,https://pbs.twimg.com/media/EBX7cl4W4AE5jVZ.jpg,,,,,,,[],,,,
1158062626473201666,1158062626473201666,2019-08-04 22:40:20 IST,2019-08-04,22:40:20,+0530,977330038021423104,agn_chile,AGN Chile,,"Sobre transporte sustentable, energía, COP25 y más; se conversó con la ministra @GloriaHutt en el World Energy Cafe @AGN_Chile @ENGIEENERGIACL @ENGIEChile @WEC_Chile @MTTChile @ccortes72  https://t.co/sJTiT9wImw",es,"[{'screen_name': 'gloriahutt', 'name': 'gloria hutt hesse', 'id': '1410685676'}, {'screen_name': 'agn_chile', 'name': 'agn chile', 'id': '977330038021423104'}, {'screen_name': 'engiechile', 'name': 'engie chile', 'id': '1618068542'}, {'screen_name': 'wec_chile', 'name': 'world energy council (wec) chile', 'id': '700411569419771904'}, {'screen_name': 'mttchile', 'name': 'ministerio de transportes y telecomunicaciones', 'id': '599285257'}, {'screen_name': 'ccortes72', 'name': 'carlos cortés simon', 'id': '40354939'}]",[],"['https://pbs.twimg.com/media/EBJD0M7XsAEtr6T.jpg', 'https://pbs.twimg.com/media/EBJD0M7XoAEFIVd.jpg', 'https://pbs.twimg.com/media/EBJD0M9XsAQtI8h.jpg']",0,2,12,[],[],https://twitter.com/AGN_Chile/status/1158062626473201666,False,,1,https://pbs.twimg.com/media/EBJD0M7XsAEtr6T.jpg,,,,,,,[],,,,
1157380370620440577,1157380370620440577,2019-08-03 01:29:18 IST,2019-08-03,01:29:18,+0530,700411569419771904,wec_chile,World Energy Council (WEC) Chile,,"En nuestro World Energy Cafe 5 con la ministra @GloriaHutt conversamos sobre las metas que se ha propuesto el país en materia de energías renovables y electromovilidad, una de las herramientas claves para avanzar en la transición energética. @MTTChile @ENGIEChile @MinEnergia  https://t.co/0GPdbSyaHT",es,"[{'screen_name': 'gloriahutt', 'name': 'gloria hutt hesse', 'id': '1410685676'}, {'screen_name': 'mttchile', 'name': 'ministerio de transportes y telecomunicaciones', 'id': '599285257'}, {'screen_name': 'engiechile', 'name': 'engie chile', 'id': '1618068542'}, {'screen_name': 'minenergia', 'name': 'energía', 'id': '242876780'}]",[],"['https://pbs.twimg.com/media/EA_XS15X4AAL3o1.jpg', 'https://pbs.twimg.com/media/EA_XSyoXsAAsIWq.jpg', 'https://pbs.twimg.com/media/EA_XSt3WkAAmuUO.jpg', 'https://pbs.twimg.com/media/EA_XSpwXUAU6Xwb.jpg']",1,6,14,[],[],https://twitter.com/WEC_Chile/status/1157380370620440577,False,,1,https://pbs.twimg.com/media/EA_XS15X4AAL3o1.jpg,,,,,,,[],,,,
1154069553481244673,1154069553481244673,2019-07-24 22:13:17 IST,2019-07-24,22:13:17,+0530,443804285,tgr_wec,TOYOTA GAZOO Racing WEC,,"2⃣4⃣,0⃣0⃣9⃣MJ - the amount of energy recovered by our #TS050 HYBRIDs during the eight @FIAWEC races last season.... but how is that energy recuperated and used? 🤔  We hope this short video might provide you with some insight. ⚡️  #Toyota #Prologue2019 #PushingTheLimitsForBetter  https://t.co/Qql8WPcSfT",en,"[{'screen_name': 'fiawec', 'name': 'wec', 'id': '426488154'}]",[],[],2,41,232,"['ts050', 'toyota', 'prologue2019', 'pushingthelimitsforbetter']",[],https://twitter.com/TGR_WEC/status/1154069553481244673,False,,1,https://pbs.twimg.com/ext_tw_video_thumb/1154069444685115392/pu/img/s6sr6cWjzehTTg_w.jpg,,,,,,,[],,,,
1154065104993837056,1153812778659958785,2019-07-24 21:55:37 IST,2019-07-24,21:55:37,+0530,832477027512967168,crlp_ucsd,UCSD_CRLP,,"@angecensoplano @LasPalmasNSD1 @Betsyj25 @Erika25426977 @Jcoladatacto @crosbiesclass @AmericanReading @nsdleti Positive energy and attitude, all the time. We see you, #WeC_NSD!",en,[],[],[],0,0,7,['wec_nsd'],[],https://twitter.com/CRLP_UCSD/status/1154065104993837056,False,,0,,,,,,,,"[{'screen_name': 'angecensoplano', 'name': 'Angela Censoplano Holmes', 'id': '834453188405125120'}, {'screen_name': 'LasPalmasNSD1', 'name': '@LasPalmasNSD', 'id': '786638371888046080'}, {'screen_name': 'Betsyj25', 'name': 'Betsy', 'id': '977622070937792512'}, {'screen_name': 'Jcoladatacto', 'name': 'Jannette ColadaTacto', 'id': '860624824976130048'}, {'screen_name': 'crosbiesclass', 'name': 'Katie Crosbie, NBCT', 'id': '904817562936008704'}, {'screen_name': 'AmericanReading', 'name': 'American Reading', 'id': '101811617'}, {'screen_name': 'nsdleti', 'name': '@nsdleti', 'id': '1027905721017413632'}]",,,,
1153992964273782784,1153992964273782784,2019-07-24 17:08:57 IST,2019-07-24,17:08:57,+0530,443804285,tgr_wec,TOYOTA GAZOO Racing WEC,,"If you love a stat or two then you might just enjoy looking back at our key numbers from the 2018-19 @FIAWEC season. 🧮 🔢  From laps completed through to energy recovered, we've got it all wrapped up for you! 👩‍🎓👨‍🎓  #Toyota #TS050 #PushingTheLimitsForBetter #ToyotaGAZOORacing  https://t.co/SGnjGCthLx",en,"[{'screen_name': 'fiawec', 'name': 'wec', 'id': '426488154'}]",[],[],0,28,148,"['toyota', 'ts050', 'pushingthelimitsforbetter', 'toyotagazooracing']",[],https://twitter.com/TGR_WEC/status/1153992964273782784,False,,1,https://pbs.twimg.com/ext_tw_video_thumb/1153992694722637825/pu/img/K3IE3AKkNGZ9F6bH.jpg,,,,,,,[],,,,
1151803017617903617,1151803017617903617,2019-07-18 16:06:53 IST,2019-07-18,16:06:53,+0530,950759411978555392,exetermarine,ExeterMarine,,Last week saw the launch of new AMOG #Wave #Energy Converter (WEC). ERDF project w/ @marinei_feed &amp; @CollegeofEMPS develop an entirely new design of #waveenergy tech. Floating constuction at @Mainstay_Marine for trial @FabtestUK #Falmouth! 🤞  https://t.co/6bj3fW7C66 #Marinenergy  https://t.co/NvCQ1pyQDI,en,"[{'screen_name': 'marinei_feed', 'name': 'marine-i', 'id': '905423156684447744'}, {'screen_name': 'collegeofemps', 'name': 'uni of exeter cemps', 'id': '453251724'}, {'screen_name': 'mainstay_marine', 'name': 'mainstay marine', 'id': '936968630'}, {'screen_name': 'fabtestuk', 'name': 'fabtest', 'id': '2240556229'}]",['http://bit.ly/AMOGWEC'],"['https://pbs.twimg.com/media/D_wGvOhXsAAUrWh.jpg', 'https://pbs.twimg.com/media/D_wGvOYWsAEkH75.jpg']",1,6,7,"['wave', 'energy', 'waveenergy', 'falmouth', 'marinenergy']",[],https://twitter.com/ExeterMarine/status/1151803017617903617,False,,1,https://pbs.twimg.com/media/D_wGvOhXsAAUrWh.jpg,,,,,,,[],,,,
