id,conversation_id,created_at,date,time,timezone,user_id,username,name,place,tweet,language,mentions,urls,photos,replies_count,retweets_count,likes_count,hashtags,cashtags,link,retweet,quote_url,video,thumbnail,near,geo,source,user_rt_id,user_rt,retweet_id,reply_to,retweet_date,translate,trans_src,trans_dest
1113844487606771712,1113844487606771712,2019-04-04 22:13:14 IST,2019-04-04,22:13:14,+0530,172109039,calenergy,California Energy Commission,,"Through the #ARFVTP, #CalEnergy helped fund development of chassis &amp; drivetrain system in these electric United Parcel Service (@UPS)  vans, which produce zero tailpipe emissions. The Energy Commission also helped fund rollout of these vehicles. 🔌🚛⚡️",en,"[{'screen_name': 'ups', 'name': 'ups', 'id': '158129535'}]",[],[],1,9,31,"['arfvtp', 'calenergy']",[],https://twitter.com/CalEnergy/status/1113844487606771712,False,https://twitter.com/jimmyodea/status/1113181417565900800,0,,,,,,,,[],,,,
1110340260658069504,1109218497194872832,2019-03-26 06:08:41 IST,2019-03-26,06:08:41,+0530,201266886,ram910resound,佐藤頼夢 (Raimu Satoh) 🇩🇪🎹,,"あと少し違うけど、 躓いたり何かを落としたり、小さな失敗をした際に｢おっと!｣といった感覚で使われる｢ウプス!(英:Oops,独:Ups)｣、あれが反射的に口から出てしまうのをどうにかしたい。  運送会社のUPS(ユーピーエス/United Parcel Service)を｢ウプス｣だと思い込んでいた無垢な時代に戻りたい…",ja,[],[],[],4,2,48,[],[],https://twitter.com/ram910resound/status/1110340260658069504,False,,0,,,,,,,,[],,,,
1110054222475784192,1110054222475784192,2019-03-25 11:12:05 IST,2019-03-25,11:12:05,+0530,2960812293,strefa_lotow,Strefa lotów,,✈️ 👑 @UPSAirlines 🛫 United Parcel Service (#UPS) #Boeing 747-400F reg: N575UP 📌21.03.19 📍#EPWA ✈️ #avgeek #planespotting #springspotting #plane #foto #photo #aviation  https://t.co/6Ug5woXk1x,en,"[{'screen_name': 'upsairlines', 'name': 'ups airlines', 'id': '1465738201'}]",[],['https://pbs.twimg.com/media/D2e0bS4XQAE8zBF.jpg'],1,9,11,"['ups', 'boeing', 'epwa', 'avgeek', 'planespotting', 'springspotting', 'plane', 'foto', 'photo', 'aviation']",[],https://twitter.com/Strefa_lotow/status/1110054222475784192,False,,1,https://pbs.twimg.com/media/D2e0bS4XQAE8zBF.jpg,,,,,,,[],,,,
1107059580259827717,1107059580259827717,2019-03-17 04:52:26 IST,2019-03-17,04:52:26,+0530,2432851891,khajuraho_one,Capelito,,2019.3.15 at ANC United Parcel Service(UPS)  Boeing B747-8F(N608UP) 季節限定、除雪された雪山に登ることでフェンスの映り込みを心配せず撮影できます。ANCは日常「またジャンボかよ」  https://t.co/GJQDHbnReh,ja,[],[],['https://pbs.twimg.com/media/D10QznRUgAEf8-b.jpg'],0,2,24,[],[],https://twitter.com/Khajuraho_one/status/1107059580259827717,False,,1,https://pbs.twimg.com/media/D10QznRUgAEf8-b.jpg,,,,,,,[],,,,
1105959088796643330,1105959088796643330,2019-03-14 03:59:29 IST,2019-03-14,03:59:29,+0530,22581994,lexlanham,alexandra j. roberts,,UPS (united parcel service) won a preliminary injunction against UPS 420 (united pot smokers) over the latter's use of confusingly similar trademarks &amp; domain names. likelihood of bridging the gap? 🤔🍀  https://t.co/7GPmHmd8qi,en,[],['https://www.worldipreview.com/news/ups-on-a-high-after-court-issues-injunction-against-united-pot-smokers-17633'],[],3,6,9,[],[],https://twitter.com/lexlanham/status/1105959088796643330,False,,0,,,,,,,,[],,,,
1102464015270363136,1102464015270363136,2019-03-04 12:31:18 IST,2019-03-04,12:31:18,+0530,39559926,airliners_net,Airliners.net,,A United Parcel Service - UPS Boeing 747-8F returning to Everett Photo by Royal S King  https://t.co/BdAXFLyAiX,en,[],['https://www.airliners.net/photo/United-Parcel-Service-UPS/Boeing-747-8F/5432351?qsp=eJwtjDsOwkAMRO/imiaKRJEOcgAouIC1HsFKIbuyzWcV5e5YK7o3b0azUSqr4%2Bu3VkETGVjTgw5UWflpNG0k7DilhOqQWAxRWlE/twjvjM9cXqv/5UUFGl5gqZ/c43QIgF4703gML9nqwq0PnfNC%2B/4DbZ0tGA%3D%3D'],[],0,10,89,[],[],https://twitter.com/airliners_net/status/1102464015270363136,False,,0,,,,,,,,[],,,,
1098266507128303616,1098266507128303616,2019-02-20 22:31:54 IST,2019-02-20,22:31:54,+0530,9300262,politico,POLITICO,,"""We're doing everything we can at the U.S. government level to support all the pathways that exist for people to experience the American dream [and] maintain a family sustaining job,"" Ivanka Trump said at a United Parcel Service (UPS) facility alongside Georgia Gov. Brian Kemp  https://t.co/CEeJTyYeET",en,[],[],[],1290,468,2315,[],[],https://twitter.com/politico/status/1098266507128303616,False,,1,https://pbs.twimg.com/amplify_video_thumb/1098264690751389698/img/SbP2t5WxszqfR83T.jpg,,,,,,,[],,,,
1097832219312312320,1097832219312312320,2019-02-19 17:46:12 IST,2019-02-19,17:46:12,+0530,317768634,worldipreview,World IP Review,,"UPS sues operators of ‘United Pot Smokers’ for TM infringement.  United Parcel Service is suing the operators of a self-described ‘non-profit’ medical #marijuana collective, “United Pot Smokers”, for infringing its trademarks.  https://t.co/p1azqGORiS @UPS #trademark #UPS",en,"[{'screen_name': 'ups', 'name': 'ups', 'id': '158129535'}]",['https://www.worldipreview.com/news/ups-sues-operators-of-united-pot-smokers-for-tm-infringement-17527'],[],0,3,6,"['marijuana', 'trademark', 'ups']",[],https://twitter.com/WorldIPReview/status/1097832219312312320,False,,0,,,,,,,,[],,,,
1096137023214080000,1096137023214080000,2019-02-15 01:30:06 IST,2019-02-15,01:30:06,+0530,158129535,ups,UPS,,"#DidYouKnow on February 14, 1919, the name United Parcel Service (UPS) was made official? Prior to, we were known by the name of ""Merchants Parcel Delivery"" until our company expanded from Seattle to Oakland. 📦😍  https://t.co/yGMXgnLslz",en,[],[],['https://pbs.twimg.com/media/DzZC0E9UYAA1oZE.jpg'],7,30,96,['didyouknow'],[],https://twitter.com/UPS/status/1096137023214080000,False,,1,https://pbs.twimg.com/media/DzZC0E9UYAA1oZE.jpg,,,,,,,[],,,,
1095306575554797568,1095306575554797568,2019-02-12 18:30:12 IST,2019-02-12,18:30:12,+0530,39559926,airliners_net,Airliners.net,,A United Parcel Service - UPS Boeing 757-24APF at Katowice Photo by Jacek Szafranek  https://t.co/9zJTidOD8f,pl,[],['https://www.airliners.net/photo/United-Parcel-Service-UPS/Boeing-757-24APF/5390011?qsp=eJwtjDsOwkAMRO/imiaKRJEOcgAouIC1HsFKIbuyzWcV5e5YK7o3b0azUSqr4%2Bu3VkETGVjTgw5UWflpNG0k7DilhOqQWAxRWlE/twjvjM9cXqv/5UUFGl5gqZ/c43QIgF4703gML9nqwq0PnfNC%2B/4DbZ0tGA%3D%3D'],[],0,11,71,[],[],https://twitter.com/airliners_net/status/1095306575554797568,False,,0,,,,,,,,[],,,,
1090373699872665602,1090373699872665602,2019-01-30 03:48:42 IST,2019-01-30,03:48:42,+0530,172109039,calenergy,California Energy Commission,,TOMORROW: Check out a zero-emission United Parcel Service (@UPS) #FuelCell hybrid electric van powered by #Hydrogen &amp; funded by the #ARFVTP in front of the #CalEnergy building at 1516 9th St. from 10 AM – 3 PM. 🔌🚛⚡️  https://t.co/k2w3LpHiOh,en,"[{'screen_name': 'ups', 'name': 'ups', 'id': '158129535'}]",[],"['https://pbs.twimg.com/media/DyHJGd1WoAAf64i.jpg', 'https://pbs.twimg.com/media/DyHJGeWW0AAhbhs.jpg']",1,4,11,"['fuelcell', 'hydrogen', 'arfvtp', 'calenergy']",[],https://twitter.com/CalEnergy/status/1090373699872665602,False,,1,https://pbs.twimg.com/media/DyHJGd1WoAAf64i.jpg,,,,,,,[],,,,
1090312208322580483,1090312208322580483,2019-01-29 23:44:22 IST,2019-01-29,23:44:22,+0530,2757568734,peter_horses,peter horses,,"ups bringing me some pants today....united parcel service? more like.....Ur pants, sir",en,[],[],[],0,1,23,[],[],https://twitter.com/peter_horses/status/1090312208322580483,False,,0,,,,,,,,[],,,,
1084873108107022337,1084873108107022337,2019-01-14 23:31:19 IST,2019-01-14,23:31:19,+0530,487118986,xhnews,China Xinhua News,,"Police responded Monday to an active shooting at a United Parcel Service (UPS) facility in Logan Township, U.S. state of New Jersey  https://t.co/qlzFQzbUtt",en,[],[],[],1,19,46,[],[],https://twitter.com/XHNews/status/1084873108107022337,False,,1,https://pbs.twimg.com/ext_tw_video_thumb/1084873042294120448/pu/img/Rv_e5J9dMm1HcQbe.jpg,,,,,,,[],,,,
1073107126271172608,1073107126271172608,2018-12-13 12:17:30 IST,2018-12-13,12:17:30,+0530,88483934,bisikhujan,Bisik Hujan,,United Parcel Service @UPSAirlines @UPS  Boeing 757-24A(PF) @BoeingAirplanes N454UP KUL/WMKK @MY_Airports  https://t.co/uIWpDtfc1O,en,"[{'screen_name': 'upsairlines', 'name': 'ups airlines', 'id': '1465738201'}, {'screen_name': 'ups', 'name': 'ups', 'id': '158129535'}, {'screen_name': 'boeingairplanes', 'name': 'boeing airplanes', 'id': '22090282'}, {'screen_name': 'my_airports', 'name': 'malaysia airports', 'id': '386353991'}]",[],['https://pbs.twimg.com/media/DuRxPW2U0AEtmJa.jpg'],0,2,15,[],[],https://twitter.com/BisikHujan/status/1073107126271172608,False,,1,https://pbs.twimg.com/media/DuRxPW2U0AEtmJa.jpg,,,,,,,[],,,,
1062747768454832128,1062747768454832128,2018-11-14 22:13:07 IST,2018-11-14,22:13:07,+0530,894741613624348672,ps66uk,ps66uk,,#emotet emails with UPS United Parcel Service theme contain URLs to DOCs  https://t.co/ivgLDUBS9c,en,[],[],['https://pbs.twimg.com/media/Dr-jbrdWkAA_ewM.jpg'],0,6,14,['emotet'],[],https://twitter.com/ps66uk/status/1062747768454832128,False,,1,https://pbs.twimg.com/media/Dr-jbrdWkAA_ewM.jpg,,,,,,,[],,,,
1061561559007166464,1061561559007166464,2018-11-11 15:39:33 IST,2018-11-11,15:39:33,+0530,436772896,134154204,Nobby,,N521UP B747-212B(SF) United Parcel Service at NRT.  UPSのOlympicジャンボフレーター この頃の画像見ると、ゲジの背景がクリアーでスッキリしてて成田でない印象  https://t.co/FZL7BKmsYI,ja,[],[],['https://pbs.twimg.com/media/DrtsmQDVsAARplL.jpg'],0,6,98,[],[],https://twitter.com/134154204/status/1061561559007166464,False,,1,https://pbs.twimg.com/media/DrtsmQDVsAARplL.jpg,,,,,,,[],,,,
1058297547394048000,1058297547394048000,2018-11-02 15:29:32 IST,2018-11-02,15:29:32,+0530,796356542085922816,holzmachtsachen,Holz macht Sachen!,,"Jippieee!!! 😀 UPS – UNITED PARCEL SERVICE DEUTSCHLAND ist Sponsor der Wanderausstellung ""Holz macht Sachen! Holz, Baum, Wald und Du?"" und hilft uns im Bereich Transport. 🙃 #holzmachtsachen  https://t.co/hq0FnGgKva Vielen Dank: @UPS_DE @UPSHilfe_DE @ups 🥰 🌲🌳  https://t.co/IrHlIJBdQ0",de,"[{'screen_name': 'ups_de', 'name': 'ups_de', 'id': '2615974958'}, {'screen_name': 'upshilfe_de', 'name': 'ups hilfe', 'id': '2601366246'}, {'screen_name': 'ups', 'name': 'ups', 'id': '158129535'}]",['http://www.holzmachtsachen.de'],['https://pbs.twimg.com/media/Dq_RjgKX0AA8RCq.jpg'],1,3,7,['holzmachtsachen'],[],https://twitter.com/HolzmachtSachen/status/1058297547394048000,False,,1,https://pbs.twimg.com/media/Dq_RjgKX0AA8RCq.jpg,,,,,,,[],,,,
1057838996078972928,1057838996078972928,2018-11-01 09:07:25 IST,2018-11-01,09:07:25,+0530,2191264657,firefoxofficial,anna (from the vault),,I just read the phrase “ups and downs” and for a solid 30 seconds kept rereading it as UPS. As in the United Parcel Service. It’s time for bed.,en,[],[],[],0,0,8,[],[],https://twitter.com/FireFoxOfficial/status/1057838996078972928,False,,0,,,,,,,,[],,,,
1047282591731257344,1047282591731257344,2018-10-03 06:00:02 IST,2018-10-03,06:00:02,+0530,14857413,wdbj7,WDBJ7,,Hundreds of guns that were stolen from a United Parcel Service (UPS) distribution facility in Tennessee were recovered Tuesday in the Chicago area.  https://t.co/CNKIbN1SAX,en,[],['https://bit.ly/2OtBjgK'],[],1,7,14,[],[],https://twitter.com/WDBJ7/status/1047282591731257344,False,,0,,,,,,,,[],,,,
1047048841051160576,1047048841051160576,2018-10-02 14:31:11 IST,2018-10-02,14:31:11,+0530,1019140951695085568,1mefadia,mefadia,,"If you work or  know anyone working for UPS (united parcel service)  in Lagos Nigeria ,  please and please contact me asap. Rts would be appropriated as well.   Thanks.",en,[],[],[],0,2,13,[],[],https://twitter.com/1Mefadia/status/1047048841051160576,False,,0,,,,,,,,[],,,,
1044891992289931264,1044891992289931264,2018-09-26 15:40:38 IST,2018-09-26,15:40:38,+0530,15459340,dotweekly,Jamie Zoch,,"United Parcel Service of America, Inc. (UPS) has sold the #domain name Fritz(.)com to an unknown buyer. @MarksmenTweets assisted that buyer in the purchase. #asset",en,"[{'screen_name': 'marksmentweets', 'name': 'marksmen', 'id': '260854254'}]",[],[],3,5,12,"['domain', 'asset']",[],https://twitter.com/DotWeekly/status/1044891992289931264,False,,0,,,,,,,,[],,,,
1040841724900175872,1040841724900175872,2018-09-15 11:26:19 IST,2018-09-15,11:26:19,+0530,2792282230,cucetom,Tom Cuce,,"United Parcel Service, Inc. (NYSE: UPS) opens today’s market  https://t.co/SWKJK2D1co  https://t.co/WcQaFUq3se",en,[],['http://bit.ly/2NQnzfS'],['https://pbs.twimg.com/media/DnHQB-8V4AA6RLk.jpg'],0,1,14,[],[],https://twitter.com/CuceTom/status/1040841724900175872,False,,1,https://pbs.twimg.com/media/DnHQB-8V4AA6RLk.jpg,,,,,,,[],,,,
1040772897675997184,1040772897675997184,2018-09-15 06:52:50 IST,2018-09-15,06:52:50,+0530,819589294956363776,hill_deryl,Deryl Hill,,"United Parcel Service, Inc. (NYSE: UPS) opens today’s market  https://t.co/e7cZpGqrYW  https://t.co/cHqdUPzqYb",en,[],['http://bit.ly/2xlAGuY'],['https://pbs.twimg.com/media/DnGRbwqVsAAv-zs.jpg'],0,2,17,[],[],https://twitter.com/hill_deryl/status/1040772897675997184,False,,1,https://pbs.twimg.com/media/DnGRbwqVsAAv-zs.jpg,,,,,,,[],,,,
1040676024432898048,1040676024432898048,2018-09-15 00:27:53 IST,2018-09-15,00:27:53,+0530,21323268,nyse,NYSE 🏛,,"United Parcel Service was founded as American Messenger Service in 1907, &amp; adopted the name @UPS in 1919. The company acquired its 1st delivery car (a Ford Motel T) in 1913, &amp; in 1924 introduced the 1st package handling conveyor belt system. CEO David Abney opened today's market  https://t.co/JbjvQGK5oa",en,"[{'screen_name': 'ups', 'name': 'ups', 'id': '158129535'}]",[],"['https://pbs.twimg.com/media/DnE5EahXcAI_5QF.jpg', 'https://pbs.twimg.com/media/DnE5EavX4AUS-tU.jpg', 'https://pbs.twimg.com/media/DnE5EbVXsAE-J4l.jpg']",6,61,179,[],[],https://twitter.com/NYSE/status/1040676024432898048,False,,1,https://pbs.twimg.com/media/DnE5EahXcAI_5QF.jpg,,,,,,,[],,,,
1038532943856070656,1038532943856070656,2018-09-09 02:32:03 IST,2018-09-09,02:32:03,+0530,514828179,aeroimageschris,Woodys Aeroimages,,.@UPSAirlines @BoeingAirplanes 747-400F arriving at Boeing Field last week.  N581UP United Parcel Service (UPS) Boeing 747-4R7F - C/N 25866 / LN 1002  https://t.co/DsU1ngnV0D,en,"[{'screen_name': 'upsairlines', 'name': 'ups airlines', 'id': '1465738201'}, {'screen_name': 'boeingairplanes', 'name': 'boeing airplanes', 'id': '22090282'}]",[],['https://pbs.twimg.com/media/Dmmb8P2UwAAjJih.jpg'],0,8,52,[],[],https://twitter.com/AeroimagesChris/status/1038532943856070656,False,,1,https://pbs.twimg.com/media/Dmmb8P2UwAAjJih.jpg,,,,,,,[],,,,
1035958030490365952,1035958030490365952,2018-09-02 00:00:16 IST,2018-09-02,00:00:16,+0530,23628802,atlbizchron,AtlBizChron,,United Parcel Service Inc. (NYSE: UPS) has launched a strong partnership to hire community residents for its new UPS SMART hub facility on Fulton Industrial Boulevard.  https://t.co/7ZlZ75tdN7,en,[],['http://bit.ly/2orYGbI'],[],0,3,6,[],[],https://twitter.com/AtlBizChron/status/1035958030490365952,False,,0,,,,,,,,[],,,,
1035674848884711425,1035666377904979968,2018-09-01 05:15:00 IST,2018-09-01,05:15:00,+0530,30070631,theraw420,"🎩 Dr. Squat, Dr. Jack Squat ➡️",,"@IngrahamAngle Thats right. I went from a $120,000a year job at United Parcel Service. After UPS/Liberty Mutual violated ADA's laws I lost my career, a million dollar pension and retirement. Retirement date was 09/05/2015. I work construction + started a new business  https://t.co/MjBPQfVcQd",en,[],['http://www.worldrockumentary.com'],[],0,2,19,[],[],https://twitter.com/TheRaw420/status/1035674848884711425,False,,0,,,,,,,,"[{'screen_name': 'IngrahamAngle', 'name': 'Laura Ingraham', 'id': '50769180'}]",,,,
1033436329416245248,1033436329416245248,2018-08-26 00:59:55 IST,2018-08-26,00:59:55,+0530,906712015,smithchris2020,Chris Smith,,"I was today years old when I found out that UPS stands for United Parcel Service, not United Postal Service.  https://t.co/nuIrao0znN",en,[],[],['https://pbs.twimg.com/media/DleA2wPU0AEYkJl.jpg'],2,2,11,[],[],https://twitter.com/smithchris2020/status/1033436329416245248,False,,1,https://pbs.twimg.com/media/DleA2wPU0AEYkJl.jpg,,,,,,,[],,,,
1031979973949763584,1031979973949763584,2018-08-22 00:32:53 IST,2018-08-22,00:32:53,+0530,1249351784,soy4ldo,ALDO ✈️,,Compañía aérea: United Parcel Service UPS  Aeronave: Boeing B767-34AFER(WL) Matrícula: N308UP Edad: 22.0 años Ubicación: Ciudad de México (MEX/MMMX)  https://t.co/QVk4Zb5DY5,es,[],[],['https://pbs.twimg.com/media/DlJUTavVAAAEw_Q.jpg'],0,3,27,[],[],https://twitter.com/Soy4ldo/status/1031979973949763584,False,,1,https://pbs.twimg.com/media/DlJUTavVAAAEw_Q.jpg,,,,,,,[],,,,
1029411474924548097,1029411474924548097,2018-08-14 22:26:35 IST,2018-08-14,22:26:35,+0530,2428265632,bethhillman99,Beth Hillman,,I was today years old when learned......UPS stands for United Parcel Service!   My whole life has been a lie; I thought it was United Postal Service......thats the USPS (United States Postal Service)  Idk why but this shook me more than it should've,en,[],[],[],1,0,8,[],[],https://twitter.com/Bethhillman99/status/1029411474924548097,False,,0,,,,,,,,[],,,,
1022113591187701761,1022113591187701761,2018-07-25 19:07:24 IST,2018-07-25,19:07:24,+0530,913260122004086784,kessanman,米国株 決算マン,,UPS決算 United Parcel Service (NYSE:UPS) Q2 EPS $1.94 予想 +$0.01 売上 $17.46B (+9.6% Y/Y) 予想 +$130M  株価は+2.3%の反応  世界最大級の物流・運送会社。  https://t.co/BRN9yYw3mt  https://t.co/oJEOVhWEkB  https://t.co/iJMU7dWNlU,ja,[],"['https://www.americabu.com/ups', 'http://www.investors.ups.com/news-releases/news-release-details/ups-2q18-revenue-96-strong-growth-and-pricing']",['https://pbs.twimg.com/media/Di9Fie9XoAcF0ip.jpg'],0,7,13,[],[],https://twitter.com/KessanMan/status/1022113591187701761,False,,1,https://pbs.twimg.com/media/Di9Fie9XoAcF0ip.jpg,,,,,,,[],,,,
1020211517004775424,1020029577727479808,2018-07-20 13:09:14 IST,2018-07-20,13:09:14,+0530,402483883,helenarmstrong5,Helen Armstrong,,"@owillis @AIAspeaks @AHLA @TRUCKINGdotORG @ABCNational @AGCofA @FedEx @foxconncon @GM @HomeDepot @IBM @InternetAssn @LockheedMartin @Microsoft @NAHBhome @WeRRestaurants @NRFnews @northropgrumman @BldgTrdsUnions @Raytheon 7.  Here's the companies having to do a praise Trump perp walk, the CEOs, &amp; Twitter handles RETWEET  Society for Human Resource Management  Henry G. Jackson @SHRM  Signatory Wall and Ceiling Contractors Alliance Matt Townsen @AWCI_INFO  United Parcel Service David P. Abney @UPS",en,"[{'screen_name': 'shrm', 'name': 'shrm', 'id': '14818045'}, {'screen_name': 'awci_info', 'name': 'awci', 'id': '321411855'}, {'screen_name': 'ups', 'name': 'ups', 'id': '158129535'}]",[],[],1,16,4,[],[],https://twitter.com/HelenArmstrong5/status/1020211517004775424,False,,0,,,,,,,,"[{'screen_name': 'owillis', 'name': 'Oliver Willis', 'id': '3497941'}, {'screen_name': 'AIAspeaks', 'name': 'Aerospace Industries', 'id': '71070614'}, {'screen_name': 'AHLA', 'name': 'AHLA', 'id': '15298502'}, {'screen_name': 'TRUCKINGdotORG', 'name': 'American Trucking', 'id': '20626879'}, {'screen_name': 'ABCNational', 'name': 'ABC National', 'id': '52060506'}, {'screen_name': 'AGCofA', 'name': 'AGC of America', 'id': '43958971'}, {'screen_name': 'FedEx', 'name': 'FedEx', 'id': '134887156'}, {'screen_name': 'foxconncon', 'name': 'FoxConnCon', 'id': '910705628007542784'}, {'screen_name': 'GM', 'name': 'General Motors', 'id': '10850192'}, {'screen_name': 'HomeDepot', 'name': 'The Home Depot', 'id': '14791918'}, {'screen_name': 'IBM', 'name': 'IBM', 'id': '18994444'}, {'screen_name': 'InternetAssn', 'name': 'Internet Association', 'id': '633924423'}, {'screen_name': 'LockheedMartin', 'name': 'Lockheed Martin', 'id': '42871498'}, {'screen_name': 'Microsoft', 'name': 'Microsoft', 'id': '74286565'}, {'screen_name': 'NAHBhome', 'name': 'NAHB', 'id': '73453532'}, {'screen_name': 'WeRRestaurants', 'name': 'National Restaurant Association', 'id': '15562948'}, {'screen_name': 'NRFnews', 'name': 'National Retail Federation', 'id': '63787812'}, {'screen_name': 'northropgrumman', 'name': 'Northrop Grumman', 'id': '15840909'}, {'screen_name': 'Raytheon', 'name': 'Raytheon', 'id': '1250829380059893760'}]",,,,
1017780762354110464,1017734547440590848,2018-07-13 20:10:17 IST,2018-07-13,20:10:17,+0530,23498919,lauzin,Eric Lauzin,,"I feel like this should be stated again. Sarah Palin asked if he was in the service and Cohen replied ""Yeah the Parcel"" The United Parcel Service... UPS. That's what fooled Sarah Palin",en,[],[],[],1,2,5,[],[],https://twitter.com/Lauzin/status/1017780762354110464,False,,0,,,,,,,,[],,,,
1017669004834422784,1017468494936305664,2018-07-13 12:46:12 IST,2018-07-13,12:46:12,+0530,27841547,supachicnic,ⓝⓘⓒⓚⓘ,,@sunbejus @BillyWRuddick @SarahPalinUSA @SachaBaronCohen @UPS Well he did say that he was in the Service... United Parcel Service 😂📦👍🏻,en,[],[],[],0,2,12,[],[],https://twitter.com/supachicnic/status/1017669004834422784,False,,0,,,,,,,,"[{'screen_name': 'sunbejus', 'name': ""Bea O'Connor"", 'id': '2841040641'}, {'screen_name': 'BillyWRuddick', 'name': 'Billy Wayne Ruddick Jr., PhD', 'id': '986347466965618694'}, {'screen_name': 'SarahPalinUSA', 'name': 'Sarah Palin', 'id': '65493023'}, {'screen_name': 'SachaBaronCohen', 'name': 'Sacha Baron Cohen', 'id': '4185877812'}, {'screen_name': 'UPS', 'name': 'UPS', 'id': '158129535'}]",,,,
1016419567583801344,1016419567583801344,2018-07-10 02:01:23 IST,2018-07-10,02:01:23,+0530,603127714,pennystacker3,Matt Pennypacker,,Did everyone else know that UPS stood for United Parcel Service?? I just learned this,en,[],[],[],1,0,5,[],[],https://twitter.com/Pennystacker3/status/1016419567583801344,False,,0,,,,,,,,[],,,,
1007833168844554242,1007833168844554242,2018-06-16 09:22:06 IST,2018-06-16,09:22:06,+0530,191701613,tompodolec,Tom Podolec Aviation,,Cargo night ops at  Hamilton International Airport  Cargojet C-FMIJ Boeing 767-300F  UPS United Parcel Service N138UP Airbus A300-F4-600  #Hamilton #HamOnt #Avgeek  https://t.co/szcYX9n3Jl,en,[],[],"['https://pbs.twimg.com/media/DfyK67XVAAAWhb4.jpg', 'https://pbs.twimg.com/media/DfyK67ZVAAsZp9A.jpg']",4,18,71,"['hamilton', 'hamont', 'avgeek']",[],https://twitter.com/TomPodolec/status/1007833168844554242,False,,1,https://pbs.twimg.com/media/DfyK67XVAAAWhb4.jpg,,,,,,,[],,,,
1006210063248183296,1006210063248183296,2018-06-11 21:52:28 IST,2018-06-11,21:52:28,+0530,20395749,browncafe,BrownCafe,,"Buy United Parcel Service - UPS posted another strong quarter with double-digit revenue growth. Management affirmed EPS 20% EPS growth, boosted by tax reform. UPS remains at a discount to its average valuation, &amp; is a strong buy.  https://t.co/gZKZjvTs9g #upsers",en,[],['https://seekingalpha.com/article/4180670-buy-united-parcel-service'],[],0,2,9,['upsers'],[],https://twitter.com/browncafe/status/1006210063248183296,False,,0,,,,,,,,[],,,,
997214434165776384,997214434165776384,2018-05-18 02:07:03 IST,2018-05-18,02:07:03,+0530,170254080,jacobinmag,Jacobin,,Will the historic strike wave that began with teachers in February hit the United Parcel Service (UPS) this summer?  https://t.co/t43RxZSQpe,en,[],['https://www.jacobinmag.com/2018/05/ups-teamsters-contract-hoffa-strike'],[],0,5,18,[],[],https://twitter.com/jacobinmag/status/997214434165776384,False,,0,,,,,,,,[],,,,
995402048148471810,995402048148471810,2018-05-13 02:05:16 IST,2018-05-13,02:05:16,+0530,25163231,convertbond,Lawrence McDonald,,"Since Jan 2014  Amazon AMZN: +303.2% FedEx FDX: +75.3% United Parcel Service UPS: +7.9% US Postal Service losses: -$24B*  *2012 through last year, the agency failed to deliver nearly $40B toward its pool for retirees’ health care  via @BearTrapsReport",en,"[{'screen_name': 'beartrapsreport', 'name': 'the bear traps report', 'id': '3198452002'}]",[],[],0,4,4,[],[],https://twitter.com/Convertbond/status/995402048148471810,False,,0,,,,,,,,[],,,,
979861235649753088,979861235649753088,2018-03-31 04:51:38 IST,2018-03-31,04:51:38,+0530,37489889,greenawakening,Sara Laughter,,United Parcel Service—world's largest fleets of vehicles—@UPS updates fleet to electric vehicles—EVs replacing internal combustion engines—another indicator that fossil fuels are fading—EV adoption trend makes urbanization sustainable  https://t.co/UyI5yxSDNy @FredericLambert,en,"[{'screen_name': 'ups', 'name': 'ups', 'id': '158129535'}, {'screen_name': 'fredericlambert', 'name': 'fred lambert', 'id': '38253449'}]",['https://electrek.co/2018/03/30/end-internal-combustion-engine-says-ups-fleet-to-electric/'],[],0,5,11,[],[],https://twitter.com/GreenAwakening/status/979861235649753088,False,,0,,,,,,,,[],,,,
963203914584739840,963203914584739840,2018-02-13 05:41:23 IST,2018-02-13,05:41:23,+0530,405942342,yyztjc,Trevor Carl,,United Parcel Service - UPS | N145UP | Airbus A300F4-622R | YYZ | CYYZ #avgeek #Flickr  https://t.co/jnQfdJgSNZ #Photography  https://t.co/AZvjB5cCg5,en,[],['https://flic.kr/p/24fkwnA'],['https://pbs.twimg.com/media/DV382urX0AAl5fR.jpg'],0,3,6,"['avgeek', 'flickr', 'photography']",[],https://twitter.com/yyztjc/status/963203914584739840,False,,1,https://pbs.twimg.com/media/DV382urX0AAl5fR.jpg,,,,,,,[],,,,
941001939088805888,941001939088805888,2017-12-13 23:18:39 IST,2017-12-13,23:18:39,+0530,396945586,haley_loud,Haley Loudin,,Did y’all know that UPS stands for United PARCEL Service bc I didn’t and I’m shook,en,[],[],[],1,0,7,[],[],https://twitter.com/haley_loud/status/941001939088805888,False,,0,,,,,,,,[],,,,
