id,conversation_id,created_at,date,time,timezone,user_id,username,name,place,tweet,language,mentions,urls,photos,replies_count,retweets_count,likes_count,hashtags,cashtags,link,retweet,quote_url,video,thumbnail,near,geo,source,user_rt_id,user_rt,retweet_id,reply_to,retweet_date,translate,trans_src,trans_dest
963537932236808192,963537932236808192,2018-02-14 03:48:39 IST,2018-02-14,03:48:39,+0530,15098243,phidelt,Phi Delta Theta,,Ohio Alpha (Miami) Phi Brian Niccol named CEO of Chipotle. Niccol most recently served as CEO of Yum! Brands' Taco Bell Division. Read the release -  https://t.co/OoQedYNXQr  https://t.co/fSWcdeTmsQ,en,[],['http://phide.lt/2so8Ui8'],['https://pbs.twimg.com/media/DV8sf8YVQAAhQNL.jpg'],4,25,83,[],[],https://twitter.com/phidelt/status/963537932236808192,False,,1,https://pbs.twimg.com/media/DV8sf8YVQAAhQNL.jpg,,,,,,,[],,,,
963531405430087686,963531405430087686,2018-02-14 03:22:43 IST,2018-02-14,03:22:43,+0530,225847395,austincarr,Austin Carr,,"With Chipotle appointing its new CEO from @TacoBell, a good reminder that the restaurant chain has been heading down the Yum! Brands path since its E. coli crisis:  https://t.co/Zapi8WohOv  https://t.co/VawAXxHi0Q",en,"[{'screen_name': 'tacobell', 'name': 'taco bell', 'id': '7831092'}]",['https://www.fastcompany.com/3064068/chipotle-eats-itself'],['https://pbs.twimg.com/media/DV8mNgcU0AAZnDj.jpg'],0,2,10,[],[],https://twitter.com/AustinCarr/status/963531405430087686,False,,1,https://pbs.twimg.com/media/DV8mNgcU0AAZnDj.jpg,,,,,,,[],,,,
962789882379649024,962785715787624448,2018-02-12 02:16:10 IST,2018-02-12,02:16:10,+0530,2909233365,jaiceharmon,Jaice Harmon,,"@demsrloosers @kwilli1046 @Freedom_Daily I haven't eaten KFC in years.  It's horrible.  Pepsi ruined KFC, Taco Bell, and Pizza Hut when they took them over.  Yum Brands hasn't been much better.",en,[],[],[],0,0,1,[],[],https://twitter.com/JaiceHarmon/status/962789882379649024,False,,0,,,,,,,,"[{'screen_name': 'demsrloosers', 'name': 'Hatton', 'id': '927335827264425984'}, {'screen_name': 'kwilli1046', 'name': 'Kevin W', 'id': '3297022953'}, {'screen_name': 'freedom_daily', 'name': 'Freedom Daily', 'id': '1042392985676050433'}]",,,,
962111166737797121,962111166737797121,2018-02-10 05:19:11 IST,2018-02-10,05:19:11,+0530,15464697,juddlegum,Judd Legum,,"""Yum! Brands, the corporate parent of fast food brands KFC, Pizza Hut and Taco Bell, has no business use for the money it will save under the GOP-led Tax Cuts and Jobs Act.""  https://t.co/SeP5gESJxr",en,[],['https://goo.gl/mMLczX'],[],19,82,97,[],[],https://twitter.com/JuddLegum/status/962111166737797121,False,,0,,,,,,,,[],,,,
961744293059792896,961744293059792896,2018-02-09 05:01:22 IST,2018-02-09,05:01:22,+0530,49783304,lauhaim,LAURENCE HAIM,,"Encore une fluctuation importante a Wall Street..Le Dow Jones a perdu plus de 1000 points. A noter cependant que Twitter annonce des profits ainsi que Yum brands, Cardinal Health,  Tyson Foods et 80% des entreprises americaines. Mot du jour : Volatilité",fr,[],[],[],3,16,43,[],[],https://twitter.com/lauhaim/status/961744293059792896,False,,0,,,,,,,,[],,,,
961670990819397633,961670990819397633,2018-02-09 00:10:05 IST,2018-02-09,00:10:05,+0530,9820242,captivate,Captivate,,"Yum! Brands, the parent company of Taco Bell and KFC, announced a $200M partnership with Grubhub to improve online sales and delivery from its restaurants.  https://t.co/U24QqyYaJr",en,[],['http://ow.ly/cmnH30ihyTl'],[],2,3,6,[],[],https://twitter.com/Captivate/status/961670990819397633,False,,0,,,,,,,,[],,,,
961656684371378176,961656684371378176,2018-02-08 23:13:14 IST,2018-02-08,23:13:14,+0530,17673635,livemint,Mint,,KFC and Pizza Hut owner Yum! Brands posts growth for sixth consecutive quarter in a row  https://t.co/CvnRsavXCz,en,[],['http://mintne.ws/2skghr0'],[],0,1,7,[],[],https://twitter.com/livemint/status/961656684371378176,False,,0,,,,,,,,[],,,,
961628524116414465,961628524116414465,2018-02-08 21:21:21 IST,2018-02-08,21:21:21,+0530,938419883745869824,theworldindex,World Index,,"World's Largest Restaurant Companies, 2017 (Market value in billions)  🇺🇸 McDonald's: $106.4b 🇺🇸 Starbucks: $84.6b 🇬🇧 Compass Group: $31.1b 🇺🇸 Yum! Brands: $22.7b 🇨🇦 Restaurant Brands International: $13.1b 🇺🇸 Yum China Holdings: $12.0b 🇺🇸 Aramark: $9.0b  (Forbes)",en,[],[],[],0,4,13,[],[],https://twitter.com/theworldindex/status/961628524116414465,False,,0,,,,,,,,[],,,,
961605610189086720,961605610189086720,2018-02-08 19:50:17 IST,2018-02-08,19:50:17,+0530,14886375,stocktwits,Stocktwits,,YUM Brands (owner of KFC and Taco Bell) has made a $200 million investment in Grubhub.  $GRUB is up 20% right now and hitting all-time highs -&gt;  https://t.co/yDXXjJzkE6,en,[],['https://stocktwits.com/CurtisMelonopoly/message/112231970'],[],0,5,19,[],['grub'],https://twitter.com/Stocktwits/status/961605610189086720,False,,0,,,,,,,,[],,,,
961590280041443328,961590280041443328,2018-02-08 18:49:22 IST,2018-02-08,18:49:22,+0530,147973756,jonathanmaze,Jonathan Maze,,Yum Brands to invest $200 million in Grubhub:   https://t.co/YXZaRZFGT9  $YUM $GRUB,en,[],['http://www.restaurantbusinessonline.com/financing/yum-brands-invest-200-million-grubhub'],[],6,8,8,[],"['yum', 'grub']",https://twitter.com/jonathanmaze/status/961590280041443328,False,,0,,,,,,,,[],,,,
961585495351414791,961585495351414791,2018-02-08 18:30:22 IST,2018-02-08,18:30:22,+0530,804273411325202432,strainerjp,Strainer（ストレイナー）,,今晩の気になる海外決算 アクティビジョン・ブリザード AIG CVS Health Expedia GrubHub Hanesbrands ケロッグ KKR New York Times ニールセン NVIDIA トムソン・ロイター T-Mobile US Twitter ベリサイン Yum! Brands Zillow Group,ja,[],[],[],0,3,14,[],[],https://twitter.com/strainerjp/status/961585495351414791,False,,0,,,,,,,,[],,,,
961576393220984834,961576393220984834,2018-02-08 17:54:12 IST,2018-02-08,17:54:12,+0530,624413,marketwatch,MarketWatch,,Yum Brands to buy $200 million of Grubhub stock as part of new partnership  https://t.co/sescK1kFi9,en,[],['http://on.mktw.net/2nSXxJC'],[],0,12,13,[],[],https://twitter.com/MarketWatch/status/961576393220984834,False,,0,,,,,,,,[],,,,
961573070753419264,961573070753419264,2018-02-08 17:40:59 IST,2018-02-08,17:40:59,+0530,37718217,thedomino,Dominic Chu,,YUM Brands and Grubhub announce partnership agreement. $YUM will invest $200M in $GRUB &amp; get a board seat. Grubhub will become the only national partner providing dedicated support for Taco Bell &amp; KFC online delivery channels.   https://t.co/w7O7AQTT7w,en,[],['http://www.businesswire.com/news/home/20180208005615/en/'],[],0,1,11,[],"['yum', 'grub']",https://twitter.com/TheDomino/status/961573070753419264,False,,0,,,,,,,,[],,,,
961571979596849152,961571979596849152,2018-02-08 17:36:39 IST,2018-02-08,17:36:39,+0530,15110357,reutersbiz,Reuters Business,,JUST IN: Yum Brands reports quarterly revenue of $1.577 billion $YUM  https://t.co/abJ26NlMJF,en,[],[],['https://pbs.twimg.com/media/DVgwnjEXUAEcPft.jpg'],1,3,6,[],['yum'],https://twitter.com/ReutersBiz/status/961571979596849152,False,,1,https://pbs.twimg.com/media/DVgwnjEXUAEcPft.jpg,,,,,,,[],,,,
960636998057975808,960636998057975808,2018-02-06 03:41:22 IST,2018-02-06,03:41:22,+0530,147973756,jonathanmaze,Jonathan Maze,,Buy Del Taco and Jack in the Box and Yum Brands.  https://t.co/XuaM52x7EK,en,[],['https://twitter.com/businessinsider/status/960636532838293505'],[],1,1,8,[],[],https://twitter.com/jonathanmaze/status/960636998057975808,False,https://twitter.com/businessinsider/status/960636532838293505,0,,,,,,,,[],,,,
960327096311656448,960327096311656448,2018-02-05 07:09:56 IST,2018-02-05,07:09:56,+0530,20152072,mearn,Mearn,,Yum Brands Presents the KFC Halftime Show Starring Colonel Reba,en,[],[],[],0,1,4,[],[],https://twitter.com/mearn/status/960327096311656448,False,,0,,,,,,,,[],,,,
959162990061735936,959162990061735936,2018-02-02 02:04:11 IST,2018-02-02,02:04:11,+0530,122047904,faccccct,Fact,,"Taco Bell, KFC and Pizza Hut are all owned by the same company (Yum! Brands).",en,[],[],[],0,3,7,[],[],https://twitter.com/faccccct/status/959162990061735936,False,,0,,,,,,,,[],,,,
959077073775136768,959077073775136768,2018-02-01 20:22:47 IST,2018-02-01,20:22:47,+0530,3400344525,pgvanceii,Gene Vance,,"Join me at the beautiful @LaQuintaResort for this terrific @ABALitigation program. I'll be moderating an insightful General Counsel Forum with GC's from Facebook, Fischer Homes, Fox Networks, Roland Corp. and Yum! Brands. Don't miss it! #LitigationCorporate #LitigationLeader  https://t.co/PwYKFuhKBi",en,"[{'screen_name': 'laquintaresort', 'name': 'la quinta resort', 'id': '38505635'}, {'screen_name': 'abalitigation', 'name': 'aba litigation section', 'id': '56714555'}]",['https://twitter.com/ABALitigation/status/958497644216836096'],[],1,3,5,"['litigationcorporate', 'litigationleader']",[],https://twitter.com/PGVanceII/status/959077073775136768,False,https://twitter.com/ABALitigation/status/958497644216836096,0,,,,,,,,[],,,,
956654302579318784,956654302579318784,2018-01-26 03:55:34 IST,2018-01-26,03:55:34,+0530,147973756,jonathanmaze,Jonathan Maze,,"Starbucks opened 188 stores in China in the quarter.  Company sounds like Yum Brands circa 2005, calls China the biggest growth opportunity in its history. $SBUX",en,[],[],[],1,2,17,[],['sbux'],https://twitter.com/jonathanmaze/status/956654302579318784,False,,0,,,,,,,,[],,,,
955822383184609281,955822383184609281,2018-01-23 20:49:49 IST,2018-01-23,20:49:49,+0530,37718217,thedomino,Dominic Chu,,"68 RECORD S&amp;P 500 HIGHS so far in trading today, incl: Amazon $AMZN Alphabet $GOOGL Microsoft $MSFT Nvidia $NVDA Salesforce $CRM Wells Fargo $WFC JPMorgan Chase $JPM Valero $VLO Coca Cola $KO Netflix $NFLX Home Depot $HD Marriott $MAR $YUM Brands Etc  @cnbc",en,"[{'screen_name': 'cnbc', 'name': 'cnbc', 'id': '20402945'}]",[],[],1,14,33,[],"['amzn', 'googl', 'msft', 'nvda', 'crm', 'wfc', 'jpm', 'vlo', 'ko', 'nflx', 'hd', 'mar', 'yum']",https://twitter.com/TheDomino/status/955822383184609281,False,,0,,,,,,,,[],,,,
955475496682303488,955475496682303488,2018-01-22 21:51:24 IST,2018-01-22,21:51:24,+0530,8845592,yumbrands,Yum! Brands,,We’re pleased that Yum! Brands is one of more than 100 companies included in the 2018 @Bloomberg #GenderEquality Index.  https://t.co/sEeiSyqvT8,en,"[{'screen_name': 'bloomberg', 'name': 'bloomberg lp', 'id': '104237736'}]",['https://bloom.bg/2G2ncIh'],[],0,0,7,['genderequality'],[],https://twitter.com/yumbrands/status/955475496682303488,False,,0,,,,,,,,[],,,,
953422661568335873,953422661568335873,2018-01-17 05:54:10 IST,2018-01-17,05:54:10,+0530,16144366,kftc,KFTC,,"Bevin just praised @yumbrands for being in Kentucky. Too bad YUM Brands hasn't been chipping in their fair share into ""getting our financial house in order"" and has paid $0 in state income taxes in recent years #KYbudgettalk #sotc #kyga18  https://t.co/JJ1qcTkF0r",en,"[{'screen_name': 'yumbrands', 'name': 'yum! brands', 'id': '8845592'}]",['https://kypolicy.org/profitable-fortune-500-companies-kentucky-avoid-paying-millions-state-corporate-income-taxes/'],[],1,18,23,"['kybudgettalk', 'sotc', 'kyga18']",[],https://twitter.com/kftc/status/953422661568335873,False,,0,,,,,,,,[],,,,
951603907599347713,951603213374902272,2018-01-12 05:27:06 IST,2018-01-12,05:27:06,+0530,764128520834584577,smallcapjt,LargeCapJT,,"@airic101 either Western Union will catch up with Moneygram via ZeU and Gatcoin, or Yum Brands stroke a deal with Google, who's using ZeU protocol, or both. I dunno but $5 is coming very soon.",en,[],[],[],2,4,15,[],[],https://twitter.com/SmallCapJT/status/951603907599347713,False,,0,,,,,,,,"[{'screen_name': 'airic101', 'name': 'Airic', 'id': '69221666'}]",,,,
951593404391018496,951593404391018496,2018-01-12 04:45:22 IST,2018-01-12,04:45:22,+0530,937745963237629952,nextrocketstock,Rocket,,"If KFC is serious about Bitcoin/ Blockchain let’s look at Their ownership   Yum Brands  KFC, Pizza Hut, Taco Bell, Wing Street and more   Market Cap $27.8 Billion  https://t.co/ofNQXWLCpi",en,[],['https://twitter.com/stgeorgesplat/status/951582348344139777'],[],0,5,7,[],[],https://twitter.com/nextrocketstock/status/951593404391018496,False,https://twitter.com/stgeorgesplat/status/951582348344139777,0,,,,,,,,[],,,,
951140422600052737,951140422600052737,2018-01-10 22:45:22 IST,2018-01-10,22:45:22,+0530,15568127,themotleyfool,The Motley Fool,,Yum! Brands spun off its China operations so that they could better cater to local tastes. So what IS a Chinese version of an American interpretation of Mexican food? $YUM $YUMC  https://t.co/qvFz1cg1Ot,en,[],['https://www.fool.com/investing/2018/01/08/will-tacos-and-burritos-be-a-hit-in-china.aspx'],[],1,2,8,[],"['yum', 'yumc']",https://twitter.com/themotleyfool/status/951140422600052737,False,,0,,,,,,,,[],,,,
950473510882893824,950473510882893824,2018-01-09 02:35:18 IST,2018-01-09,02:35:18,+0530,32529120,valoreconomico,Valor Econômico,,Yum! Brands vende KFC e Pizza Hut no Brasil para Carlos Wizard  https://t.co/yixfEUWVKE,en,[],['http://www.valor.com.br/u/5250095'],[],0,5,13,[],[],https://twitter.com/valoreconomico/status/950473510882893824,False,,0,,,,,,,,[],,,,
949527562627108864,949527562627108864,2018-01-06 11:56:26 IST,2018-01-06,11:56:26,+0530,124615025,factttsss,Fact,,"Taco Bell, KFC and Pizza Hut are all owned by the same company (Yum! Brands).",en,[],[],[],0,8,10,[],[],https://twitter.com/factttsss/status/949527562627108864,False,,0,,,,,,,,[],,,,
948203929824841728,948203929824841728,2018-01-02 20:16:48 IST,2018-01-02,20:16:48,+0530,1591882489,fairwagesnow,$15 & Fairness!,,Thanks for flagging this. Such BS! Here's a recent profit report for YUM Brands - its parent company that also owns KFC and Taco Bell.  https://t.co/DLwHbAijDn  https://t.co/MF08OGmZ4H,en,[],"['https://www.reuters.com/article/us-yum-brands-results/yum-profit-buoyed-by-strength-at-kfc-shares-jump-idUSKBN1D21FW', 'https://twitter.com/KrystleRoseKing/status/948019156154118144']",[],1,4,6,[],[],https://twitter.com/fairwagesnow/status/948203929824841728,False,0,0,,,,,,,,[],,,,
946206714755473408,945688274353508352,2017-12-28 08:00:35 IST,2017-12-28,08:00:35,+0530,50173115,annettesisco,Annette Sisco,,"@trueguru @atticascott Hi senior analyst, YUM brands! I tutored kids @ Coleridge Taylor as a teen. You? Folks want opportunities &amp; a level playing field. That leads to jobs. K? K!",en,[],[],[],0,2,8,[],[],https://twitter.com/AnnetteSisco/status/946206714755473408,False,,0,,,,,,,,"[{'screen_name': 'trueguru', 'name': 'Steve Medved', 'id': '17168065'}, {'screen_name': 'atticascott', 'name': 'Joseph Ditto', 'id': '1157613520583872512'}]",,,,
945851627587506176,945851627587506176,2017-12-27 08:29:35 IST,2017-12-27,08:29:35,+0530,118655489,faaaactt,Fact,,"Taco Bell, KFC and Pizza Hut are all owned by the same company (Yum! Brands).",en,[],[],[],0,5,7,[],[],https://twitter.com/faaaactt/status/945851627587506176,False,,0,,,,,,,,[],,,,
943956820837715969,943956820837715969,2017-12-22 03:00:18 IST,2017-12-22,03:00:18,+0530,122711186,nash076,Nash Across the 8th Dimension,,"I would say from personal experience that in the past two decades, *all* big brand US delivery pizza has become worse and worse.  It kind of started when Yum! Brands was spun off from Pepsi in 1997; that was Pizza Hut, Taco Bell and KFC.  It's been a slow yucky slide ever since.  https://t.co/dNWTzHCPes",en,[],['https://twitter.com/rmp792/status/943954565623402496'],[],12,5,19,[],[],https://twitter.com/Nash076/status/943956820837715969,False,https://twitter.com/rmp792/status/943954565623402496,0,,,,,,,,[],,,,
943139389537996800,943139389537996800,2017-12-19 20:52:07 IST,2017-12-19,20:52:07,+0530,15764001,usatodaysports,USA TODAY Sports,,Rick Pitino's Louisville home sells for $1.9M to Yum Brands executive Scott Catlett.  https://t.co/6sFDcjWjt7,en,[],['https://usat.ly/2kiQQQa'],[],0,8,7,[],[],https://twitter.com/usatodaysports/status/943139389537996800,False,,0,,,,,,,,[],,,,
941087917086269440,941087917086269440,2017-12-14 05:00:18 IST,2017-12-14,05:00:18,+0530,25053299,fortunemagazine,FORTUNE,,"Yum Brands’ CEO: ""Sometimes you need to fail to succeed""  https://t.co/KGJhr4nqoc",en,[],['http://for.tn/2AT5CUM'],[],0,6,5,[],[],https://twitter.com/FortuneMagazine/status/941087917086269440,False,,0,,,,,,,,[],,,,
940777944053530626,940777944053530626,2017-12-13 08:28:35 IST,2017-12-13,08:28:35,+0530,124615025,factttsss,Fact,,"Taco Bell, KFC and Pizza Hut are all owned by the same company (Yum! Brands).",en,[],[],[],0,8,4,[],[],https://twitter.com/factttsss/status/940777944053530626,False,,0,,,,,,,,[],,,,
940249296557035525,940249296557035525,2017-12-11 21:27:55 IST,2017-12-11,21:27:55,+0530,737989529827704832,davidnovakogo,David Novak,,"Who would think that a kid from the trailer parks, whose childhood can best be described as nomadic, would ever have a chance at becoming the CEO of Yum! Brands at the age of 46?  https://t.co/Y65xitWEsl",en,[],['https://ogolead.com/ogoinspire/trailer-park-corner-office-past-impacts-present/'],[],0,0,11,[],[],https://twitter.com/DavidNovakOGO/status/940249296557035525,False,,0,,,,,,,,[],,,,
938873559748714496,938873559748714496,2017-12-08 02:21:14 IST,2017-12-08,02:21:14,+0530,1155007404,interneteh,@interneteh on Mastodon,,Blood type: Yum! Brands canola fryer grease  https://t.co/OhFcXzxMkp,en,[],['https://twitter.com/christinawilkie/status/938845708723073025'],[],2,1,8,[],[],https://twitter.com/InternetEh/status/938873559748714496,False,https://twitter.com/christinawilkie/status/938845708723073025,0,,,,,,,,[],,,,
938767159488114688,938767159488114688,2017-12-07 19:18:26 IST,2017-12-07,19:18:26,+0530,790624379390586881,gomoneybadger,Money Badger,,Pizza Hut is selling booze now. What does that mean for $YUM Brands?  https://t.co/qIX5TVsh0E,en,[],[],[],5,7,13,[],['yum'],https://twitter.com/gomoneybadger/status/938767159488114688,False,,1,https://pbs.twimg.com/ext_tw_video_thumb/938766881556643840/pu/img/EKCt0a-MCErf_0xs.jpg,,,,,,,[],,,,
938197282515714049,938197282515714049,2017-12-06 05:33:57 IST,2017-12-06,05:33:57,+0530,428694491,bartsimsonreal,lenopilled1959,,Yum! Brands mercs kick in my door with ease in their exosuit frames. i am swiftly executed with a full auto phased plasma rifle for besmirching Pizza Hut online,en,[],[],[],1,12,40,[],[],https://twitter.com/bartsimsonreal/status/938197282515714049,False,,0,,,,,,,,[],,,,
938195230507102210,938156535967969280,2017-12-06 05:25:48 IST,2017-12-06,05:25:48,+0530,18494888,natepatrin,Nate Patrin,,"@XEECEEVEVO @max_read rebooting Aliens to be exactly 100% the same except all instances of ""Weyland-Yutani"" replaced in the script with ""Yum! Brands""",en,[],[],[],2,18,107,[],[],https://twitter.com/natepatrin/status/938195230507102210,False,,0,,,,,,,,"[{'screen_name': 'XEECEEVEVO', 'name': 'XEECEE', 'id': '2555573144'}, {'screen_name': 'max_read', 'name': 'Max Read', 'id': '1368409380589305857'}]",,,,
936375154313064448,936375154313064448,2017-12-01 04:53:28 IST,2017-12-01,04:53:28,+0530,47838954,marcus_today,Marcus Today,,Huge deal signed today for $GSW with a deal signed with Amazon and Yum! Brands. We hold the stock in the Small Cap Portfolio @henryj007 currently up 85%. #amazon #Getswift,en,"[{'screen_name': 'henryj007', 'name': 'henry jennings', 'id': '146293159'}]",[],[],1,1,8,"['amazon', 'getswift']",['gsw'],https://twitter.com/Marcus_Today/status/936375154313064448,False,,0,,,,,,,,[],,,,
936273541175152640,936273541175152640,2017-11-30 22:09:41 IST,2017-11-30,22:09:41,+0530,30050899,opensecretsdc,OpenSecrets.org,,A closer look at YUM! Brands political spending  https://t.co/tudFyiBhH6  https://t.co/o4IfQElFEV,en,[],"['https://goo.gl/uYr5p8', 'https://twitter.com/OpenSecretsDC/status/936273116602368000']",[],0,6,4,[],[],https://twitter.com/OpenSecretsDC/status/936273541175152640,False,https://twitter.com/OpenSecretsDC/status/936273116602368000,0,,,,,,,,[],,,,
935563150069448706,935563150069448706,2017-11-28 23:06:51 IST,2017-11-28,23:06:51,+0530,122047904,faccccct,Fact,,"Taco Bell, KFC and Pizza Hut are all owned by the same company (Yum! Brands).",en,[],[],[],0,2,5,[],[],https://twitter.com/faccccct/status/935563150069448706,False,,0,,,,,,,,[],,,,
931185621888053248,931185621888053248,2017-11-16 21:12:07 IST,2017-11-16,21:12:07,+0530,3346876209,ekonomikguc,Ekonomik Güç Dergisi,,"""Türkiye’de 10 şirkete 1 milyar doların üzerinde yatırım yapan, Birleşik Arap Emirlikleri Dubai merkezli yatırım şirketi Abraaj Grup, Türkiye çapında 104 restoranı bulunan Kentucky Fried Chicken (KFC) Türkiye'yi ABD’li Yum Brands’tan satın aldı."" Dünya/Jülide Yiğittürk Gürdamar",tr,[],[],[],1,22,37,[],[],https://twitter.com/ekonomikguc/status/931185621888053248,False,,0,,,,,,,,[],,,,
930616522808217601,930616522808217601,2017-11-15 07:30:43 IST,2017-11-15,07:30:43,+0530,21870520,pbauniversity,Palm Beach Atlantic,,"Good evening, PBA'ers! The sun has set on another terrific American Free Enterprise Day, in this case honoring @DavidNovakOGO retired chairman of franchise giant Yum! Brands, Inc. More:  https://t.co/LSKEShoDyC  https://t.co/msgIbmUNwK",en,"[{'screen_name': 'davidnovakogo', 'name': 'david novak', 'id': '737989529827704832'}]",['http://www.pba.edu/news/David-Novak-AFE17'],"['https://pbs.twimg.com/media/DOo2IyHWAAAf7Mm.jpg', 'https://pbs.twimg.com/media/DOo2aGmX4AARMuc.jpg', 'https://pbs.twimg.com/media/DOo2tuAWAAAnE0D.jpg', 'https://pbs.twimg.com/media/DOo2wYRW4AAZa2D.jpg']",0,1,7,[],[],https://twitter.com/PBAUniversity/status/930616522808217601,False,,1,https://pbs.twimg.com/media/DOo2IyHWAAAf7Mm.jpg,,,,,,,[],,,,
928298651771863040,928280479207444483,2017-11-08 22:00:20 IST,2017-11-08,22:00:20,+0530,6211352,skylar_moran,Skylar Moran,,@_YoungCommodity Dream bigger. Go for all the Yum! Brands  https://t.co/zkJqIlHe4Z,en,[],[],['https://pbs.twimg.com/media/DOH6V72XcAAxakV.jpg'],1,1,7,[],[],https://twitter.com/skylar_moran/status/928298651771863040,False,,1,https://pbs.twimg.com/media/DOH6V72XcAAxakV.jpg,,,,,,,[],,,,
927920946563993601,927920946563993601,2017-11-07 20:59:28 IST,2017-11-07,20:59:28,+0530,37718217,thedomino,Dominic Chu,,"33 S&amp;P 500 RECORD HIGHS so far today, incl Salesforce $CRM Nvidia $NVDA Apple $AAPL Deere $DE Boeing $BA Amazon $AMZN $YUM Brands etc  @cnbc",en,"[{'screen_name': 'cnbc', 'name': 'cnbc', 'id': '20402945'}]",[],[],0,2,3,[],"['crm', 'nvda', 'aapl', 'de', 'ba', 'amzn', 'yum']",https://twitter.com/TheDomino/status/927920946563993601,False,,0,,,,,,,,[],,,,
926483724195184640,926478963618263040,2017-11-03 21:48:27 IST,2017-11-03,21:48:27,+0530,18621303,gabedelahaye,Gabe Delahaye,,@maxsilvestri Yum! Brands is proud to partner with Time Warner/Spectrum as sponsors of My Own Private Precog (download on Stitcher Premium),en,[],[],[],0,0,7,[],[],https://twitter.com/gabedelahaye/status/926483724195184640,False,,0,,,,,,,,"[{'screen_name': 'maxsilvestri', 'name': 'Max Silvestri', 'id': '17791502'}]",,,,
926422453043245058,926422453043245058,2017-11-03 17:44:59 IST,2017-11-03,17:44:59,+0530,43930301,wdrbnews,WDRB News,,"Yum Brands sees sales growth, says NFL hasn't had effect  https://t.co/ZR3CD9XJ7F  https://t.co/dC47YWPdSK",en,[],['http://wdrb.news/2yoX6Pi'],['https://pbs.twimg.com/media/DNtQTiDUMAIVguh.jpg'],2,5,8,[],[],https://twitter.com/WDRBNews/status/926422453043245058,False,,1,https://pbs.twimg.com/media/DNtQTiDUMAIVguh.jpg,,,,,,,[],,,,
926249483649847296,926249483649847296,2017-11-03 06:17:40 IST,2017-11-03,06:17:40,+0530,485769605,varinder_bansal,Varinder Bansal 🇮🇳,,Yum Brands up 6.5% yesterday; posts growth for the fifth quarter in a row  https://t.co/f727Xzm9NZ,en,[],['http://www.livemint.com/Companies/Y9mtBlzlSjU7ydRFAfRluM/Yum-Brands-posts-growth-for-the-fifth-quarter-in-a-row.html'],[],0,4,7,[],[],https://twitter.com/varinder_bansal/status/926249483649847296,False,,0,,,,,,,,[],,,,
926248591219396608,926248591219396608,2017-11-03 06:14:07 IST,2017-11-03,06:14:07,+0530,34713362,business,Bloomberg,,Yum Brands rallies after Pizza Hut turnaround helps fuel growth  https://t.co/yeWi3Am5JK  https://t.co/UUZJrJpQq2,en,[],['https://bloom.bg/2ypo61d'],['https://pbs.twimg.com/media/DNqyLufV4AAEnIK.jpg'],0,8,14,[],[],https://twitter.com/business/status/926248591219396608,False,,1,https://pbs.twimg.com/media/DNqyLufV4AAEnIK.jpg,,,,,,,[],,,,
926118328392998914,926118328392998914,2017-11-02 21:36:30 IST,2017-11-02,21:36:30,+0530,22589449,readdanwrite,Daniel Roberts,,"Sorry, Papa John. Pizza Hut owner Yum Brands: ""We're not seeing any impact"" of NFL player protests on pizza sales  https://t.co/kWRFIca1kH  https://t.co/j5Nw3NPUAg",en,[],['https://yhoo.it/2zsbDtJ'],['https://pbs.twimg.com/media/DNo7roIV4AANTuK.jpg'],100,1250,3749,[],[],https://twitter.com/readDanwrite/status/926118328392998914,False,,1,https://pbs.twimg.com/media/DNo7roIV4AANTuK.jpg,,,,,,,[],,,,
926113694773374976,926113694773374976,2017-11-02 21:18:05 IST,2017-11-02,21:18:05,+0530,34713362,business,Bloomberg,,Yum Brands rallies after Pizza Hut turnaround helps fuel growth  https://t.co/ZBEmPOGCxc  https://t.co/TcV6X3fcln,en,[],['https://bloom.bg/2z725kL'],['https://pbs.twimg.com/media/DNo3fw6XUAIvKVD.jpg'],2,11,14,[],[],https://twitter.com/business/status/926113694773374976,False,,1,https://pbs.twimg.com/media/DNo3fw6XUAIvKVD.jpg,,,,,,,[],,,,
926109190745153537,926109190745153537,2017-11-02 21:00:12 IST,2017-11-02,21:00:12,+0530,1652541,reuters,Reuters,,Pizza Hut same-restaurant sales growth help Yum Brands beat Street  https://t.co/ntJM7RkcFb  https://t.co/C5a6v338q4,en,[],['http://reut.rs/2h6w6wH'],['https://pbs.twimg.com/media/DNozZleX0AAgYS2.jpg'],5,9,26,[],[],https://twitter.com/Reuters/status/926109190745153537,False,,1,https://pbs.twimg.com/media/DNozZleX0AAgYS2.jpg,,,,,,,[],,,,
