id,conversation_id,created_at,date,time,timezone,user_id,username,name,place,tweet,language,mentions,urls,photos,replies_count,retweets_count,likes_count,hashtags,cashtags,link,retweet,quote_url,video,thumbnail,near,geo,source,user_rt_id,user_rt,retweet_id,reply_to,retweet_date,translate,trans_src,trans_dest
928299322361417730,928299322361417730,2017-11-08 22:03:00 IST,2017-11-08,22:03:00,+0530,19400611,cvpayne,Charles V Payne,,The week before the election this was my special report - I also published report day after with more Trump Stocks.  Ideas on this report: CTAS +40% URI +94% GEO +68% CSX +60%    https://t.co/sD64YvekZd,en,[],['http://www.wstreet.com/member/commentary.asp?con_id=38757'],[],2,10,53,[],[],https://twitter.com/cvpayne/status/928299322361417730,False,,0,,,,,,,,[],,,,
925412797063860225,925412797063860225,2017-10-31 22:52:58 IST,2017-10-31,22:52:58,+0530,17629628,unionpacific,Union Pacific,,Happy #Halloween! Have you seen @CSX's Chainsaw Guy video? Take a peek if you're in the mood for a spooky story.  https://t.co/l2AhqACgiO,en,"[{'screen_name': 'csx', 'name': 'csx', 'id': '15724503'}]",['https://twitter.com/CSX/status/925032959199137794'],[],0,7,32,['halloween'],[],https://twitter.com/UnionPacific/status/925412797063860225,False,https://twitter.com/CSX/status/925032959199137794,0,,,,,,,,[],,,,
924646971612286977,924646971612286977,2017-10-29 20:09:51 IST,2017-10-29,20:09:51,+0530,28938763,landoncassill,landon cassill,,Good morning everyone hopefully you braked for Trains this morning like my crew chief Seth Barbour @CSX  https://t.co/qJOLOPOGBr,en,"[{'screen_name': 'csx', 'name': 'csx', 'id': '15724503'}]",[],['https://pbs.twimg.com/media/DNUBgQEX0AAqcxx.jpg'],1,4,65,[],[],https://twitter.com/landoncassill/status/924646971612286977,False,,1,https://pbs.twimg.com/media/DNUBgQEX0AAqcxx.jpg,,,,,,,[],,,,
923164161042976769,923164161042976769,2017-10-25 17:57:42 IST,2017-10-25,17:57:42,+0530,100893294,team_frm,Front Row Motorsports,,"The @CSX #PlayItSafe Ford is back with @landoncassill at @MartinsvilleSwy, reminding you to be safe around railroad tracks.  https://t.co/yFJniYaPjg",en,"[{'screen_name': 'csx', 'name': 'csx', 'id': '15724503'}, {'screen_name': 'landoncassill', 'name': 'landon cassill', 'id': '28938763'}, {'screen_name': 'martinsvilleswy', 'name': 'martinsville speedway', 'id': '21672310'}]",[],['https://pbs.twimg.com/media/DM-80Y1XcAMXk3X.jpg'],1,6,36,['playitsafe'],[],https://twitter.com/Team_FRM/status/923164161042976769,False,,1,https://pbs.twimg.com/media/DM-80Y1XcAMXk3X.jpg,,,,,,,[],,,,
919699336224825346,919699336224825346,2017-10-16 04:29:43 IST,2017-10-16,04:29:43,+0530,100893294,team_frm,Front Row Motorsports,,"Thanks, @lovestravelstop and @CSX for going on the crazy ride called @TalladegaSuperS with us.  https://t.co/b0BjXyw7FA",en,"[{'screen_name': 'lovestravelstop', 'name': ""love's travel stops"", 'id': '36982741'}, {'screen_name': 'csx', 'name': 'csx', 'id': '15724503'}]",[],['https://pbs.twimg.com/media/DMNtq9AXUAA46ZA.jpg'],1,3,25,[],[],https://twitter.com/Team_FRM/status/919699336224825346,False,,1,https://pbs.twimg.com/media/DMNtq9AXUAA46ZA.jpg,,,,,,,[],,,,
918091889525567491,918091889525567491,2017-10-11 18:02:18 IST,2017-10-11,18:02:18,+0530,100893294,team_frm,Front Row Motorsports,,"The No. 34's two biggest partners, Love's &amp; CSX, are both on @landoncassill's Ford at @TalladegaSuperS, the site of his career-best finish.  https://t.co/MQlhv5bH1t",en,"[{'screen_name': 'landoncassill', 'name': 'landon cassill', 'id': '28938763'}]",[],['https://pbs.twimg.com/media/DL22yRTWkAEGT50.png'],9,9,43,[],[],https://twitter.com/Team_FRM/status/918091889525567491,False,,1,https://pbs.twimg.com/media/DL22yRTWkAEGT50.png,,,,,,,[],,,,
917760484933238785,917760484933238785,2017-10-10 20:05:25 IST,2017-10-10,20:05:25,+0530,32368769,railsimulator,Train Simulator,,"To celebrate hitting 10k followers, we're giving away a 3 copies of TSW: CSX HH and GWE! Like and retweet &amp; we'll choose 3 winners tomorrow!  https://t.co/O9yZrwLu31",en,[],[],['https://pbs.twimg.com/media/DLyJ3A-XcAABV7S.jpg'],17,231,282,[],[],https://twitter.com/railsimulator/status/917760484933238785,False,,1,https://pbs.twimg.com/media/DLyJ3A-XcAABV7S.jpg,,,,,,,[],,,,
916645565131313153,916645565131313153,2017-10-07 18:15:07 IST,2017-10-07,18:15:07,+0530,3108351,wsj,The Wall Street Journal,,Railroad CSX has gotten its tracks in order ahead of a coming hearing on train delays    https://t.co/AIbHeRM3D8,en,[],['http://on.wsj.com/2y1cqyn'],[],7,24,41,[],[],https://twitter.com/WSJ/status/916645565131313153,False,,0,,,,,,,,[],,,,
913033216856125441,913033216856125441,2017-09-27 19:00:56 IST,2017-09-27,19:00:56,+0530,384356237,ravenscommunity,Ravens Community,,"Yesterday, the @Ravens and other sponsors took part in the groundbreaking ceremony for CSX Field at Baybrook Park!  #OurTeamOurCommunity  https://t.co/x3FSSj4c0f",en,"[{'screen_name': 'ravens', 'name': 'baltimore ravens', 'id': '22146282'}]",[],"['https://pbs.twimg.com/media/DKu-27bX0AEG9v2.jpg', 'https://pbs.twimg.com/media/DKu-27ZXUAQkhGM.jpg']",6,8,39,['ourteamourcommunity'],[],https://twitter.com/RavensCommunity/status/913033216856125441,False,,1,https://pbs.twimg.com/media/DKu-27bX0AEG9v2.jpg,,,,,,,[],,,,
912403991656587264,912403991656587264,2017-09-26 01:20:37 IST,2017-09-26,01:20:37,+0530,16550480,treehuggertwo,Treehugger Animals,,"in a contest between you and a train, the train will win. Here's how to #PlayItSafe  #USRailSafetyWeek @CSX  https://t.co/4FJml440yS",en,"[{'screen_name': 'csx', 'name': 'csx', 'id': '15724503'}]",[],[],1,8,23,"['playitsafe', 'usrailsafetyweek']",[],https://twitter.com/TreehuggerTwo/status/912403991656587264,False,,1,https://pbs.twimg.com/ext_tw_video_thumb/912403813008642049/pu/img/F0P9fKG9BQMYaq-N.jpg,,,,,,,[],,,,
911931103434493953,911931103434493953,2017-09-24 18:01:32 IST,2017-09-24,18:01:32,+0530,143525311,hcsosheriff,HCSO,,"Here's something that doesn't happen every day, @CSX train traveling down the middle of the street.  https://t.co/if3CsSlUfy",en,"[{'screen_name': 'csx', 'name': 'csx', 'id': '15724503'}]",[],[],8,11,58,[],[],https://twitter.com/HCSOSheriff/status/911931103434493953,False,,1,https://pbs.twimg.com/ext_tw_video_thumb/911931006487277568/pu/img/je35PYajuJolETJx.jpg,,,,,,,[],,,,
909564248786898944,909564248786898944,2017-09-18 05:16:30 IST,2017-09-18,05:16:30,+0530,28938763,landoncassill,landon cassill,,"Thanks mom for being my good luck charm today! Top 20 feels good, especially with so many @CSX guests. Play it Safe for God's sake  https://t.co/9OaWxbF0eh",en,"[{'screen_name': 'csx', 'name': 'csx', 'id': '15724503'}]",[],['https://pbs.twimg.com/media/DJ9r2GPWAAAJx6a.jpg'],19,13,412,[],[],https://twitter.com/landoncassill/status/909564248786898944,False,,1,https://pbs.twimg.com/media/DJ9r2GPWAAAJx6a.jpg,,,,,,,[],,,,
906597718969262081,906597718969262081,2017-09-10 00:48:34 IST,2017-09-10,00:48:34,+0530,28938763,landoncassill,landon cassill,,"Please guys, play it safe around trains...and safer barriers @CSX  https://t.co/U5xIMu2aRX",en,"[{'screen_name': 'csx', 'name': 'csx', 'id': '15724503'}]",[],['https://pbs.twimg.com/media/DJThyLpWsAAaIbb.jpg'],2,7,72,[],[],https://twitter.com/landoncassill/status/906597718969262081,False,,1,https://pbs.twimg.com/media/DJThyLpWsAAaIbb.jpg,,,,,,,[],,,,
900153120747081728,900153120747081728,2017-08-23 06:00:02 IST,2017-08-23,06:00:02,+0530,3108351,wsj,The Wall Street Journal,,CSX's railroad woes have caused a colossal mess for businesses that depend on just-in-time inventories  https://t.co/NwHwhkUKzY,en,[],['http://on.wsj.com/2wlqLar'],[],3,20,40,[],[],https://twitter.com/WSJ/status/900153120747081728,False,,0,,,,,,,,[],,,,
900051204054679553,900051204054679553,2017-08-22 23:15:03 IST,2017-08-22,23:15:03,+0530,3108351,wsj,The Wall Street Journal,,CSX's railroad woes cause colossal mess at businesses that depend on just-in-time inventories  https://t.co/HUpwU587id,en,[],['http://on.wsj.com/2vbhHkI'],[],3,17,23,[],[],https://twitter.com/WSJ/status/900051204054679553,False,,0,,,,,,,,[],,,,
900028665211310080,900028665211310080,2017-08-22 21:45:30 IST,2017-08-22,21:45:30,+0530,3108351,wsj,The Wall Street Journal,,Why it’s harder to make Pringles this summer: CSX’s monster railroad traffic jam  https://t.co/BjpEmccA1f,en,[],['http://on.wsj.com/2vaX1ZX'],[],6,33,33,[],[],https://twitter.com/WSJ/status/900028665211310080,False,,0,,,,,,,,[],,,,
898590859737710592,898590859737710592,2017-08-18 22:32:10 IST,2017-08-18,22:32:10,+0530,217064621,simonmaloy,Simon Maloy,,hearing from sources that Bannon bindled up his bathtub rye and pinto beans and hopped a CSX freight to Saginaw this morning,en,[],[],[],5,10,77,[],[],https://twitter.com/SimonMaloy/status/898590859737710592,False,,0,,,,,,,,[],,,,
897656674948919297,897656674948919297,2017-08-16 08:40:03 IST,2017-08-16,08:40:03,+0530,1652541,reuters,Reuters,,Trade groups call on U.S. to investigate CSX rail disruptions  https://t.co/HYtjjAdqaU  https://t.co/oitdU4ixDH,en,[],['http://reut.rs/2w8ERMv'],['https://pbs.twimg.com/media/DHUd_K_XgAAPKA1.jpg'],7,23,39,[],[],https://twitter.com/Reuters/status/897656674948919297,False,,1,https://pbs.twimg.com/media/DHUd_K_XgAAPKA1.jpg,,,,,,,[],,,,
897545953720315908,897545953720315908,2017-08-16 01:20:05 IST,2017-08-16,01:20:05,+0530,1652541,reuters,Reuters,,Trade groups call on U.S. to investigate CSX rail disruptions  https://t.co/cEZUIKdmtl  https://t.co/5Xk02YqJFX,en,[],['http://reut.rs/2x1yMy0'],['https://pbs.twimg.com/media/DHS5SY4V0AAtPXX.jpg'],4,24,35,[],[],https://twitter.com/Reuters/status/897545953720315908,False,,1,https://pbs.twimg.com/media/DHS5SY4V0AAtPXX.jpg,,,,,,,[],,,,
896990784909606912,896990784909606912,2017-08-14 12:34:03 IST,2017-08-14,12:34:03,+0530,960924277,danilotoninelli,Danilo Toninelli,,Il Csx si sta squagliando sotto il sole estivo. Perciò vogliono il premio di ammucchiata:stare divisi per unirsi contro il #M5S. Falliranno!,it,[],[],[],109,287,476,['m5s'],[],https://twitter.com/DaniloToninelli/status/896990784909606912,False,,0,,,,,,,,[],,,,
893882995920261120,893882995920261120,2017-08-05 22:44:48 IST,2017-08-05,22:44:48,+0530,2978837542,governortomwolf,Governor Tom Wolf,,"Thanks to residents of Hyndman for their patience as @CSX, responders and agency officials worked to resolve Wednesday’s train derailment.  https://t.co/HyMG1SAwdp",en,"[{'screen_name': 'csx', 'name': 'csx', 'id': '15724503'}]",['https://twitter.com/GovernorsOffice/status/893882825707053056'],[],1,12,20,[],[],https://twitter.com/GovernorTomWolf/status/893882995920261120,False,https://twitter.com/GovernorsOffice/status/893882825707053056,0,,,,,,,,[],,,,
893519413877633024,893519413877633024,2017-08-04 22:40:03 IST,2017-08-04,22:40:03,+0530,1652541,reuters,Reuters,,Fires still burning after CSX train derailment in Pennsylvania  https://t.co/9Sauai8Vug  https://t.co/vbsgV3oyqP,en,[],['http://reut.rs/2vAeSgX'],['https://pbs.twimg.com/media/DGZrK9LXkAAo5Ko.jpg'],2,25,22,[],[],https://twitter.com/Reuters/status/893519413877633024,False,,1,https://pbs.twimg.com/media/DGZrK9LXkAAo5Ko.jpg,,,,,,,[],,,,
889550752598949888,889550318467510272,2017-07-24 23:50:01 IST,2017-07-24,23:50:01,+0530,28938763,landoncassill,landon cassill,,@CSX In all seriousness I'm still trying to understand the scope of the whole scenario. I'll keep you posted,en,[],[],[],13,6,93,[],[],https://twitter.com/landoncassill/status/889550752598949888,False,,0,,,,,,,,"[{'screen_name': 'CSX', 'name': 'CSX', 'id': '15724503'}]",,,,
889550318467510272,889550318467510272,2017-07-24 23:48:17 IST,2017-07-24,23:48:17,+0530,28938763,landoncassill,landon cassill,,"NASCAR parked me yesterday for ""disobeying red flag orders"". This is my official statement: @CSX  https://t.co/Eef5oHWE8A",en,"[{'screen_name': 'csx', 'name': 'csx', 'id': '15724503'}]",[],['https://pbs.twimg.com/media/DFhRSuBUMAAJb2L.jpg'],22,98,466,[],[],https://twitter.com/landoncassill/status/889550318467510272,False,,1,https://pbs.twimg.com/media/DFhRSuBUMAAJb2L.jpg,,,,,,,[],,,,
889416233958952960,889416233958952960,2017-07-24 14:55:29 IST,2017-07-24,14:55:29,+0530,318400179,vitopetrocelli,Vito Petrocelli,,CDX e CSX hanno spolpato Roma e umiliato l'intero Paese. Chi li sostiene è complice dello sfacelo.   https://t.co/JIw4z996UQ  https://t.co/8Sbo1KUXKL,it,[],['http://www.beppegrillo.it/2017/07/non_e_mafia_e_una_montagna_di_merda.html'],"['https://pbs.twimg.com/media/DFfXU9JXoAAwLkq.jpg', 'https://pbs.twimg.com/media/DFfXU9LXcAA_8lN.jpg']",0,31,20,[],[],https://twitter.com/vitopetrocelli/status/889416233958952960,False,,1,https://pbs.twimg.com/media/DFfXU9JXoAAwLkq.jpg,,,,,,,[],,,,
888060034743234560,888060034743234560,2017-07-20 21:06:26 IST,2017-07-20,21:06:26,+0530,821419495730401281,briancdeese,Brian Deese,,Striking Paris irreversibility datapoint of the day: CSX chief says railroad won't purchase any new coal assets  https://t.co/GhtyjOaiv6,en,[],['https://www.ft.com/content/888b05c4-6c95-11e7-bfeb-33fe0c5b7eaa'],[],1,33,60,[],[],https://twitter.com/BrianCDeese/status/888060034743234560,False,,0,,,,,,,,[],,,,
887834454802259968,887834454802259968,2017-07-20 06:10:03 IST,2017-07-20,06:10:03,+0530,401775393,assaadrazzouk,Assaad Razzouk,,"“Fossil fuels are dead""  -&gt; CEO of CSX, a US freight railroad company that won't buy a single new locomotive to pull coal trains  #climate  https://t.co/F5zndrQLrt",en,[],[],['https://pbs.twimg.com/media/DFI4uuhXoAQVEyl.jpg'],2,29,36,['climate'],[],https://twitter.com/AssaadRazzouk/status/887834454802259968,False,,1,https://pbs.twimg.com/media/DFI4uuhXoAQVEyl.jpg,,,,,,,[],,,,
887408586044956672,887408586044956672,2017-07-19 01:57:48 IST,2017-07-19,01:57:48,+0530,19400611,cvpayne,Charles V Payne,,Saving Coal @realDonaldTrump keeping promise to bring coal back to life against massive odds. After close $CSX coal volume +7% revenue +27%  https://t.co/BhJrKUzmTy,en,"[{'screen_name': 'realdonaldtrump', 'name': 'donald j. trump', 'id': '25073877'}]",[],['https://pbs.twimg.com/media/DFC04WVUIAAHqwe.jpg'],14,122,281,[],['csx'],https://twitter.com/cvpayne/status/887408586044956672,False,,1,https://pbs.twimg.com/media/DFC04WVUIAAHqwe.jpg,,,,,,,[],,,,
887122732068081664,887122732068081664,2017-07-18 07:01:55 IST,2017-07-18,07:01:55,+0530,17446621,thr,The Hollywood Reporter,,A jury decided Monday that railroad company CSX Transportation shared in the blame for the 2014 death of Sarah Jones  https://t.co/v164kEqN4M,en,[],['http://thr.cm/ajnLyI'],[],2,14,41,[],[],https://twitter.com/THR/status/887122732068081664,False,,0,,,,,,,,[],,,,
887084711255744512,887084711255744512,2017-07-18 04:30:51 IST,2017-07-18,04:30:51,+0530,21039636,llpos,Harry Bring,,Sarah Jones Family V. CSX Verdict: Jones Win $11.2M In Savannah Court via @Deadline  https://t.co/O9JdMNtEew,en,"[{'screen_name': 'deadline', 'name': 'deadline hollywood', 'id': '586032653'}]",['http://deadline.com/2017/07/sarah-jones-midnight-rider-csx-civil-trial-1202129827/'],[],4,3,30,[],[],https://twitter.com/LLPOS/status/887084711255744512,False,,0,,,,,,,,[],,,,
887072271851978753,887072271851978753,2017-07-18 03:41:25 IST,2017-07-18,03:41:25,+0530,51241574,ap,The Associated Press,,"BREAKING: Jury verdict: CSX liable, should pay $3.9 million in railroad bridge death of worker in Gregg Allman movie.",en,[],[],[],17,82,127,[],[],https://twitter.com/AP/status/887072271851978753,False,,0,,,,,,,,[],,,,
885934188599418880,885934188599418880,2017-07-15 00:19:05 IST,2017-07-15,00:19:05,+0530,3108351,wsj,The Wall Street Journal,,"CSX’s new policy on napping has a positive effect on safety and no effect on productivity, the company said  https://t.co/1tVPySNPb2",en,[],['http://on.wsj.com/2tTa16Q'],[],4,14,29,[],[],https://twitter.com/WSJ/status/885934188599418880,False,,0,,,,,,,,[],,,,
885801090230484992,885801090230484992,2017-07-14 15:30:11 IST,2017-07-14,15:30:11,+0530,3108351,wsj,The Wall Street Journal,,"""We had a rule that said you could take a nap while you worked. We don't have that now,” CSX said  https://t.co/USH3Pm9rOX",en,[],['http://on.wsj.com/2uqdg8E'],[],6,23,34,[],[],https://twitter.com/WSJ/status/885801090230484992,False,,0,,,,,,,,[],,,,
885152775302246400,885152775302246400,2017-07-12 20:34:01 IST,2017-07-12,20:34:01,+0530,114782468,carlquintanilla,Carl Quintanilla,,Buckle up  Friday:  JPM Citi PNC Wells  Next week: Netflix BofA Goldman J&amp;J UNH Harley IBM CSX MStanley Amex Qualcomm eBay Microsoft Visa GE,en,[],[],[],3,19,34,[],[],https://twitter.com/carlquintanilla/status/885152775302246400,False,,0,,,,,,,,[],,,,
879392750336167936,879392750336167936,2017-06-26 23:05:44 IST,2017-06-26,23:05:44,+0530,58913244,airlineflyer,Jason Rabinowitz,,Oscar Munoz goes from @CSX President to @United CEO  Richard Anderson goes from @Delta CEO to @Amtrak CEO  Maybe they should swap now?  https://t.co/bARZFY1c8P,en,"[{'screen_name': 'csx', 'name': 'csx', 'id': '15724503'}, {'screen_name': 'united', 'name': 'united airlines', 'id': '260907612'}, {'screen_name': 'delta', 'name': 'delta', 'id': '5920532'}, {'screen_name': 'amtrak', 'name': 'amtrak', 'id': '119166791'}]",[],['https://pbs.twimg.com/tweet_video_thumb/DDQ6G_cXsAAxgKA.jpg'],3,2,24,[],[],https://twitter.com/AirlineFlyer/status/879392750336167936,False,,1,https://pbs.twimg.com/tweet_video_thumb/DDQ6G_cXsAAxgKA.jpg,,,,,,,[],,,,
874119460495532033,874119460495532033,2017-06-12 09:51:34 IST,2017-06-12,09:51:34,+0530,337767301,borghi_claudio,Claudio Borghi A.,,A Lucca se finisce così Cdx e csx appaiati al ballottaggio con quasi il 40% e Casapound supera il M5S,it,[],[],[],7,57,86,[],[],https://twitter.com/borghi_claudio/status/874119460495532033,False,,0,,,,,,,,[],,,,
874042143140139010,874042143140139010,2017-06-12 04:44:20 IST,2017-06-12,04:44:20,+0530,337767301,borghi_claudio,Claudio Borghi A.,,A Monza cdx e csx appaiati attorno al 40% (!),it,[],[],[],3,6,21,[],[],https://twitter.com/borghi_claudio/status/874042143140139010,False,,0,,,,,,,,[],,,,
872516053779263488,872516053779263488,2017-06-07 23:40:12 IST,2017-06-07,23:40:12,+0530,123323498,jashkenas,Jeremy Ashkenas,,"JSX lands in CoffeeScript 2 (as CSX, natch).  All the g(l)ory details:  https://t.co/zEFQ6U8o3V",en,[],['https://github.com/jashkenas/coffeescript/pull/4551'],[],3,19,60,[],[],https://twitter.com/jashkenas/status/872516053779263488,False,,0,,,,,,,,[],,,,
872430467697565696,872430467697565696,2017-06-07 18:00:07 IST,2017-06-07,18:00:07,+0530,100893294,team_frm,Front Row Motorsports,,".@landoncassill takes the @CSX #PlayItSafe Ford to @poconoraceway, where the 34 last visited Victory Lane.  https://t.co/O2HX14OeV5",en,"[{'screen_name': 'landoncassill', 'name': 'landon cassill', 'id': '28938763'}, {'screen_name': 'csx', 'name': 'csx', 'id': '15724503'}, {'screen_name': 'poconoraceway', 'name': 'pocono raceway', 'id': '16202575'}]",[],['https://pbs.twimg.com/media/DBt-z28UwAE1Amb.jpg'],1,6,24,['playitsafe'],[],https://twitter.com/Team_FRM/status/872430467697565696,False,,1,https://pbs.twimg.com/media/DBt-z28UwAE1Amb.jpg,,,,,,,[],,,,
872056549715431425,872056549715431425,2017-06-06 17:14:18 IST,2017-06-06,17:14:18,+0530,714417878,gabrigiammanco,Gabriella Giammanco,,A Palermo fermati 15 scafisti ke avrebbe trasportato da Tunisia sospettati jihadisti. Ennesima conferma fallimento politiche csx su immigraz,it,[],[],[],8,15,23,[],[],https://twitter.com/GabriGiammanco/status/872056549715431425,False,,0,,,,,,,,[],,,,
868890315461152769,868890315461152769,2017-05-28 23:32:49 IST,2017-05-28,23:32:49,+0530,100893294,team_frm,Front Row Motorsports,,This is Jake from Harmony Elementary. His #PlayItSafe poster won first place in the school contest. It's now on @landoncassill's @CSX Ford.  https://t.co/Cx7qTNbgLC,en,"[{'screen_name': 'landoncassill', 'name': 'landon cassill', 'id': '28938763'}, {'screen_name': 'csx', 'name': 'csx', 'id': '15724503'}]",[],"['https://pbs.twimg.com/media/DA7qyHgV0AE5rY2.jpg', 'https://pbs.twimg.com/media/DA7qyHgUMAAGwp-.jpg']",1,5,18,['playitsafe'],[],https://twitter.com/Team_FRM/status/868890315461152769,False,,1,https://pbs.twimg.com/media/DA7qyHgV0AE5rY2.jpg,,,,,,,[],,,,
867423617218469889,867423617218469889,2017-05-24 22:24:40 IST,2017-05-24,22:24:40,+0530,28938763,landoncassill,landon cassill,,"Great kids at Harmony Elementary this morning promoting train safety with @CSX! Jake won the art contest, and will come to the race Sunday!  https://t.co/b5G98ShPlg",en,"[{'screen_name': 'csx', 'name': 'csx', 'id': '15724503'}]",[],"['https://pbs.twimg.com/media/DAm1LEOXUAA_gHN.jpg', 'https://pbs.twimg.com/media/DAm1LEYXsAAADHM.jpg']",3,8,40,[],[],https://twitter.com/landoncassill/status/867423617218469889,False,,1,https://pbs.twimg.com/media/DAm1LEOXUAA_gHN.jpg,,,,,,,[],,,,
867371227706515456,867371227706515456,2017-05-24 18:56:30 IST,2017-05-24,18:56:30,+0530,100893294,team_frm,Front Row Motorsports,,"The biggest announcement: First-place poster design will go on the back of Landon's @CSX #PlayItSafe Ford this weekend. Way to go, Jake!  https://t.co/HI22bkxyKU",en,"[{'screen_name': 'csx', 'name': 'csx', 'id': '15724503'}]",[],['https://pbs.twimg.com/media/DAmFhNWXcAAbis-.jpg'],2,5,22,['playitsafe'],[],https://twitter.com/Team_FRM/status/867371227706515456,False,,1,https://pbs.twimg.com/media/DAmFhNWXcAAbis-.jpg,,,,,,,[],,,,
867024781673189376,867024781673189376,2017-05-23 19:59:51 IST,2017-05-23,19:59:51,+0530,100893294,team_frm,Front Row Motorsports,,.@landoncassill and @CSX remember our fallen service members in this special No. 34 CSX Ford this Memorial Day weekend. #NASCARSalutes  https://t.co/oL1VY244a6,en,"[{'screen_name': 'landoncassill', 'name': 'landon cassill', 'id': '28938763'}, {'screen_name': 'csx', 'name': 'csx', 'id': '15724503'}]",[],['https://pbs.twimg.com/media/DAhJa1CXsAEMMwK.jpg'],2,15,53,['nascarsalutes'],[],https://twitter.com/Team_FRM/status/867024781673189376,False,,1,https://pbs.twimg.com/media/DAhJa1CXsAEMMwK.jpg,,,,,,,[],,,,
866681394000531459,866681394000531459,2017-05-22 21:15:21 IST,2017-05-22,21:15:21,+0530,32368769,railsimulator,Train Simulator,,Want to win a copy of TSW CSX Heavy Haul? All you have to do is like and Re-tweet this tweet and we'll pick a winner on the 24/05!  https://t.co/71VmS8gi6q,en,[],[],['https://pbs.twimg.com/media/DAcSAwdXcAAUBTu.jpg'],9,195,175,[],[],https://twitter.com/railsimulator/status/866681394000531459,False,,1,https://pbs.twimg.com/media/DAcSAwdXcAAUBTu.jpg,,,,,,,[],,,,
861585775112187904,861585775112187904,2017-05-08 19:47:10 IST,2017-05-08,19:47:10,+0530,114782468,carlquintanilla,Carl Quintanilla,,Stop me if you've heard these new highs before  McDonalds Apple H Depot Marriott Priceline Boeing CSX Raytheon Aetna Ulta Elec Arts PayPal,en,[],[],[],2,2,24,[],[],https://twitter.com/carlquintanilla/status/861585775112187904,False,,0,,,,,,,,[],,,,
856607780060442626,856607780060442626,2017-04-25 02:06:24 IST,2017-04-25,02:06:24,+0530,100893294,team_frm,Front Row Motorsports,,Thanks to @CSX for being our #NASCARgreen partner at @BMSupdates.  https://t.co/RyPseGtzdj,en,"[{'screen_name': 'csx', 'name': 'csx', 'id': '15724503'}, {'screen_name': 'bmsupdates', 'name': 'bristolmotorspeedway', 'id': '10695922'}]",[],['https://pbs.twimg.com/media/C-NIN9AXoAAKCQL.jpg'],0,4,30,['nascargreen'],[],https://twitter.com/Team_FRM/status/856607780060442626,False,,1,https://pbs.twimg.com/media/C-NIN9AXoAAKCQL.jpg,,,,,,,[],,,,
856509485489295361,856509485489295361,2017-04-24 19:35:49 IST,2017-04-24,19:35:49,+0530,114782468,carlquintanilla,Carl Quintanilla,,The all-time high list will get your attention:  McDonalds Darden Hasbro Comcast Home Depot Lowe's CSX Honeywell 3M Adobe Facebook Microsoft,en,[],[],[],7,36,57,[],[],https://twitter.com/carlquintanilla/status/856509485489295361,False,,0,,,,,,,,[],,,,
855123658993532928,855123658993532928,2017-04-20 23:49:02 IST,2017-04-20,23:49:02,+0530,100893294,team_frm,Front Row Motorsports,,VIDEO: @landoncassill and Beckham plant seeds for #EarthDay.  https://t.co/plGD65Ez7t #NASCARgreen @CSX  #TreesForTracks  https://t.co/nbowvS3Cup,en,"[{'screen_name': 'landoncassill', 'name': 'landon cassill', 'id': '28938763'}, {'screen_name': 'csx', 'name': 'csx', 'id': '15724503'}]",['https://www.facebook.com/landoncassillfans/videos/1305151752853196/'],['https://pbs.twimg.com/media/C94CD_iXgAEFFnK.jpg'],0,7,28,"['earthday', 'nascargreen', 'treesfortracks']",[],https://twitter.com/Team_FRM/status/855123658993532928,False,,1,https://pbs.twimg.com/media/C94CD_iXgAEFFnK.jpg,,,,,,,[],,,,
844996506809708545,844996506809708545,2017-03-24 01:07:21 IST,2017-03-24,01:07:21,+0530,21316253,zekejmiller,Zeke Miller,,Trump has already sat in pilot’s seat (on dreamliner). Needs an Amtrak or CSX visit soon to complete the trifecta,en,[],[],[],8,5,27,[],[],https://twitter.com/ZekeJMiller/status/844996506809708545,False,,0,,,,,,,,[],,,,
842424387773038592,842424387773038592,2017-03-16 22:46:40 IST,2017-03-16,22:46:40,+0530,32368769,railsimulator,Train Simulator,,The future of train simulation is here! TSW: CSX Heavy Haul is out now on Steam! -  https://t.co/UOyMmaa1nf #feelthedetail @unrealengine  https://t.co/vmhgqhubRG,en,"[{'screen_name': 'unrealengine', 'name': 'unreal engine', 'id': '164081884'}]",['http://bit.ly/2mKlXUk'],['https://pbs.twimg.com/media/C7DkfhBXAAAiINw.jpg'],13,19,43,['feelthedetail'],[],https://twitter.com/railsimulator/status/842424387773038592,False,,1,https://pbs.twimg.com/media/C7DkfhBXAAAiINw.jpg,,,,,,,[],,,,
842423155356516356,842423155356516356,2017-03-16 22:41:46 IST,2017-03-16,22:41:46,+0530,36803580,steam,Steam,,Now Available on Steam - Train Sim World®: CSX Heavy Haul #SteamNewRelease  https://t.co/UOKfxiFr2Q  https://t.co/dQSjtaif7j,en,[],['http://zpr.io/PuKiL'],['https://pbs.twimg.com/media/C7DjZPRWwAAI7ic.jpg'],3,31,121,['steamnewrelease'],[],https://twitter.com/Steam/status/842423155356516356,False,,1,https://pbs.twimg.com/media/C7DjZPRWwAAI7ic.jpg,,,,,,,[],,,,
