id,conversation_id,created_at,date,time,timezone,user_id,username,name,place,tweet,language,mentions,urls,photos,replies_count,retweets_count,likes_count,hashtags,cashtags,link,retweet,quote_url,video,thumbnail,near,geo,source,user_rt_id,user_rt,retweet_id,reply_to,retweet_date,translate,trans_src,trans_dest
1015728859927449600,1015672548615446534,2018-07-08 04:16:46 IST,2018-07-08,04:16:46,+0530,119496583,doug5007,Doug Tanney,,@EdKrassen Shawn - Harley was NOT bought out by Kawasaki. Harley Davidson is a independent company trading under the symbol of HOG. So where did you get this false information from - FAUX News? I'm a shareholder of Harley &amp; follow it closely. Trump's Tariffs are forcing Harley overseas.,en,[],[],[],1,7,38,[],[],https://twitter.com/Doug5007/status/1015728859927449600,False,,0,,,,,,,,"[{'screen_name': 'EdKrassen', 'name': 'Ed Krassenstein', 'id': '132339474'}]",,,,
1013540833394593792,1013540248318631936,2018-07-02 03:22:20 IST,2018-07-02,03:22:20,+0530,999399993738977280,michael84546622,Stellae Incognita,,@politico Think of all the Hog riders who will abandon Trump for attacking Harley-Davidson ...,en,[],[],[],1,1,8,[],[],https://twitter.com/Michael84546622/status/1013540833394593792,False,,0,,,,,,,,"[{'screen_name': 'politico', 'name': 'POLITICO', 'id': '9300262'}]",,,,
1013176942235934722,1013176942235934722,2018-07-01 03:16:21 IST,2018-07-01,03:16:21,+0530,827011405165559808,jay_usmc2,Mexi-'Can' Marine💪🇺🇸🇲🇽(F🖕U Reps!),,"Harley-Davidson's problems go much deeper than Trump's trade war (HOG)  https://t.co/MrKjWOayWo via @Yahoo Shares of Harley-Davidson already sank 8% this week after the motorcycle maker announced new tariffs from the European Union will cause a ""tremendous cost increase.",en,"[{'screen_name': 'yahoo', 'name': 'yahoo', 'id': '19380829'}]",['https://finance.yahoo.com/news/harley-davidson-apos-problems-much-163500855.html?soc_src=community&soc_trk=tw'],[],0,2,8,[],[],https://twitter.com/Jay_USMC2/status/1013176942235934722,False,,0,,,,,,,,[],,,,
1013108682257813504,1013108682257813504,2018-06-30 22:45:07 IST,2018-06-30,22:45:07,+0530,19546277,yahoofinance,Yahoo Finance,,Trump's rage towards Harley-Davidson is what happens when you pick winners and losers $HOG  https://t.co/99wBQxiqnq by @MylesUdland  https://t.co/TPORN4EQ5I,en,"[{'screen_name': 'mylesudland', 'name': 'myles udland', 'id': '62633125'}]",['https://yhoo.it/2MXFIEW'],['https://pbs.twimg.com/media/Dg9I-jxW4AAyQr-.jpg'],1,2,4,[],['hog'],https://twitter.com/YahooFinance/status/1013108682257813504,False,,1,https://pbs.twimg.com/media/Dg9I-jxW4AAyQr-.jpg,,,,,,,[],,,,
1013009066971553792,1013009066971553792,2018-06-30 16:09:17 IST,2018-06-30,16:09:17,+0530,11104872,patrickw,Patrick W. Watson,,Harley-Davidson has bigger problems that Trump tweets. FT summarizes nicely in three sentences. $HOG  https://t.co/Jpim62AMU7  https://t.co/fxQBCrzehb,en,[],['https://www.ft.com/content/8d55adbe-7b87-11e8-8e67-1e1a0846c475?desktop=true&segmentId=7c8f09b9-9b61-4fbb-9430-9208a9e233c8'],['https://pbs.twimg.com/media/Dg7uQHsUcAEzGiG.jpg'],1,2,12,[],['hog'],https://twitter.com/PatrickW/status/1013009066971553792,False,,1,https://pbs.twimg.com/media/Dg7uQHsUcAEzGiG.jpg,,,,,,,[],,,,
1012681815004532736,1012681815004532736,2018-06-29 18:28:54 IST,2018-06-29,18:28:54,+0530,949645952,rudnit,Jake Rudnitsky,,"Hog heaven? Lenin's hometown, the Russian rust belt city Ulyankovsk, has invited Harley Davidson to set up shop to dodge EU tariffs #TradeWar  https://t.co/Zs4yjtTqsJ",en,[],['https://twitter.com/lentaruofficial/status/1012681029654630400'],[],0,9,10,['tradewar'],[],https://twitter.com/Rudnit/status/1012681815004532736,False,https://twitter.com/lentaruofficial/status/1012681029654630400,0,,,,,,,,[],,,,
1012667768594935813,1012667768594935813,2018-06-29 17:33:05 IST,2018-06-29,17:33:05,+0530,1652541,reuters,Reuters,,Trump praises Taiwanese high-tech company Foxconn and vaguely threatens motorcycle maker Harley-Davidson on Wisconsin trip  https://t.co/CxSKAp5lcD by @jeffmason1 $HOG  https://t.co/uAWJsUKwSF,en,"[{'screen_name': 'jeffmason1', 'name': 'jeff mason', 'id': '120180668'}]",['https://reut.rs/2tF917f'],['https://pbs.twimg.com/media/Dg239_gW4AA0vlo.jpg'],14,31,24,[],['hog'],https://twitter.com/Reuters/status/1012667768594935813,False,,1,https://pbs.twimg.com/media/Dg239_gW4AA0vlo.jpg,,,,,,,[],,,,
1012607372928409606,1012607372928409606,2018-06-29 13:33:05 IST,2018-06-29,13:33:05,+0530,15110357,reutersbiz,Reuters Business,,'Don’t get cute with us': Trump vaguely threatens motorcycle maker Harley-Davidson on Wisconsin trip  https://t.co/8yrY4keied via @jeffmason1 $HOG  https://t.co/A3aNZChM3y,en,"[{'screen_name': 'jeffmason1', 'name': 'jeff mason', 'id': '120180668'}]",['https://reut.rs/2yTw831'],['https://pbs.twimg.com/media/Dg2BCdMU8AEsoxu.jpg'],2,3,7,[],['hog'],https://twitter.com/ReutersBiz/status/1012607372928409606,False,,1,https://pbs.twimg.com/media/Dg2BCdMU8AEsoxu.jpg,,,,,,,[],,,,
1012607115448418304,1012607115448418304,2018-06-29 13:32:04 IST,2018-06-29,13:32:04,+0530,1652541,reuters,Reuters,,'Don’t get cute with us': Trump vaguely threatens motorcycle maker Harley-Davidson on Wisconsin trip  https://t.co/bGRIP8EQyj by @jeffmason1 $HOG  https://t.co/NWiaz6gBaU,en,"[{'screen_name': 'jeffmason1', 'name': 'jeff mason', 'id': '120180668'}]",['https://reut.rs/2KhFrPC'],['https://pbs.twimg.com/media/Dg2AzhBWsAAVokw.jpg'],13,26,34,[],['hog'],https://twitter.com/Reuters/status/1012607115448418304,False,,1,https://pbs.twimg.com/media/Dg2AzhBWsAAVokw.jpg,,,,,,,[],,,,
