id,conversation_id,created_at,date,time,timezone,user_id,username,name,place,tweet,language,mentions,urls,photos,replies_count,retweets_count,likes_count,hashtags,cashtags,link,retweet,quote_url,video,thumbnail,near,geo,source,user_rt_id,user_rt,retweet_id,reply_to,retweet_date,translate,trans_src,trans_dest
1211777611170549760,1211692451242631168,2019-12-31 04:04:30 IST,2019-12-31,04:04:30,+0530,860793234,jeannielee88,JeannieLee@CBC,,"Also, MacDonald &amp; Dettwiler started their business in - what else? - a garage  Other notable enterprises launched in garages: Amazon, Apple, Dell, Disney, Google, Harley Davidson, Mattel; Microsoft  $MAXR $AMZN $AAPL $DELL $DIS $GOOGL $HOG $MAT $MSFT  #cdnbiz  https://t.co/dMTls4Iwmk",en,[],[],['https://pbs.twimg.com/tweet_video_thumb/ENEZT9qXkAY-3PM.jpg'],1,0,5,['cdnbiz'],"['maxr', 'amzn', 'aapl', 'dell', 'dis', 'googl', 'hog', 'mat', 'msft']",https://twitter.com/JeannieLee88/status/1211777611170549760,False,,1,https://pbs.twimg.com/tweet_video_thumb/ENEZT9qXkAY-3PM.jpg,,,,,,,[],,,,
1198619884399333376,1198619884399333376,2019-11-24 20:40:24 IST,2019-11-24,20:40:24,+0530,22258623,jewelrymandave,David T. Salerno,,"Solid Sterling Silver Motorcycle Charm, Harley Davidson Charm, Rider, Hog, Bike, Cycle, Hell's Angels, Necklace Charm, Bracelet Charm, Biker  https://t.co/yvWgU0NyOU via @Etsy",en,"[{'screen_name': 'etsy', 'name': 'etsy', 'id': '11522502'}]",['https://etsy.me/2pKOgIz'],[],0,7,6,[],[],https://twitter.com/jewelrymandave/status/1198619884399333376,False,,0,,,,,,,,[],,,,
1196963453530980352,1196963453530980352,2019-11-20 06:58:20 IST,2019-11-20,06:58:20,+0530,836791621987479556,vintagevanshop,Vintage Van Shop,,Reworked Harley Davidson Motorcycles Hog Wild Flames Biker Bab by VintageVanShop  https://t.co/JS2dxk6R9l via @Etsy,en,"[{'screen_name': 'etsy', 'name': 'etsy', 'id': '11522502'}]",['https://etsy.me/2rXYpCt'],[],0,13,7,[],[],https://twitter.com/VintageVanShop/status/1196963453530980352,False,,0,,,,,,,,[],,,,
1196541088166764544,1196541088166764544,2019-11-19 03:00:00 IST,2019-11-19,03:00:00,+0530,28123142,12newsnow,12NewsNow,,"HEARTWARMING 💕 Children in Southeast Texas hospitals woke up to a special gift this morning. The Cowboy Harley-Davidson Hog Chapter of Beaumont participated in their 3rd annual Teddy Bear Run + delivered 1,000 teddy bears to muscular dystrophy patients.  https://t.co/5qmzDYFzpz",en,[],['https://www.12newsnow.com/article/life/heartwarming/bikers-deliver-1000-teddy-bears-to-children-in-hospitals-across-southeast-texas/502-e020b938-41d0-4c83-a764-3b937fe41dfa'],[],1,3,11,[],[],https://twitter.com/12NewsNow/status/1196541088166764544,False,,0,,,,,,,,[],,,,
1194135980048932864,1194135980048932864,2019-11-12 11:42:58 IST,2019-11-12,11:42:58,+0530,363769472,trillgrandpa,Fontaine Belafonte,,"*in heaven, at a round table discussion with history's greatest philosophers*   ""Many Harley Davidson owners call themselves hog riders, though I would never want my hog to be ridden by one""  *everyone nods*",en,[],[],[],0,1,6,[],[],https://twitter.com/TrillGrandpa/status/1194135980048932864,False,,0,,,,,,,,[],,,,
1194113132744056832,1194113132744056832,2019-11-12 10:12:11 IST,2019-11-12,10:12:11,+0530,876045241,robertpatrickt2,Robert Patrick 🇺🇸,,Hog Wild! Harley-Davidson Just Debuted Two New Bikes With Liquid-Cooled Engines  https://t.co/mlEjQAw00g via @RobbReport,en,"[{'screen_name': 'robbreport', 'name': 'robbreport', 'id': '45894866'}]",['https://robbreport.com/motors/motorcycles/hog-wild-harley-davidson-just-debuted-two-new-bikes-with-liquid-cooled-engines-2878549/#utm_medium=social&utm_source=twitter&utm_campaign=social_bar&utm_content=bottom&utm_id=2878549'],[],0,0,24,[],[],https://twitter.com/robertpatrickT2/status/1194113132744056832,False,,0,,,,,,,,[],,,,
1191388185382858755,1191388185382858755,2019-11-04 21:44:12 IST,2019-11-04,21:44:12,+0530,69183155,detikcom,detikcom,,"Bikers Harley-Davidson Owner Group (HOG) Anak Elang akan touring Cikampek Bali di musim hujan. Bagi bikers moge, hujan tak jadi masalah. Ini lho kata mereka: #Moge #HarleyDavidson  via @detikoto  https://t.co/pAkIJtB1Pb",in,"[{'screen_name': 'detikoto', 'name': 'detikoto', 'id': '80543284'}]",['https://oto.detik.com/motor/d-4770949/bikers-moge-hadapi-cuaca-hujan-tak-kepanasan-panas-tak-kehujanan?utm_content=detikoto&utm_term=echobox&utm_medium=oa&utm_campaign=detikcomsocmed&utm_source=Twitter#Echobox=1572840839'],[],4,4,16,"['moge', 'harleydavidson']",[],https://twitter.com/detikcom/status/1191388185382858755,False,,0,,,,,,,,[],,,,
1190546606665478144,1190546606665478144,2019-11-02 14:00:04 IST,2019-11-02,14:00:04,+0530,38160734,hogeurope,"HOGEurope,ME&Africa",,From the Archives – a look at how a Harley-Davidson dealership looked in 1930! How times have changed... #HarleyDavidson #HOG #HarleyOwnersGroup #Motorcycle #Biker #Bikerlife #Archives #Dealership  https://t.co/xhOtHXeC63,en,[],[],['https://pbs.twimg.com/media/EIWr1EJWsAAzdZW.jpg'],1,2,14,"['harleydavidson', 'hog', 'harleyownersgroup', 'motorcycle', 'biker', 'bikerlife', 'archives', 'dealership']",[],https://twitter.com/HOGEurope/status/1190546606665478144,False,,1,https://pbs.twimg.com/media/EIWr1EJWsAAzdZW.jpg,,,,,,,[],,,,
1186637144565178369,1186637144565178369,2019-10-22 19:05:16 IST,2019-10-22,19:05:16,+0530,114782468,carlquintanilla,Carl Quintanilla,,"* HARLEY-DAVIDSON SAYS EXPECTS BUSINESS TO REMAIN UNDER PRESSURE AS U.S. AND DEVELOPED INTERNATIONAL MARKETS CONTINUE TO FACE SUBSTANTIAL HEADWINDS - CONF. CALL  (via @reuters) $HOG  (Stock still up 7.4%, on earnings beat)",en,"[{'screen_name': 'reuters', 'name': 'reuters', 'id': '1652541'}]",[],[],3,2,15,[],['hog'],https://twitter.com/carlquintanilla/status/1186637144565178369,False,,0,,,,,,,,[],,,,
1186589795448958976,1186589795448958976,2019-10-22 15:57:07 IST,2019-10-22,15:57:07,+0530,857693619406467072,gualestrit,Gualestrit,,Resultados 🔥 antes de la apertura:  ▪️ McDonald's $MCD ▪️ Procter &amp; Gamble $PG ▪️ Lockheed Martin $LMT ▪️ UPS $UPS ▪️ United Technologies $UTX ▪️ Biogen $BIIB ▪️ Hasbro $HAS ▪️ JetBlue $JBLU ▪️ Harley-Davidson $HOG ▪️ Kimberly-Clark $KMB ▪️ Travelers $TRV,en,[],[],[],2,17,32,[],"['mcd', 'pg', 'lmt', 'ups', 'utx', 'biib', 'has', 'jblu', 'hog', 'kmb', 'trv']",https://twitter.com/gualestrit/status/1186589795448958976,False,,0,,,,,,,,[],,,,
1183803976967446528,1183803976967446528,2019-10-14 23:27:16 IST,2019-10-14,23:27:16,+0530,857693619406467072,gualestrit,Gualestrit,,Harley Davidson suspende temporalmente la producción de su moto eléctrica por problemas de control de calidad.  $HOG   https://t.co/hnFi8MVd7c,es,[],['https://www.wsj.com/articles/harley-davidson-halts-electric-motorcycle-production-11571073048'],[],1,12,9,[],['hog'],https://twitter.com/gualestrit/status/1183803976967446528,False,,0,,,,,,,,[],,,,
1183792670004658186,1183792670004658186,2019-10-14 22:42:20 IST,2019-10-14,22:42:20,+0530,59393368,livesquawk,LiveSquawk,,$HOG Harley-Davidson Halts Electric Motorcycle Production – WSJ  https://t.co/UE6fMROGls,en,[],['https://www.wsj.com/articles/harley-davidson-halts-electric-motorcycle-production-11571073048?mod=searchresults&page=1&pos=1'],[],0,7,8,[],['hog'],https://twitter.com/LiveSquawk/status/1183792670004658186,False,,0,,,,,,,,[],,,,
1183475595289780225,1183475595289780225,2019-10-14 01:42:24 IST,2019-10-14,01:42:24,+0530,1171099180342894592,paktimestweets,The Pakistan Times,,Harley Davidson Bike Rally in support of Shaukat Khanum Breast Cancer Awareness Campaign.  Ride For Cause Pakistan Strings Faysal Quraishi Aijazz Aslam The Iron Brotherhood - MC The Tribe ‘MC’HOG Karachi Fresolz Infinity Hub Sportster Squad #HOGXplorer  https://t.co/SpWPI3QH1c,en,[],[],"['https://pbs.twimg.com/media/EGyMw8mXkAM1rBV.jpg', 'https://pbs.twimg.com/media/EGyMw8xXkAI-u7y.jpg', 'https://pbs.twimg.com/media/EGyMw8dWwAA45dr.jpg', 'https://pbs.twimg.com/media/EGyMw8lX4AADN4c.jpg']",3,7,65,['hogxplorer'],[],https://twitter.com/PakTimesTweets/status/1183475595289780225,False,,1,https://pbs.twimg.com/media/EGyMw8mXkAM1rBV.jpg,,,,,,,[],,,,
1177648028481675265,1177648028481675265,2019-09-27 23:45:44 IST,2019-09-27,23:45:44,+0530,971324375646470145,alfapoweruk,Alfa Power,,"*CHARGE YOUR HOG!*  With the fully electric Harley-Davidson LiveWire launching soon, we are excited to have installed a 25 kW DC Wallbox at Sycamore Harley-Davidson, Uppingham, LE15 9RN.  #HarleyDavidson #EV  https://t.co/mcN563VR72",en,[],[],"['https://pbs.twimg.com/media/EFfYozgX0AEgGbk.jpg', 'https://pbs.twimg.com/media/EFfYozgWoAAneW1.jpg']",2,4,42,"['harleydavidson', 'ev']",[],https://twitter.com/alfapoweruk/status/1177648028481675265,False,,1,https://pbs.twimg.com/media/EFfYozgX0AEgGbk.jpg,,,,,,,[],,,,
1174066759734910976,1174066759734910976,2019-09-18 02:35:03 IST,2019-09-18,02:35:03,+0530,22258623,jewelrymandave,David T. Salerno,,"Solid Sterling Silver Motorcycle Charm, Harley Davidson Charm, Rider, Hog, Bike, Cycle, Hell's Angels, Necklace Charm, Bracelet Charm, Biker  https://t.co/VCWRsT84vM #jewelrymandave #Etsy #HarleyCharm  https://t.co/JdaF4psqSg",en,[],['http://tuppu.net/e80bb1ce'],['https://pbs.twimg.com/media/EEsffwCWsAIE1nz.jpg'],0,5,5,"['jewelrymandave', 'etsy', 'harleycharm']",[],https://twitter.com/jewelrymandave/status/1174066759734910976,False,,1,https://pbs.twimg.com/media/EEsffwCWsAIE1nz.jpg,,,,,,,[],,,,
1169581670632218625,1169581670632218625,2019-09-05 17:32:54 IST,2019-09-05,17:32:54,+0530,37960384,patsavageband,Pat Savage 🇨🇦,,“Pat performed for us at the 5th National HOG Rally and absolutely knocked us out with his words about our Harley Davidson lifestyle. 26 HOG Chapters were in attendance and all agree: Pat Savage is The King Of Biker Music! @puribikram   Bikram Puri National HOG Director India  https://t.co/XM800XJDeK,en,"[{'screen_name': 'puribikram', 'name': 'bikram puri', 'id': '561369189'}]",[],['https://pbs.twimg.com/media/EDswU_6XkAAo46e.jpg'],0,3,8,[],[],https://twitter.com/patsavageband/status/1169581670632218625,False,,1,https://pbs.twimg.com/media/EDswU_6XkAAo46e.jpg,,,,,,,[],,,,
1167428589492547584,1167428589492547584,2019-08-30 18:57:20 IST,2019-08-30,18:57:20,+0530,226123287,harley_italia,Harley-Davidson IT,,"In occasione della 3ª edizione del raduno benefico “Run delle Valli”, Harley-Davidson Italia e HOG sono stati lieti di portare solidarietà alle popolazioni del centro Italia e di consegnare una targa commemorativa a favore delle vittime del terremoto.    https://t.co/kl8Of5zX4W  https://t.co/i8g0ll0p2v",it,[],['http://bit.ly/H-D-motori-e-solidarietà'],"['https://pbs.twimg.com/media/EDOKHBDX4AAL2L6.jpg', 'https://pbs.twimg.com/media/EDOKHNvXUAA66AB.jpg', 'https://pbs.twimg.com/media/EDOKHXsXkAAizsy.jpg']",0,1,12,[],[],https://twitter.com/Harley_Italia/status/1167428589492547584,False,,1,https://pbs.twimg.com/media/EDOKHBDX4AAL2L6.jpg,,,,,,,[],,,,
1165840504849936385,1165840504849936385,2019-08-26 09:46:51 IST,2019-08-26,09:46:51,+0530,906328017986899968,the_chart_life,"Ian McMillan, CMT",,"$HOG Harley-Davidson ...If you were looking for a fresh entry/setup to short this thing, here ya go.  https://t.co/9fBzeWXYVa",en,[],[],['https://pbs.twimg.com/media/EC3lwj8WkAI9zrS.jpg'],1,2,28,[],['hog'],https://twitter.com/the_chart_life/status/1165840504849936385,False,,1,https://pbs.twimg.com/media/EC3lwj8WkAI9zrS.jpg,,,,,,,[],,,,
1163515839393521666,1163515839393521666,2019-08-19 23:49:27 IST,2019-08-19,23:49:27,+0530,37960384,patsavageband,Pat Savage 🇨🇦,,"Ray Weishaar was one of the best known motorcycle racing stars of the 1910s &amp; 1920s. He rode the board &amp; dirt tracks for the Harley-Davidson factory racing team. Weishaar is seen here with the famous team Harley ""hog"" mascot on the tank of his bike.   https://t.co/osieYjlBc4  https://t.co/CFsUpy4aG7",en,[],['https://thesavageroads.blogspot.com/2013/09/hog-wild-over-harley-davidson-hog-boys.html'],['https://pbs.twimg.com/media/ECWjfDPXsAAYBkN.jpg'],2,5,15,[],[],https://twitter.com/patsavageband/status/1163515839393521666,False,,1,https://pbs.twimg.com/media/ECWjfDPXsAAYBkN.jpg,,,,,,,[],,,,
1161653706376396800,1161653706376396800,2019-08-14 20:30:00 IST,2019-08-14,20:30:00,+0530,20119344,greenbackd,Tobias Carlisle,,"""Better than a monopoly is a pseudo-monopoly. Because they don’t have the legal pressure of it. I’ll give you a good example, is $HOG. Harley-Davidson does not make motorcycles. Harley-Davidson makes Harley-Davidsons, and they’re the only one who does that.""  @EddyElfenbein",en,"[{'screen_name': 'eddyelfenbein', 'name': 'eddy elfenbein', 'id': '41516710'}]",[],[],2,5,31,[],['hog'],https://twitter.com/Greenbackd/status/1161653706376396800,False,https://twitter.com/acquirersx/status/1161565468232159232,0,,,,,,,,[],,,,
1159130371163918336,1159130371163918336,2019-08-07 21:23:10 IST,2019-08-07,21:23:10,+0530,37960384,patsavageband,Pat Savage 🇨🇦,,"Savage Roads: 35 Harley Blogs   There's nothing like the sound of a Harley Davidson getting fired up &amp; ready to hit the road. It’s a special sound &amp; if you've ever gone hog wild yourself, you know riding one is not just about a fine piece of machinery.    https://t.co/a17xj20WOT  https://t.co/Vu1Y6oh3lo",en,[],['https://thesavageroads.blogspot.com/2014/12/35-harley-blogs.html'],['https://pbs.twimg.com/media/EBYO7UcXUAUmubR.jpg'],1,1,8,[],[],https://twitter.com/patsavageband/status/1159130371163918336,False,,1,https://pbs.twimg.com/media/EBYO7UcXUAUmubR.jpg,,,,,,,[],,,,
1158862593509023752,1158862593509023752,2019-08-07 03:39:07 IST,2019-08-07,03:39:07,+0530,29975646,bpsandpieces,Phil Huber,,That sound you hear is sell-side analysts for Harley-Davidson feverishly drafting ‘Feral HOG’ puns for their next research report,en,[],[],[],1,0,9,[],[],https://twitter.com/bpsandpieces/status/1158862593509023752,False,,0,,,,,,,,[],,,,
1154049869939482626,1154049869939482626,2019-07-24 20:55:04 IST,2019-07-24,20:55:04,+0530,61292961,seemacnbc,Seema Mody,,"Companies mentioning plans to move production out of China and source elsewhere during Q2 earnings: Harley Davidson (Thailand), iRobot (Malaysia), General Parts (many EMs), Hasbro (India, Vietnam). $HOG, $HAS, $IRBT, $GPC",en,[],[],[],0,5,12,[],"['hog', 'has', 'irbt', 'gpc']",https://twitter.com/seemacnbc/status/1154049869939482626,False,,0,,,,,,,,[],,,,
1153707079737237504,1153707079737237504,2019-07-23 22:12:57 IST,2019-07-23,22:12:57,+0530,707743584359882753,thepitboss16,ThePitBoss,,Harley Davidson Profit Lower But Positive Rider and Sales Forecasts $HOG $SPX #harleydavidson  https://t.co/Z6U5Zw3wJr  https://t.co/b6Kx4Y7J9g,en,[],['https://traderscommunity.com/index.php/stocks/earnings-reports/1623-harley-davidson-earnings-outlook'],['https://pbs.twimg.com/media/EALKeN3XYAEhNUj.png'],0,4,5,['harleydavidson'],"['hog', 'spx']",https://twitter.com/ThePitBoss16/status/1153707079737237504,False,,1,https://pbs.twimg.com/media/EALKeN3XYAEhNUj.png,,,,,,,[],,,,
1153645894715301890,1153645894715301890,2019-07-23 18:09:49 IST,2019-07-23,18:09:49,+0530,114782468,carlquintanilla,Carl Quintanilla,,Harley-Davidson retail sales:  * US down 8% * Europe down 12.5% * worldwide down 8.4%  $HOG   https://t.co/9sPi5bdA45,en,[],['https://www.bloomberg.com/news/articles/2019-07-23/harley-lowers-profit-margin-outlook-as-slump-spreads-to-europe'],[],16,32,40,[],['hog'],https://twitter.com/carlquintanilla/status/1153645894715301890,False,,0,,,,,,,,[],,,,
1152563936950149122,1152563936950149122,2019-07-20 18:30:30 IST,2019-07-20,18:30:30,+0530,2696709092,espncoastal,ESPN Coastal,,"Today all over South Georgia, live 12-4p from Harley-Davidson in #Savannah we're going to find out who has the best barbecue.   @ESPNCoastal's KING OF THE HOG CONTEST 🐖   Meet your celebrity JUDGES 💯  https://t.co/PE4hVFma5G",en,"[{'screen_name': 'espncoastal', 'name': 'espn coastal', 'id': '2696709092'}]",[],['https://pbs.twimg.com/media/D_66r5QWwAENAsK.jpg'],0,5,9,['savannah'],[],https://twitter.com/ESPNCoastal/status/1152563936950149122,False,,1,https://pbs.twimg.com/media/D_66r5QWwAENAsK.jpg,,,,,,,[],,,,
1151325650738974726,1151325650738974726,2019-07-17 08:30:00 IST,2019-07-17,08:30:00,+0530,16665516,therealautoblog,Autoblog,,2020 Harley-Davidson LiveWire First Ride Review | This hog is shockingly good:  https://t.co/qgbQ8dqGu0  https://t.co/o5bOO1xfq0,en,[],['http://bit.ly/2kf8583'],['https://pbs.twimg.com/media/D_nRZMBXUAEbIIs.jpg'],4,6,42,[],[],https://twitter.com/therealautoblog/status/1151325650738974726,False,,1,https://pbs.twimg.com/media/D_nRZMBXUAEbIIs.jpg,,,,,,,[],,,,
1150097425601708032,1150097425601708032,2019-07-13 23:09:28 IST,2019-07-13,23:09:28,+0530,1099426984604491776,hogtucson,Tucson HOG Chapter,,"@whatsuptucson come out to Harley Davidson for our Hogs and dogs event! Enjoy hamburgers, hotdogs and watermelon and meet your local HOG chapter members. Don’t forget to feed the pig!  https://t.co/JT1MKYlO0X",en,[],[],['https://pbs.twimg.com/media/D_X3grlVAAYhIug.jpg'],1,3,7,[],[],https://twitter.com/HogTucson/status/1150097425601708032,False,,1,https://pbs.twimg.com/media/D_X3grlVAAYhIug.jpg,,,,,,,[],,,,
1149709105495465984,1149709105495465984,2019-07-12 21:26:25 IST,2019-07-12,21:26:25,+0530,99458922,dunyanews,Dunya News,,Harley-Davidson's electric Hog: 0 to 60 mph in 3 seconds  https://t.co/0Bwa5cusmi  https://t.co/aPYrUpXTeQ,en,[],['http://dunyanews.tv/en/Technology/500088-Harley-Davidson-electric-Hog-60-mph-3-seconds/'],['https://pbs.twimg.com/media/D_SWVtCX4AApeBU.jpg'],1,4,37,[],[],https://twitter.com/DunyaNews/status/1149709105495465984,False,,1,https://pbs.twimg.com/media/D_SWVtCX4AApeBU.jpg,,,,,,,[],,,,
1149457339402969089,1149457339402969089,2019-07-12 04:46:00 IST,2019-07-12,04:46:00,+0530,18999261,fox10phoenix,FOX 10 Phoenix,,The new Harley-Davidson LiveWire electric hog does 0-60 in 3 seconds.  https://t.co/8GTIY7CkLv  https://t.co/mkwv5HiBex,en,[],['http://bit.ly/2xMpN5W'],['https://pbs.twimg.com/media/D_OI1qSUcAArF55.jpg'],3,8,18,[],[],https://twitter.com/FOX10Phoenix/status/1149457339402969089,False,,1,https://pbs.twimg.com/media/D_OI1qSUcAArF55.jpg,,,,,,,[],,,,
1149432980554821632,1149432980554821632,2019-07-12 03:09:12 IST,2019-07-12,03:09:12,+0530,10648962,seattlepi,SeattlePI,,Harley-Davidson's electric Hog: 0-60 in 3 seconds  https://t.co/b2IJIStYbb,en,[],['https://trib.al/iTWwl7L'],[],0,2,5,[],[],https://twitter.com/seattlepi/status/1149432980554821632,False,,0,,,,,,,,[],,,,
1149347692906188801,1149347692906188801,2019-07-11 21:30:18 IST,2019-07-11,21:30:18,+0530,857693619406467072,gualestrit,Gualestrit,,"Harley Davidson anuncia LiveWire, la primera Harley eléctrica, desde $29,799.  $HOG  https://t.co/hap5YmAnEW",es,[],[],['https://pbs.twimg.com/media/D_NNoRlXkAEWIgG.jpg'],4,20,57,[],['hog'],https://twitter.com/gualestrit/status/1149347692906188801,False,,1,https://pbs.twimg.com/media/D_NNoRlXkAEWIgG.jpg,,,,,,,[],,,,
1149346887486595072,1149346887486595072,2019-07-11 21:27:06 IST,2019-07-11,21:27:06,+0530,114782468,carlquintanilla,Carl Quintanilla,,"$HOG  * HARLEY-DAVIDSON INC - ANNOUNCES HARLEY-DAVIDSON LIVEWIRE,  AN ALL-ELECTRIC MOTORCYCLE   * HARLEY-DAVIDSON INC - LIVEWIRE MSRP IS $29,799",en,[],[],[],5,7,13,[],['hog'],https://twitter.com/carlquintanilla/status/1149346887486595072,False,,0,,,,,,,,[],,,,
1149139830422421504,1149139830422421504,2019-07-11 07:44:20 IST,2019-07-11,07:44:20,+0530,830522446998499329,carsonklein_,carçon,,my c*ck               my harley davidson                     🤝 “wanna go for a ride on my hog ?”,en,[],[],[],0,1,5,[],[],https://twitter.com/carsonklein_/status/1149139830422421504,False,,0,,,,,,,,[],,,,
1141290883150700544,1141290883150700544,2019-06-19 15:55:25 IST,2019-06-19,15:55:25,+0530,2704294333,deitaone,*Walter Bloomberg,,HARLEY-DAVIDSON STRIKES PARTNERSHIP TO MAKE SMALL MOTORCYCLES IN CHINA $HOG,en,[],[],[],4,5,13,[],['hog'],https://twitter.com/DeItaone/status/1141290883150700544,False,,0,,,,,,,,[],,,,
1136595177911529472,1136595177911529472,2019-06-06 16:56:21 IST,2019-06-06,16:56:21,+0530,17467329,strokersdallas,Rick Fairless,,"Once upon a time, when I was 15 years old, I had a Racing Honda CL100. I used to ride it and dream that I was riding a Harley Davidson Hog! Now I’m dreaming that I was 15 again! #rickfairless #strokersdallas #punchwallygarage #beatleshaircut #turntheclockback  https://t.co/ud8sBpxuNW",en,[],[],['https://pbs.twimg.com/media/D8X_SkLX4AIBoDQ.jpg'],2,1,36,"['rickfairless', 'strokersdallas', 'punchwallygarage', 'beatleshaircut', 'turntheclockback']",[],https://twitter.com/strokersdallas/status/1136595177911529472,False,,1,https://pbs.twimg.com/media/D8X_SkLX4AIBoDQ.jpg,,,,,,,[],,,,
1135063154793205760,1135063154793205760,2019-06-02 11:28:39 IST,2019-06-02,11:28:39,+0530,256290737,jordanmocny,Jordan Mocny,,All these wild hog motherfuckers parking their tricycles at the party . Looking like a Harley Davidson convention. I scrape my leg on some pegs like I’m 13 (BARELY) and Vanessa got me wrapped up in the most jank ass thing I never needed ever.  https://t.co/y9VzIR6lrl,en,[],[],['https://pbs.twimg.com/media/D8CN6_EVsAUU08Z.jpg'],1,0,12,[],[],https://twitter.com/jordanmocny/status/1135063154793205760,False,,1,https://pbs.twimg.com/media/D8CN6_EVsAUU08Z.jpg,,,,,,,[],,,,
1130512372727259136,1130512372727259136,2019-05-20 22:05:28 IST,2019-05-20,22:05:28,+0530,114782468,carlquintanilla,Carl Quintanilla,,"We asked the Harley-Davidson CEO how tariffs are affecting capex decisions. (In their case, it’s forcing them to invest overseas in areas they don’t need.)   @SquawkAlley  @CNBC $HOG  https://t.co/EfCcGHikA0",en,"[{'screen_name': 'squawkalley', 'name': 'squawk alley', 'id': '562995991'}, {'screen_name': 'cnbc', 'name': 'cnbc', 'id': '20402945'}]",[],['https://pbs.twimg.com/media/D7Bh9oNWsAAcCJs.jpg'],1,7,13,[],['hog'],https://twitter.com/carlquintanilla/status/1130512372727259136,False,,1,https://pbs.twimg.com/media/D7Bh9oNWsAAcCJs.jpg,,,,,,,[],,,,
1129440638204825601,1129440638204825601,2019-05-17 23:06:46 IST,2019-05-17,23:06:46,+0530,99009424,dynamopro,Dynamo Pro,,History was made yesterday when Jaden Roller became the first ever winner of the Gateway Harley Davidson Hog Wild championship.  https://t.co/GHBafPpHCF,en,[],[],['https://pbs.twimg.com/media/D6yURUNW0AAwqv4.jpg'],10,1,13,[],[],https://twitter.com/DynamoPro/status/1129440638204825601,False,,1,https://pbs.twimg.com/media/D6yURUNW0AAwqv4.jpg,,,,,,,[],,,,
1127981853355331594,1127981853355331594,2019-05-13 22:30:05 IST,2019-05-13,22:30:05,+0530,22258623,jewelrymandave,David T. Salerno,,"Solid Sterling Silver Motorcycle Charm, Harley Davidson Charm, Rider, Hog, Bike, Cycle, Hell's Angels, Necklace Charm, Bracelet Charm, Biker  https://t.co/0Ct9C7C8Fn via @Etsy",en,"[{'screen_name': 'etsy', 'name': 'etsy', 'id': '11522502'}]",['https://etsy.me/2QaHmW5'],[],0,15,6,[],[],https://twitter.com/jewelrymandave/status/1127981853355331594,False,,0,,,,,,,,[],,,,
1126602060433117187,1126602060433117187,2019-05-10 03:07:17 IST,2019-05-10,03:07:17,+0530,22258623,jewelrymandave,David T. Salerno,,"Solid Sterling Silver Motorcycle Charm, Harley Davidson Charm, Rider, Hog, Bike, Cycle, Hell's Angels, Necklace Charm, Bracelet Charm, Biker  https://t.co/YydTv1zqmr via @Etsy",en,"[{'screen_name': 'etsy', 'name': 'etsy', 'id': '11522502'}]",['https://etsy.me/2VspECY'],[],0,8,6,[],[],https://twitter.com/jewelrymandave/status/1126602060433117187,False,,0,,,,,,,,[],,,,
1121015308616196096,1121015308616196096,2019-04-24 17:07:31 IST,2019-04-24,17:07:31,+0530,322456302,beursanalist,Corné van Zeijl,,"Trump zegt dat Harley Davidson het slachtoffer is van hoger EU import tarieven. Uuh meneer @realDonaldTrump HOG noemt in haar kwartaalbericht zelf de hogere staal en aluminium prijzen, veroorzaakt  door de tarieven die u heeft ingesteld.",nl,"[{'screen_name': 'realdonaldtrump', 'name': 'donald j. trump', 'id': '25073877'}]",[],[],2,2,13,[],[],https://twitter.com/beursanalist/status/1121015308616196096,False,,0,,,,,,,,[],,,,
1121000578530906112,1121000578530906112,2019-04-24 16:08:59 IST,2019-04-24,16:08:59,+0530,120242824,morganlbrennan,Morgan Brennan,,"ICYMI: Harley-Davidson CEO on trade, U.S. retail sales and the role electric motorcycles could play in ridesharing  $HOG  https://t.co/Pa3e2TUJOj",en,[],['https://www.cnbc.com/video/2019/04/23/harley-davidson-ceo-rate-of-decline-in-us-sales-is-slowing.html'],[],3,5,16,[],['hog'],https://twitter.com/MorganLBrennan/status/1121000578530906112,False,,0,,,,,,,,[],,,,
1120643713280151552,1120643713280151552,2019-04-23 16:30:56 IST,2019-04-23,16:30:56,+0530,1029424313164881921,behindthebid,Behind The Bid,,"Shewww.  71 companies reporting earnings today / last night.  Most notable are  Procter &amp; Gamble $PG, Coca-Cola $KO, Whirlpool $WHR, Harley-Davidson $HOG, Hasbro $HAS, Twitter $TWTR, United Technologies $UTX, Quest Diagnostics $DGX, JetBlue Airways $JBLU, Lockheed Martin $LMT",en,[],[],[],0,1,13,[],"['pg', 'ko', 'whr', 'hog', 'has', 'twtr', 'utx', 'dgx', 'jblu', 'lmt']",https://twitter.com/behindthebid/status/1120643713280151552,False,,0,,,,,,,,[],,,,
1120641529557782528,1120641529557782528,2019-04-23 16:22:15 IST,2019-04-23,16:22:15,+0530,59393368,livesquawk,LiveSquawk,,"Harley Davidson 1Q Earnings: $HOG -Adj EPS: 98C (est 85C) -Rev: $1.38B (est $1.22B)  -Gross Margin: 29.1% (est 31.1%) -Sees FY Motorcycle Shipments: 217,000 – 222,000",en,[],[],[],0,10,5,[],['hog'],https://twitter.com/LiveSquawk/status/1120641529557782528,False,,0,,,,,,,,[],,,,
