id,conversation_id,created_at,date,time,timezone,user_id,username,name,place,tweet,language,mentions,urls,photos,replies_count,retweets_count,likes_count,hashtags,cashtags,link,retweet,quote_url,video,thumbnail,near,geo,source,user_rt_id,user_rt,retweet_id,reply_to,retweet_date,translate,trans_src,trans_dest
1124429735063367682,1124429735063367682,2019-05-04 03:15:14 IST,2019-05-04,03:15:14,+0530,117419354,fleurdelysafc,Fleur De Lys Football Club 💙 🏴󠁧󠁢󠁷󠁬󠁳󠁿,,Our U13s play their first ever cup final on May 8th against Tredegar on the 3g in Ebbw Vale. Tough ask against a side yet to taste defeat this season but the boys will give it their all. Whatever the result it's a great achievement by the boys. Good luck lads! #cupfinal🏆⚪⚫⚽️  https://t.co/BqJjXgaRDd,en,[],[],['https://pbs.twimg.com/media/D5rG39nWwAEbu0s.jpg'],0,3,11,['cupfinal'],[],https://twitter.com/fleurdelysafc/status/1124429735063367682,False,,1,https://pbs.twimg.com/media/D5rG39nWwAEbu0s.jpg,,,,,,,[],,,,
1124308511309959168,1123916875388395522,2019-05-03 19:13:32 IST,2019-05-03,19:13:32,+0530,1085927669043064833,trophywifedayna,Participation Trophy Wife 🏆,,"@vale_fache My fitness pal and walking at least two miles everyday. Uphill if possible. I also follow the 80/20 rule. Healthy 80%, indulge 20. And if you like cauliflower it’s a great alternative to rice and potatoes. Think burrito bowls, but with cauliflower rice. I also sub turkey for beef",en,[],[],[],4,1,9,[],[],https://twitter.com/TrophyWifeDayna/status/1124308511309959168,False,,0,,,,,,,,"[{'screen_name': 'vale_fache', 'name': 'momxious', 'id': '943580236020633602'}]",,,,
1124204957274726400,1124169962170535943,2019-05-03 12:22:03 IST,2019-05-03,12:22:03,+0530,335312037,lewis_goodall,Lewis Goodall,,Lib Dem source was right about Vale of White Horse. Spectacular gains again for the Lib Dems. Last LD in 2010. This is a remain area and it's a clear backlash. Just imagine if UKIP were making these gains. We'd be saying it were a political earthquake  https://t.co/DhzqpjtmmH,en,[],[],['https://pbs.twimg.com/media/D5n6TBqXsAA-SV_.png'],25,217,438,[],[],https://twitter.com/lewis_goodall/status/1124204957274726400,False,,1,https://pbs.twimg.com/media/D5n6TBqXsAA-SV_.png,,,,,,,[],,,,
1124037553991106562,1124037553991106562,2019-05-03 01:16:51 IST,2019-05-03,01:16:51,+0530,4185350174,svaletrackfield,SunnyvaleTrack&Field,,It’s a beautiful day to get work done in the Vale! #STATE#G3  https://t.co/OEalVqSGnf,en,[],[],"['https://pbs.twimg.com/media/D5liMZNWAAEnpF1.jpg', 'https://pbs.twimg.com/media/D5liMZTWkAAEgS0.jpg']",0,3,36,[],[],https://twitter.com/SvaleTrackField/status/1124037553991106562,False,,1,https://pbs.twimg.com/media/D5liMZNWAAEnpF1.jpg,,,,,,,[],,,,
1123746986547658754,1123746986547658754,2019-05-02 06:02:14 IST,2019-05-02,06:02:14,+0530,1078212061,betohi,🐶🐹🐼❤TODOS !!!,,Amig@s Acudo1vez más a uds para pedirles ayuda Foto1hermanit@s abandonad@s a su suerte Foto2 quedaron solos quien los cuidaba lo internaron por padecer Alzaheimer Foto3 abandonados en una carretera por favor nos ayudan para comprar alimento El saquito vale $11.900 todo suma 🙏🐶  https://t.co/HadcfBXyFQ,es,[],[],"['https://pbs.twimg.com/media/D5hZ4y9W0AEeiIv.jpg', 'https://pbs.twimg.com/media/D5hZ68yXsAEu0HY.jpg', 'https://pbs.twimg.com/media/D5hZ7JzWwAEssfv.jpg', 'https://pbs.twimg.com/media/D5hZ7ZYWsAQlxky.jpg']",2,131,38,[],[],https://twitter.com/betohi/status/1123746986547658754,False,,1,https://pbs.twimg.com/media/D5hZ4y9W0AEeiIv.jpg,,,,,,,[],,,,
1123612274214744064,1123612274214744064,2019-05-01 21:06:56 IST,2019-05-01,21:06:56,+0530,365151000,michelipablo,Pablo Micheli,,"#FelizDiaDelTrabajador a tod@s mis compañer@s, a l@s que luchan cada día contra este modelo de hambre y exclusión de Macri-FMI construyendo la UNIDAD que necesitamos, ya que, tenemos que estar convencid@s “que cada uno de nosotros, solo, no vale nada”!  https://t.co/GF5AxkPfBU",es,[],[],['https://pbs.twimg.com/media/D5ffYW9XsAElbmc.jpg'],3,8,16,['felizdiadeltrabajador'],[],https://twitter.com/MicheliPablo/status/1123612274214744064,False,,1,https://pbs.twimg.com/media/D5ffYW9XsAElbmc.jpg,,,,,,,[],,,,
1123559893095501825,1123559893095501825,2019-05-01 17:38:47 IST,2019-05-01,17:38:47,+0530,89181980,bonesharman,Andrew Harman,,Couldn’t be more false Gosnells and Canning Vale are dropping dramatically and it’s a lack of transactions at the bottom of the market that are leading to a false median rise  But anything to try and make a positive spin. Even if it means a lack of diligent analysis,en,[],[],[],1,0,8,[],[],https://twitter.com/bonesharman/status/1123559893095501825,False,https://twitter.com/7NewsPerth/status/1123553116656291840,0,,,,,,,,[],,,,
1123424888151134209,1123424888151134209,2019-05-01 08:42:20 IST,2019-05-01,08:42:20,+0530,325343524,rosechacin,Rose,,"Nadie aviso, ninguna cuenta de Twitter, ni ningún periodista, ni rumorologo, lo que hoy pasaría pero les fascina crear zozobra y siguen dándole Rt’s a cuentas amarillistas, y de paso que no han pegado ni una desde hace año dichas cuentas. Sean serios vale!",es,[],[],[],1,5,11,[],[],https://twitter.com/rosechacin/status/1123424888151134209,False,,0,,,,,,,,[],,,,
1123408498807717888,1123304538612686850,2019-05-01 07:37:12 IST,2019-05-01,07:37:12,+0530,318696474,just_like_vale,Valerie∞,,@softsadsatan Okay but he’s a rappist AND a pedophile like that doesn’t even count??? It’s like twice illegal,en,[],[],[],0,1,7,[],[],https://twitter.com/Just_Like_Vale/status/1123408498807717888,False,,0,,,,,,,,"[{'screen_name': 'softsadsatan', 'name': 'kya 🕷', 'id': '1056741949'}]",,,,
1123381077253468162,1123381077253468162,2019-05-01 05:48:14 IST,2019-05-01,05:48:14,+0530,164578685,elguarrolover,El Guarrolover,,🇺🇸 Penis  🇲🇽 Verga  🇺🇸I’m fed up  🇲🇽Estoy hasta la verga  🇺🇸Fuck you  🇲🇽Vete a la verga  🇺🇸I don’t give a fuck  🇲🇽Me vale verga  🇺🇸You look terrible   🇲🇽Te ves de la verga  🇺🇸O M G  🇲🇽A la verga  🇺🇸It’s a mess  🇲🇽Está de la verga  🇺🇸Mexico is the shit  🇲🇽México es la verga,es,[],[],[],0,5,16,[],[],https://twitter.com/ElGuarrolover/status/1123381077253468162,False,,0,,,,,,,,[],,,,
1123280658569355267,1123280658569355267,2019-04-30 23:09:13 IST,2019-04-30,23:09:13,+0530,4797036753,iglesiaymineria,Iglesias y Minería,,"#ValeAssasina En el día de la Asamblea de los accionistas, #RiodeJaneiro - La sede de la Vale S,A., amaneció con un memorial en homenaje a las víctimas fatales y desaparecidas como consecuencia del desastre protagonizado por la empresa.  #Brumadinho  https://t.co/4kVu7QP6yb  https://t.co/fvV5BZmnD3",es,[],['https://www.facebook.com/169392520093347/posts/835875646778361/'],['https://pbs.twimg.com/media/D5axzLZWAAE_o9z.jpg'],0,10,14,"['valeassasina', 'riodejaneiro', 'brumadinho']",[],https://twitter.com/iglesiaymineria/status/1123280658569355267,False,,1,https://pbs.twimg.com/media/D5axzLZWAAE_o9z.jpg,,,,,,,[],,,,
1123230213662547969,1123230213662547969,2019-04-30 19:48:46 IST,2019-04-30,19:48:46,+0530,1540034828,midianinja,Mídia NINJA,,"A sede da Vale S.A., em Botafogo, amanheceu com um memorial em homenagem às vítimas do rompimento da barragem de rejeitos do Córrego de Feijão, em Brumadinho. A ação acontece no dia em que a Vale realiza a sua primeira Assembleia de Acionistas após a catástrofe. 📸DANIELA Fichino  https://t.co/MqEWdZgzOM",pt,[],[],"['https://pbs.twimg.com/media/D5aD6M5WwAE7BgL.jpg', 'https://pbs.twimg.com/media/D5aD6MzXsAI4Dtg.jpg']",0,34,144,[],[],https://twitter.com/MidiaNINJA/status/1123230213662547969,False,,1,https://pbs.twimg.com/media/D5aD6M5WwAE7BgL.jpg,,,,,,,[],,,,
1123190401077104642,1123190401077104642,2019-04-30 17:10:34 IST,2019-04-30,17:10:34,+0530,2733478238,artemis_vale,ArtemisWyrm,,Someone's a bitter failure.,en,[],[],[],0,1,8,[],[],https://twitter.com/Artemis_Vale/status/1123190401077104642,False,https://twitter.com/rianjohnson/status/1123092988748607494,0,,,,,,,,[],,,,
1122982664049324038,1122982664049324038,2019-04-30 03:25:05 IST,2019-04-30,03:25:05,+0530,12515772,adamatsya,On the Diameter of His Noble Height,,"""There's a fellow crying in Martin Place. They can't stop him.""  Vale Les Murray. Of all of his poems, this one comes to me the most often.    https://t.co/XIwm5uwct9",en,[],['https://www.poetrylibrary.edu.au/poets/murray-les/an-absolutely-ordinary-rainbow-0575026'],[],0,0,5,[],[],https://twitter.com/adamatsya/status/1122982664049324038,False,,0,,,,,,,,[],,,,
1122954706412765190,1122954706412765190,2019-04-30 01:34:00 IST,2019-04-30,01:34:00,+0530,19596023,monoesdrujulo,MonoEsdrújulo,,Inglés / Mexicano  🇺🇸 Penis 🇲🇽 Verga 🇺🇸I’m fed up 🇲🇽Estoy hasta la verga 🇺🇸Fuck you 🇲🇽Vete a la verga 🇺🇸I don’t give a fuck 🇲🇽Me vale verga 🇺🇸You look terrible  🇲🇽Te ves de la verga 🇺🇸O M G 🇲🇽A la verga 🇺🇸It’s a mess 🇲🇽Está de la verga 🇺🇸Mexico is the shit 🇲🇽México es la verga,es,[],[],[],0,9,19,[],[],https://twitter.com/MonoEsdrujulo/status/1122954706412765190,False,,0,,,,,,,,[],,,,
1122929927203053568,1122929927203053568,2019-04-29 23:55:32 IST,2019-04-29,23:55:32,+0530,431909283,debhruin,Daithí,,Love #Arya she's a legend Is there enough people left alive for an army between the #northerners knights of the vale #Dothraki and #Unsullied decimated  #Yara doesn't have many soldiers  How can #DaenerysTargaryen win the #GameofThrones  Against #Cersei   https://t.co/BnBGhJBLrI,en,[],['https://youtu.be/ksTqLXLUvQ4'],[],1,0,4,"['arya', 'northerners', 'dothraki', 'unsullied', 'yara', 'daenerystargaryen', 'gameofthrones', 'cersei']",[],https://twitter.com/debhruin/status/1122929927203053568,False,,0,,,,,,,,[],,,,
1122917714295652352,1122670748361998337,2019-04-29 23:07:00 IST,2019-04-29,23:07:00,+0530,456906738,luisfajardohn,Luis Fajardo,,"@paulventura4 MENTIRA, eso es en México 🇺🇸 penis 🇭🇳 pija 🇺🇸 I’m fed up 🇭🇳 estoy a pija  🇺🇸 fuck u 🇭🇳 come mierda hijueputa 🇺🇸 i don’t give a fuck 🇭🇳 me vale pija 🇺🇸 you look terrible 🇭🇳 que’cho pija andas 🇺🇸 OMG 🇭🇳 HIJUEPUTA 🇺🇸 it’s a mess 🇭🇳 que cagadal De nada",es,[],[],[],2,6,44,[],[],https://twitter.com/LuisFajardoHN/status/1122917714295652352,False,,0,,,,,,,,"[{'screen_name': 'paulventura4', 'name': '🐣 ¯\\_(ツ)_/¯', 'id': '917245400'}]",,,,
1122843268453216262,1122843268453216262,2019-04-29 18:11:11 IST,2019-04-29,18:11:11,+0530,1427485484,goraosasuna1987,ITZULIKO GARA C.A.O  🇵🇸,,OS GUSTA VOTAR?SIGAMOS HACIENDOLO EL DOMINGO 12:00 SOLO VALE VOTAR EN ROJO EL ROJO DE NUESTRAS NESKAK.PARA ESO TENEMOS QUE IR TOD@S A COJER LA PAPELETA ALAS TAQUILLAS Y EL DOMINGO VOTAR HASTA QUE LOS CIMIENTOS DEL SADAR(HAGAN QUE LAS NESKAK ROMPAN LA URNA Y REMONTEN!#Osasuna,es,[],[],[],1,1,10,['osasuna'],[],https://twitter.com/goraosasuna1987/status/1122843268453216262,False,,0,,,,,,,,[],,,,
1122731400057147392,1122731400057147392,2019-04-29 10:46:39 IST,2019-04-29,10:46:39,+0530,122197962,yamileth_elisea,Yamileth Elisea,,🇺🇸 Penis 🇲🇽 Verga 🇺🇸I’m fed up 🇲🇽Estoy hasta la verga 🇺🇸Fuck you 🇲🇽Vete a la verga 🇺🇸I don’t give a fuck 🇲🇽Me vale verga 🇺🇸You look terrible  🇲🇽Te ves de la verga 🇺🇸O M G 🇲🇽A la verga 🇺🇸It’s a mess 🇲🇽Está de la verga 🇺🇸Mexico is the shit 🇲🇽México es la verga,es,[],[],[],0,1,6,[],[],https://twitter.com/Yamileth_Elisea/status/1122731400057147392,False,,0,,,,,,,,[],,,,
1122670748361998337,1122670748361998337,2019-04-29 06:45:39 IST,2019-04-29,06:45:39,+0530,917245400,paulventura4,🐣 ¯\_(ツ)_/¯,,🇺🇸 Penis  🇭🇳 Verga 🇺🇸I’m fed up 🇭🇳Estoy hasta la verga 🇺🇸Fuck you 🇭🇳Vete a la verga 🇺🇸I don’t give a fuck  🇭🇳Me vale verga 🇺🇸You look terrible  🇭🇳Te ves de la verga 🇺🇸O M G 🇭🇳A la verga 🇺🇸It’s a mess 🇭🇳Está de la verga 🇺🇸Honduras is the shit 🇭🇳Honduras es la mera verga maje!,es,[],[],[],13,268,700,[],[],https://twitter.com/paulventura4/status/1122670748361998337,False,,0,,,,,,,,[],,,,
1122490929326243841,1122490929326243841,2019-04-28 18:51:07 IST,2019-04-28,18:51:07,+0530,123165648,_carlieyo,Una Norteñita,,🇺🇸 Penis 🇲🇽 Verga 🇺🇸I’m fed up 🇲🇽Estoy hasta la verga 🇺🇸Fuck you 🇲🇽Vete a la verga 🇺🇸I don’t give a fuck 🇲🇽Me vale verga 🇺🇸You look terrible  🇲🇽Te ves de la verga 🇺🇸O M G 🇲🇽A la verga 🇺🇸It’s a mess 🇲🇽Está de la verga 🇺🇸Mexico is the shit 🇲🇽México es la verga,es,[],[],[],31,496,1846,[],[],https://twitter.com/_CarlieYo/status/1122490929326243841,False,,0,,,,,,,,[],,,,
1122428820299055104,1122428820299055104,2019-04-28 14:44:19 IST,2019-04-28,14:44:19,+0530,707156800328568832,mah_gigs,Musicians Against Homelessness,,"It's a biggie from @KikOutTheJams! A couple of weeks after @Jekyllband's Maida Vale set for Radio 1 @huwstephens they headline @Water_Rats with @garageflowerss, @thetrustedband &amp; recently signed to @creation23label @itsRubberJaw. Supporting #MAH in association with @thezineuk  https://t.co/SX17S0VNDI",en,"[{'screen_name': 'kikoutthejams', 'name': 'kick out the jams', 'id': '880445251407753216'}, {'screen_name': 'jekyllband', 'name': 'jekyll', 'id': '241083175'}, {'screen_name': 'huwstephens', 'name': 'huw stephens', 'id': '20106152'}, {'screen_name': 'water_rats', 'name': 'the water rats', 'id': '4005299896'}, {'screen_name': 'garageflowerss', 'name': 'the garage flowers', 'id': '3405557997'}, {'screen_name': 'thetrustedband', 'name': 'the trusted', 'id': '2350589036'}, {'screen_name': 'creation23label', 'name': 'creation23', 'id': '993845676973920256'}, {'screen_name': 'itsrubberjaw', 'name': 'rubberjaw', 'id': '971036573079953411'}, {'screen_name': 'thezineuk', 'name': 'the zine uk', 'id': '1625840702'}]",[],['https://pbs.twimg.com/media/D5Oq7Z0X4AAUjKM.jpg'],0,9,12,['mah'],[],https://twitter.com/MAH_Gigs/status/1122428820299055104,False,,1,https://pbs.twimg.com/media/D5Oq7Z0X4AAUjKM.jpg,,,,,,,[],,,,
1122220624309563395,1122220624309563395,2019-04-28 00:57:01 IST,2019-04-28,00:57:01,+0530,116591415,gideoncalder,Gideon Calder,,"A great event, kicking off a vital campaign which it's a pleasure to be involved in, with @JonLuxton, @jeni_bone, @gpgpenarth, @ShopInPenarth, @people_vale, #Penarth Youth Action - and much appreciated support from @PenarthCouncil",en,"[{'screen_name': 'jonluxton', 'name': 'jon luxton', 'id': '21614816'}, {'screen_name': 'jeni_bone', 'name': 'jeni bone', 'id': '802485109786025984'}, {'screen_name': 'gpgpenarth', 'name': 'gwyrddio penarth greening', 'id': '274517734'}, {'screen_name': 'shopinpenarth', 'name': 'shoppenarth', 'id': '1346514518'}, {'screen_name': 'people_vale', 'name': 'vale people first', 'id': '1031485780190003200'}, {'screen_name': 'penarthcouncil', 'name': 'penarth town council', 'id': '54890200'}]",[],[],0,3,10,['penarth'],[],https://twitter.com/gideoncalder/status/1122220624309563395,False,https://twitter.com/SDoughtyMP/status/1122200390764781568,0,,,,,,,,[],,,,
1121925084426448896,1121925084426448896,2019-04-27 05:22:39 IST,2019-04-27,05:22:39,+0530,105023487,tesfangirrl,TESfangirrl,,I fucking LOVE the Investigator Vale books. I hope there's a new one for the #Elsweyr chapter! Can we get some appreciation for our fav bisexual Breton detective?! Who even cares about racist 'Lusty Argonian' books when we have these absolute gems?! #ESO #ElderScrollsOnline,en,[],[],[],0,1,12,"['elsweyr', 'eso', 'elderscrollsonline']",[],https://twitter.com/TESfangirrl/status/1121925084426448896,False,,0,,,,,,,,[],,,,
1121835829683470339,1121829431859974145,2019-04-26 23:27:59 IST,2019-04-26,23:27:59,+0530,1036387922520498176,jmnaster,Ana Esther JM,,"@mcarmenmaths @juanfisicahr @sergiovsergiov @miprofematania @IsabelGarciasvp @carmeniglesiasb @simplificamates @alegallardo28 Animo a llevar esta S.A. al aula, vale la pena el esfuerzo. Este vídeo fue realizado por una alumna cuya preocupación principal era que no sabía editar vídeos. Y yo  digo “menos mal que no sabía”  Se despertó el interés del gran grupo y se vio mucha ayuda entre ellos, cooperativo",es,[],[],[],1,1,5,[],[],https://twitter.com/JmNaster/status/1121835829683470339,False,,0,,,,,,,,"[{'screen_name': 'mcarmenmaths', 'name': 'mari carmen garcia', 'id': '2409406273'}, {'screen_name': 'juanfisicahr', 'name': 'Juan Francisco', 'id': '2271441404'}, {'screen_name': 'sergiovsergiov', 'name': 'Sergio Darias', 'id': '268419644'}, {'screen_name': 'miprofematania', 'name': 'matania', 'id': '768266336'}, {'screen_name': 'IsabelGarciasvp', 'name': 'Isabel García', 'id': '2359691977'}, {'screen_name': 'carmeniglesiasb', 'name': 'Carmen Iglesias 🙋', 'id': '231761216'}, {'screen_name': 'simplificamates', 'name': 'David Sierra ~ simplificalasmatematicas', 'id': '994738850'}, {'screen_name': 'alegallardo28', 'name': 'Alejandro Gallardo', 'id': '519319371'}]",,,,
1121486645189070849,1121486645189070849,2019-04-26 00:20:27 IST,2019-04-26,00:20:27,+0530,144866296,mptmg,MPT-MG,,"Vale S.A pagará multa diária de R$ 5 mil por trabalhador, caso não cumpra prazos fixados em audiência nesta quarta-feira, 25  Confira:  https://t.co/Ou93OtaVxR #Brumadinho #MPT",pt,[],['https://bit.ly/2IJP0FF'],[],0,0,4,"['brumadinho', 'mpt']",[],https://twitter.com/MPTMG/status/1121486645189070849,False,,0,,,,,,,,[],,,,
1121364189640110080,1121364189640110080,2019-04-25 16:13:51 IST,2019-04-25,16:13:51,+0530,21387875,nmcrecordings,NMC Recordings,,"#DidYouKnow Edward Elgar's 'Symphony No.3' is our best-selling release of all time? Here's a photo from the recording session back in 1997 at Maida Vale Studios... #nmc30 #ThrowbackThursday   (L-R: Colin Matthews, Andrew Davis, Trygg Tryggvason and Anthony Payne)  https://t.co/nEPK6JD56s",en,[],[],['https://pbs.twimg.com/media/D4_iM1AW0AAyln7.jpg'],2,2,8,"['didyouknow', 'nmc30', 'throwbackthursday']",[],https://twitter.com/nmcrecordings/status/1121364189640110080,False,,1,https://pbs.twimg.com/media/D4_iM1AW0AAyln7.jpg,,,,,,,[],,,,
1121238081523339264,1121238081523339264,2019-04-25 07:52:44 IST,2019-04-25,07:52:44,+0530,3824894129,author_pcorrell,Patricia Correll,,"Night Vale fans: I haven't listened to a ton of Night Vale, but there's a terrific little show on Netflix called The Kirlian Frequency that strongly reminds me of what I did hear. Check it out. #thekirlianfrequency #netflix",en,[],[],[],1,0,4,"['thekirlianfrequency', 'netflix']",[],https://twitter.com/Author_PCorrell/status/1121238081523339264,False,,0,,,,,,,,[],,,,
1121201441694261255,1121201441694261255,2019-04-25 05:27:09 IST,2019-04-25,05:27:09,+0530,581166760,soniaramirezra2,SONIA ✨,,"Alguien me explica qué tiene de malo el sexo sin amor? Vale que con amor es otro rollo, pero no es plan de ningunear lo otro o tratar de suci@s a quiénes lo practican, llamadme rara 💁🏻‍♀️",es,[],[],[],0,1,17,[],[],https://twitter.com/SoniaRamirezRa2/status/1121201441694261255,False,,0,,,,,,,,[],,,,
1121089837153443840,1121089837153443840,2019-04-24 22:03:40 IST,2019-04-24,22:03:40,+0530,23010860,alisonmartino,Vintage Los Angeles,,"Here’s a classic...”Don’t squeeze the Charmin!”    Dad, Jerry Vale, Mr. Whipple, and Nick Sovano (Sinatra’s Manager). Taken in 1975  https://t.co/WdJVezIKHK",en,[],[],['https://pbs.twimg.com/media/D47pQ2rUcAAC30i.jpg'],4,4,68,[],[],https://twitter.com/alisonmartino/status/1121089837153443840,False,,1,https://pbs.twimg.com/media/D47pQ2rUcAAC30i.jpg,,,,,,,[],,,,
1120949876072878081,1120949876072878081,2019-04-24 12:47:31 IST,2019-04-24,12:47:31,+0530,227953016,degentleman_,Manny ✂,,"Y'all beware of this account @emperor_vale!! It's a yahoo boy's account from a village in Shagamu. I mean, it's pretty obvious but I'm just putting this out there 😊😊  https://t.co/BKB018gbQH",en,"[{'screen_name': 'emperor_vale', 'name': 'peter smith', 'id': '870959131888427009'}]",[],['https://pbs.twimg.com/media/D45p8WIWsAEpPkC.jpg'],4,11,12,[],[],https://twitter.com/DeGentleman_/status/1120949876072878081,False,,1,https://pbs.twimg.com/media/D45p8WIWsAEpPkC.jpg,,,,,,,[],,,,
1120798305955602432,1120798305955602432,2019-04-24 02:45:14 IST,2019-04-24,02:45:14,+0530,133918104,gargafilho,Luciano Sousa Filho,,"No adestramento em Op de GLO do 24° BIS, realizado em parceria com a Vale S.A., foram aperfeiçoados os planejamentos para a defesa dessa importante estrutura estratégica de nossa área de responsabilidade, além de estreitar os laços institucionais. #AquicomecaaAmazonia #Selva  https://t.co/byTLqFFy4G",pt,[],[],[],1,4,37,"['aquicomecaaamazonia', 'selva']",[],https://twitter.com/gargafilho/status/1120798305955602432,False,,1,https://pbs.twimg.com/ext_tw_video_thumb/1120798156680249344/pu/img/tkk7bgBRIlvK-BDX.jpg,,,,,,,[],,,,
1120767009606836225,1120767007987765248,2019-04-24 00:40:52 IST,2019-04-24,00:40:52,+0530,785906275389505536,danedgardv8ihjl,Daniel E. Capurro,,"Amig@s...he desaparecido en acción...por tantas cosas, que no vale la pena enumerar. Les deseo un fantástico martes y mejor semana, con la mayor felicidad y armonía posible. Cariñ@s a tod@s.  https://t.co/DVuYpdn8Ui",es,"[{'screen_name': 's', 'name': '『s』', 'id': '347002675'}]",[],['https://pbs.twimg.com/media/D43DoQBXsAEalU6.jpg'],2,0,2,[],[],https://twitter.com/danedgardV8ihjl/status/1120767009606836225,False,,1,https://pbs.twimg.com/media/D43DoQBXsAEalU6.jpg,,,,,,,[],,,,
1120766313801105408,1120766313801105408,2019-04-24 00:38:06 IST,2019-04-24,00:38:06,+0530,785906275389505536,danedgardv8ihjl,Daniel E. Capurro,,"Amig@s...he desaparecido en acción...por tantas cosas, que no vale la pena enumerar. Les deseo un fantástico martes y mejor semana, con la mayor felicidad y armonía posible. Cariñ@s a tod@s.  https://t.co/rnJNnKj5r2",es,"[{'screen_name': 's', 'name': '『s』', 'id': '347002675'}]",[],['https://pbs.twimg.com/media/D43C7ODXoAAUKqS.jpg'],2,1,4,[],[],https://twitter.com/danedgardV8ihjl/status/1120766313801105408,False,,1,https://pbs.twimg.com/media/D43C7ODXoAAUKqS.jpg,,,,,,,[],,,,
1120728534123732992,1120725797218783237,2019-04-23 22:07:59 IST,2019-04-23,22:07:59,+0530,48670183,propelforward,Drew Hinkes,,"@RadioWesteros to be clear i'm 100% ok w/this, even if it's a deus ex machina to turn the tide or a replay of the Knights of the Vale coming in to pull victory from the jaws of defeat during the BofB. Based on the big battle happening in ep 3 with 3 more to go, WF isn't the end of the conflict.",en,[],[],[],1,0,5,[],[],https://twitter.com/propelforward/status/1120728534123732992,False,,0,,,,,,,,"[{'screen_name': 'RadioWesteros', 'name': 'Radio Westeros', 'id': '2465148620'}]",,,,
1120726923183828992,1120697403764563968,2019-04-23 22:01:35 IST,2019-04-23,22:01:35,+0530,860186239370219520,nottscworld,Notts County World,,"Fret over, Notts fans 😅  Smurthwaite has since ruled himself out of the bidding, but will be at Notts this Saturday to watch the Pies, With his reason being the fact he lives close to Notts and it’s a serious security issue if he turns up at Vale.   😀",en,[],[],[],3,1,14,[],[],https://twitter.com/NottsCworld/status/1120726923183828992,False,,0,,,,,,,,[],,,,
1120683721697394689,1120683721697394689,2019-04-23 19:09:55 IST,2019-04-23,19:09:55,+0530,259973275,michaellam15,Michaella Medved,,"If someone tells you he/she is from Westeros, there’s a 99.9% chance he/she is actually from one of the following:   Winterfell The Wall The Iron Islands Riverrun The Twins The Vale Casterly Rock  Oldtown Storm’s End Dragonstone King’s Landing Dorne",en,[],[],[],0,1,10,[],[],https://twitter.com/MichaellaM15/status/1120683721697394689,False,https://twitter.com/regulareb/status/1120163786512404480,0,,,,,,,,[],,,,
1120645476250943489,1120645476250943489,2019-04-23 16:37:56 IST,2019-04-23,16:37:56,+0530,89027609,natpirks,Natalie Pirks,,"Sure, It’s a big week for Liverpool and Man City but tonight it’s all about @official_FGFC They will win the title if they beat Tooting Bec in the last game of the season at Raynes Park Vale, aka The Big One™️. Good luck, lads! @Eggieboys",en,"[{'screen_name': 'official_fgfc', 'name': 'frimley green fc', 'id': '2993754203'}, {'screen_name': 'eggieboys', 'name': 'john cook', 'id': '726850872'}]",[],[],2,4,19,[],[],https://twitter.com/Natpirks/status/1120645476250943489,False,,0,,,,,,,,[],,,,
1119873782259298310,1119873782259298310,2019-04-21 13:31:30 IST,2019-04-21,13:31:30,+0530,94985967,hutchie_vale,Hutchison Vale FC,,"Good morning @Edinburgh_CC and @Ed_Leisure. Happy Easter and here’s a wee idea for you, with thanks to Dundee.👇🏻⚽️",en,"[{'screen_name': 'edinburgh_cc', 'name': 'the city of edinburgh council', 'id': '36050142'}, {'screen_name': 'ed_leisure', 'name': 'ed_leisure', 'id': '73421887'}]",[],[],0,7,19,[],[],https://twitter.com/Hutchie_Vale/status/1119873782259298310,False,https://twitter.com/Evening_Tele/status/1119273241506385925,0,,,,,,,,[],,,,
1119841550291427333,1119838656829775872,2019-04-21 11:23:25 IST,2019-04-21,11:23:25,+0530,1960838256,agent_r24,🍀CloverLover69🍀,,"@chalcoyong ""I get separating Vale from Shin Malphur,"" Drifter says, ""But what was the Renegade for? Layin' low?""  Shin curls up tighter at his side, cheek smushed against Drifter's chest and face hidden by his mop of black hair.  There's a beat of silence. Shin answers quietly, ""You.""",en,[],[],[],3,0,24,[],[],https://twitter.com/Agent_R24/status/1119841550291427333,False,,0,,,,,,,,"[{'screen_name': 'chalcoyong', 'name': 'Deep Stoned Crypt 420', 'id': '924470072'}]",,,,
