id,conversation_id,created_at,date,time,timezone,user_id,username,name,place,tweet,language,mentions,urls,photos,replies_count,retweets_count,likes_count,hashtags,cashtags,link,retweet,quote_url,video,thumbnail,near,geo,source,user_rt_id,user_rt,retweet_id,reply_to,retweet_date,translate,trans_src,trans_dest
1168166375363424256,1168159003324624902,2019-09-01 19:49:02 IST,2019-09-01,19:49:02,+0530,12291602,qwrrty,Tim Pierce,,"@JuliusGoat ""Guns don't kill people. It's impossible to be killed by a gun. We are all invincible to bullets, and it's a miracle."" --Welcome to Night Vale",en,[],[],[],0,0,6,[],[],https://twitter.com/qwrrty/status/1168166375363424256,False,,0,,,,,,,,"[{'screen_name': 'JuliusGoat', 'name': 'A.R. Moxon', 'id': '14869615'}]",,,,
1168161589985521666,1168161589985521666,2019-09-01 19:30:01 IST,2019-09-01,19:30:01,+0530,740895416,nightvaleradio,Night Vale podcast,,"NEW EPISODE: 153 - The Heist, Part 1 There's a bank robbery at the Last Bank of Night Vale.  Listen on @ApplePodcasts:  https://t.co/jg2iW2oyb2  More ways to listen:  https://t.co/zfqQdJTnbP  https://t.co/9xjTdFgoU2",en,"[{'screen_name': 'applepodcasts', 'name': 'apple podcasts', 'id': '48436234'}]","['https://podcasts.apple.com/us/podcast/153-the-heist-part-1/id536258179?i=1000448275382', 'https://www.welcometonightvale.com/listen']",['https://pbs.twimg.com/media/EDYWCcJWkAMdVhA.jpg'],4,49,428,[],[],https://twitter.com/NightValeRadio/status/1168161589985521666,False,,1,https://pbs.twimg.com/media/EDYWCcJWkAMdVhA.jpg,,,,,,,[],,,,
1167993063098081281,1167993063098081281,2019-09-01 08:20:21 IST,2019-09-01,08:20:21,+0530,2335453926,ediecreekangus,Edie Creek Angus,,"Here’s a 3yr old Hfr raising a dandy MH Titan 752 son. She’s a Cole Creek Full Bore 730 dtr. Calf is double bred to OCC Great Plains and OCC Homer. Last year she raised the heaviest calf of all our 2yr olds. She was born and raised at Howrey Angus, Vale SD. #HerdBuilders  https://t.co/mYyXCdi6xj",en,[],[],['https://pbs.twimg.com/media/EDWLe71U0AEOVN3.jpg'],1,0,18,['herdbuilders'],[],https://twitter.com/ediecreekangus/status/1167993063098081281,False,,1,https://pbs.twimg.com/media/EDWLe71U0AEOVN3.jpg,,,,,,,[],,,,
1167858839812624384,1167858839812624384,2019-08-31 23:26:59 IST,2019-08-31,23:26:59,+0530,1148203488687599616,clermistonv,Clermiston vale,,After a great result in the cup last week it’s a sore one for the lads today. Controlled the game and bar a few mistakes from the ref we’re into next round! 2-2 beat 5-3 on pens against KSQ fair play to them for sticking in as well. Big one next week tho Mon the vale 💛🤟🏻,en,[],[],[],0,3,8,[],[],https://twitter.com/ClermistonV/status/1167858839812624384,False,,0,,,,,,,,[],,,,
1167825063745396738,1167825063745396738,2019-08-31 21:12:46 IST,2019-08-31,21:12:46,+0530,333915533,officialpvfc,Port Vale FC,,GOOOOOOOOOOOOOOOOOOOOOOOOOOOOOOOAL!!!!!!!! AT LAST SOMETHINGS HAPPENED AND IT'S A VALE GOAL!!!  https://t.co/rjuvNqxyym,en,[],[],[],6,24,158,[],[],https://twitter.com/OfficialPVFC/status/1167825063745396738,False,,1,https://pbs.twimg.com/ext_tw_video_thumb/1167825033844219904/pu/img/2enuOCS4GBrw7hVY.jpg,,,,,,,[],,,,
1167807875504173057,1167807875504173057,2019-08-31 20:04:28 IST,2019-08-31,20:04:28,+0530,251276599,javed0909,JAVED IQBAL SHAH,,"Well what's a son for if not to be by the side of parents in the state @UrmilaMatondkar 's in-laws are in. On a different note u should be celebrating news of being an equal opportunity Kashmiri now, maybe settle down in the beautiful Vale. Always better than long distance calls.",en,"[{'screen_name': 'urmilamatondkar', 'name': 'urmila matondkar', 'id': '1110513045959311361'}]",[],[],29,187,692,[],[],https://twitter.com/JAVED0909/status/1167807875504173057,False,https://twitter.com/timesofindia/status/1167355021823901696,0,,,,,,,,[],,,,
1167741325430665216,1167736804394582016,2019-08-31 15:40:02 IST,2019-08-31,15:40:02,+0530,207949883,danibordas,Dani Bordas,,"@arcitecta Yo me acuerdo mucho de una página de ""La Parejita s.a."" de @ManelFontdevila en la que el padre le decía a la madre que el niño tenía que ser un tiburón. Ella respondía algo así como: ""Vale, ¿y quién va a enseñárselo?"".",es,"[{'screen_name': 'manelfontdevila', 'name': 'manel fontdevila', 'id': '476977725'}]",[],[],0,0,8,[],[],https://twitter.com/DaniBordas/status/1167741325430665216,False,,0,,,,,,,,"[{'screen_name': 'arcitecta', 'name': 'arcitecta', 'id': '177319253'}]",,,,
1167706661190012934,1167706661190012934,2019-08-31 13:22:17 IST,2019-08-31,13:22:17,+0530,91546437,wealdstone_fc,Wealdstone FC Fans,,"Match Day! Apparently, the collective noun for Stones is either cairn, heap or henge. Whichever. There's a lot of Stones there today. Stones v Stones at The Vale today at 3pm.",en,[],[],[],2,1,13,[],[],https://twitter.com/Wealdstone_FC/status/1167706661190012934,False,,0,,,,,,,,[],,,,
1167550486242877441,1167550486242877441,2019-08-31 03:01:42 IST,2019-08-31,03:01:42,+0530,333915533,officialpvfc,Port Vale FC,,A busy one at Vale Park today...   Let’s hope it’s a winning one tomorrow 👊🏻   #PVFC  https://t.co/WgvHuDk0Sf,en,[],[],['https://pbs.twimg.com/media/EDP4-noWkAEKZNU.jpg'],1,3,57,['pvfc'],[],https://twitter.com/OfficialPVFC/status/1167550486242877441,False,,1,https://pbs.twimg.com/media/EDP4-noWkAEKZNU.jpg,,,,,,,[],,,,
1167084655834779648,1167084655834779648,2019-08-29 20:10:39 IST,2019-08-29,20:10:39,+0530,354177774,carrington_bio,Carrington,,"Vale, tod@s somos buenas personas y la venganza está fatal.  Pero entonces... Por qué cada vez que vemos cualquier versión de El Conde de Montecristo se nos cae la baba de una venganza tan bien planificada y nos quedamos pegad@s a la pantalla?  https://t.co/arm9MSmT1S",es,[],[],['https://pbs.twimg.com/tweet_video_thumb/EDJRTWHW4AUCKB1.jpg'],0,0,5,[],[],https://twitter.com/Carrington_BIO/status/1167084655834779648,False,,1,https://pbs.twimg.com/tweet_video_thumb/EDJRTWHW4AUCKB1.jpg,,,,,,,[],,,,
1166868100895125504,1166868100895125504,2019-08-29 05:50:09 IST,2019-08-29,05:50:09,+0530,890590026517622784,vale_boys_ath,Vale Boys Athletics,,It’s a great day to be a @NISDVale Stingray!!! Almost 80 kids in our 7th grade program!! Almost 90 in our 8th grade program!!! #herewecome @CoachConyersVMS @CoachMosleyNISD @JPS_DFB  https://t.co/dW7ArymrkR,en,"[{'screen_name': 'nisdvale', 'name': 'vale middle school', 'id': '80312278'}, {'screen_name': 'coachconyersvms', 'name': 'coach conyers', 'id': '707635195839516672'}, {'screen_name': 'coachmosleynisd', 'name': 'mr. mosley', 'id': '1163450303246741504'}, {'screen_name': 'jps_dfb', 'name': 'stevens hs football', 'id': '753783829291204608'}]",[],['https://pbs.twimg.com/media/EDGMWX1X4AE1F6Y.jpg'],0,1,16,['herewecome'],[],https://twitter.com/Vale_boys_ath/status/1166868100895125504,False,,1,https://pbs.twimg.com/media/EDGMWX1X4AE1F6Y.jpg,,,,,,,[],,,,
1166604058175705088,1166604058175705088,2019-08-28 12:20:56 IST,2019-08-28,12:20:56,+0530,2696319347,paulwiggins1969,Paul Wiggins,,"This simple little photo was taken from the away end at Gigg Lane, Bury Football Club May 4th 2019 v Port Vale. It's a more poignant photo this morning.. Feel for all the staff and fans and all the local businesses that will suffer too.  https://t.co/un8YC1zHsf",en,[],[],['https://pbs.twimg.com/media/EDCcMg4W4AIlXwQ.jpg'],1,1,14,[],[],https://twitter.com/PaulWiggins1969/status/1166604058175705088,False,,1,https://pbs.twimg.com/media/EDCcMg4W4AIlXwQ.jpg,,,,,,,[],,,,
1166167095991832579,1166167095991832579,2019-08-27 07:24:36 IST,2019-08-27,07:24:36,+0530,813068986183274497,kvalenagle,Vale Nagle,,"I was picking up food today and someone stopped me and asked if I'd grown up here. Turns out, a Vale Nagle ten years older than me grew up here.  That's a first for me. Do we fight to the death or how do you handle meeting someone with your name? I've never been plural before.",en,[],[],[],3,0,7,[],[],https://twitter.com/KValeNagle/status/1166167095991832579,False,,0,,,,,,,,[],,,,
1165822153914290176,1165822153914290176,2019-08-26 08:33:56 IST,2019-08-26,08:33:56,+0530,65491451,adsiie,Anianita 🦄✨,,"Asociación de gente que finge durante más de media hora tener una conversación conmigo porque le da pena preguntarme directamente sobre información legal S.A. de C.V.   Sé que te vale verga mi vida, Juan Carlos ya pregúntame por la puta pensión alimenticia.",es,[],[],[],0,0,8,[],[],https://twitter.com/Adsiie/status/1165822153914290176,False,,0,,,,,,,,[],,,,
1165674863232786436,1165674863232786436,2019-08-25 22:48:39 IST,2019-08-25,22:48:39,+0530,3899191229,shrimpsacademy,Morecambe FC Academy,,Here’s a retro looking photo from yesterday’s Youth Team win at Port Vale. Hope everyone is enjoying the Bank Holiday sunshine. #Shrimps  https://t.co/IQVUUp1gC9,en,[],[],['https://pbs.twimg.com/media/EC1PG7sXUAIDCC0.jpg'],0,5,19,['shrimps'],[],https://twitter.com/ShrimpsAcademy/status/1165674863232786436,False,,1,https://pbs.twimg.com/media/EC1PG7sXUAIDCC0.jpg,,,,,,,[],,,,
1165247416838381569,1165247416838381569,2019-08-24 18:30:08 IST,2019-08-24,18:30:08,+0530,3301113970,fredtalks_,"Fred, CEO dos cancelamentos, concorre ao Wipeout",,"Portanto, o Dost vale 3 Naby Sarr, o dobro de um Schelotto, um pouco mais que um Naldo, vale menos que um Elias ou um Pongolle e vale metade de um Vietto. Ou de um Rúben Semedo.  Agora digam lá comigo:  g-e-s-t-ã-o d-a-n-o-s-a!",pt,[],[],[],7,143,367,[],[],https://twitter.com/fredtalks_/status/1165247416838381569,False,,0,,,,,,,,[],,,,
1164914528938790913,1164914528938790913,2019-08-23 20:27:21 IST,2019-08-23,20:27:21,+0530,948604742548312065,grommy_art,Gromy 🐰 (Commissions Open),,"Finished this Personal concept piece for my character Vale last night, will be adding this piece to my portfolio :d  since he's a rogue assassin with thieving habits, I gave him weapons that function both as dual blades but also climbing tools to traverse different terrain  https://t.co/l5XA8Ty4cz",en,[],[],['https://pbs.twimg.com/media/ECqbln4XYAAHJZ7.jpg'],0,0,12,[],[],https://twitter.com/Grommy_Art/status/1164914528938790913,False,,1,https://pbs.twimg.com/media/ECqbln4XYAAHJZ7.jpg,,,,,,,[],,,,
1164722726872862720,1164722726872862720,2019-08-23 07:45:12 IST,2019-08-23,07:45:12,+0530,1424587129,zcolemanhk,Zach Coleman,,"Asked why he assigns his harshest ratings to foreign cos. such as Rio Tinto, Vale and BHP while only giving buy ratings for Chinese cos. such as Shandong Gold, Zhao said: “I did just issue a strong sell rating on Cathay... That’s a HK-incorporated company, not a foreign one.”",en,[],[],[],2,7,14,[],[],https://twitter.com/ZColemanHK/status/1164722726872862720,False,https://twitter.com/tracyalloway/status/1164685533236252672,0,,,,,,,,[],,,,
1164635250171027456,1164635250171027456,2019-08-23 01:57:36 IST,2019-08-23,01:57:36,+0530,2529935697,ex_bcf,Futbolistas,,"Siempre que paso por el Plantio hay colas, primero para hacerse el abono, por las camisetas, por entradas, para ver al Castilla, hoy por los carnets....Seguro que si dicen que mañana dan una patada en los cojon*s a los primeros 50, también se hace cola. Ya os vale, no? 😂",es,[],[],[],3,2,30,[],[],https://twitter.com/Ex_BCF/status/1164635250171027456,False,,0,,,,,,,,[],,,,
1164537419280072704,1164537419280072704,2019-08-22 19:28:51 IST,2019-08-22,19:28:51,+0530,500895181,ltbittar,Leandro Bittar,,"Eu já encomendei o meu. Acho Cap maneiro e o projeto do Digital Cycling também!!!  Vale a pena dar uma força para os caras.  E atenção: ""it's a cap not a hat""!!   #ciclismobr",pt,[],[],[],1,1,7,['ciclismobr'],[],https://twitter.com/ltbittar/status/1164537419280072704,False,https://twitter.com/CyclingDigital/status/1164536645099687936,0,,,,,,,,[],,,,
1164524725722370049,1164524725722370049,2019-08-22 18:38:25 IST,2019-08-22,18:38:25,+0530,637000062,blinkdesignirl,Louise Blink Design,,It’s a great time of the year to think about your training needs!...check out our #adverts this week in the local papers for Autumn Programmes by LEO Limerick &amp; Partners.   @limerickpost @Limerick_Leader Vale Star  #branding #graphics #MakingItHappen #limerick  https://t.co/5Fx1zJ2wyb,en,"[{'screen_name': 'limerickpost', 'name': 'limerick post', 'id': '22085078'}, {'screen_name': 'limerick_leader', 'name': 'limerick leader', 'id': '21646017'}]",[],['https://pbs.twimg.com/media/ECk5DfPWwAIvl-n.jpg'],0,1,8,"['adverts', 'branding', 'graphics', 'makingithappen', 'limerick']",[],https://twitter.com/BlinkDesignIRL/status/1164524725722370049,False,,1,https://pbs.twimg.com/media/ECk5DfPWwAIvl-n.jpg,,,,,,,[],,,,
1164491255943958529,1164490116565524481,2019-08-22 16:25:25 IST,2019-08-22,16:25:25,+0530,632155362,artemisamadrid,Artemisa Madrid🇪🇸🔻,,"@Zurine3 No sé quién es esta señora pero aquí la gestación subrrogada es ilegal y seguirá así muchos años más. Se puede querer ser padre o madre, pero no todo vale. Niñ@s a la carta, no??",es,"[{'screen_name': 's', 'name': '『s』', 'id': '347002675'}]",[],[],2,8,26,[],[],https://twitter.com/ArtemisaMadrid/status/1164491255943958529,False,,0,,,,,,,,"[{'screen_name': 'Zurine3', 'name': 'Zuriñe', 'id': '267058747'}]",,,,
1164400245314244608,1164400245314244608,2019-08-22 10:23:46 IST,2019-08-22,10:23:46,+0530,703068717039497216,drdrehistorian,André Brett,,"Do people outside Australia use ""vale"" for RIP? Not even sure if it's a Kiwi thing too or if I picked it up over here. I'm reminded of the British editor who queried my use of it in an acknowledgements paragraph: they thought it the person's first name and added RIP before.",en,[],[],[],38,6,24,[],[],https://twitter.com/DrDreHistorian/status/1164400245314244608,False,,0,,,,,,,,[],,,,
1164364171787395072,1164364171787395072,2019-08-22 08:00:26 IST,2019-08-22,08:00:26,+0530,25032802,karenmmiddleton,Karen Middleton,,"Farewell, Tim Fischer. A distinctive and determined political leader, a courageous campaigner and a great Australian. My sincere condolences to Judy and their boys. It's a very sad day. Vale.",en,[],[],[],3,17,170,[],[],https://twitter.com/KarenMMiddleton/status/1164364171787395072,False,,0,,,,,,,,[],,,,
1164272844743860225,1164272844743860225,2019-08-22 01:57:31 IST,2019-08-22,01:57:31,+0530,1106948678407860231,glenvale2004,Glenvale FC 2004,,"🔴⚫️ PJDYFL Div 1 Result 🔴⚫️   Glenvale 4-0 Erskine FC   Very efficient performance from the boys means it’s a solid 7 points from 9 to start the season!   Two goals from Jack F, an own goal and a 2nd half Mark C strike meant all 3 points stayed with us ⚽️  come on the Vale 🔴⚫️  https://t.co/RR9jQnGf1c",en,[],[],['https://pbs.twimg.com/media/EChT-OmW4AAl9Ww.jpg'],1,1,16,[],[],https://twitter.com/glenvale2004/status/1164272844743860225,False,,1,https://pbs.twimg.com/media/EChT-OmW4AAl9Ww.jpg,,,,,,,[],,,,
1164265920199450624,1164265920199450624,2019-08-22 01:30:01 IST,2019-08-22,01:30:01,+0530,757991249827733504,dndbeyond,D&D Beyond,,"Heroes of the Vale returns today at 2pm PT on  https://t.co/mvfDh3HC5z! It's all out war, there's a polymorphed red cap, &amp; the cleric is missing. Join @ToddKenreck @TJStorm01 @reelhopelavelle @dreamwisp @BadEyeAdam &amp; @OboeCrazy to see what happens in Episode 9: ANNIHILATION! #HotV  https://t.co/PSPn6IT5Yp",en,"[{'screen_name': 'toddkenreck', 'name': 'todd kenreck', 'id': '14732108'}, {'screen_name': 'tjstorm01', 'name': 'tj storm', 'id': '893933527'}, {'screen_name': 'dreamwisp', 'name': 'jennifer kretchmer', 'id': '126668391'}, {'screen_name': 'badeyeadam', 'name': 'adam bradford', 'id': '2549210401'}, {'screen_name': 'oboecrazy', 'name': '@oboecrazy', 'id': '1221263472027041792'}]",['http://twitch.tv/dndbeyond'],['https://pbs.twimg.com/media/EChIR95VUAAb6X0.jpg'],1,4,26,['hotv'],[],https://twitter.com/DnDBeyond/status/1164265920199450624,False,,1,https://pbs.twimg.com/media/EChIR95VUAAb6X0.jpg,,,,,,,[],,,,
1163990213384953856,1163990213384953856,2019-08-21 07:14:27 IST,2019-08-21,07:14:27,+0530,731874151624019969,geolui_,lui amorim ⚢,,fui montar minhas opções p mid e tá tipo  vale s. a.  flávio bolsonaro  greenpeace china,pt,[],[],[],0,0,8,[],[],https://twitter.com/geolui_/status/1163990213384953856,False,,0,,,,,,,,[],,,,
1163933729254854656,1163933729254854656,2019-08-21 03:30:00 IST,2019-08-21,03:30:00,+0530,911093430356340736,layerto_art,noa,,it's a cold winter night... with re:vale! ❄️  previews for my piece in @4seasons_i7 !  https://t.co/CLHKIOHOrw,en,"[{'screen_name': '4seasons_i7', 'name': '[sales closed] 四季: four seasons', 'id': '1114762158863052801'}]",[],"['https://pbs.twimg.com/media/ECZNzLPXsAAss9z.jpg', 'https://pbs.twimg.com/media/ECZN0BrWwAAAq7u.jpg', 'https://pbs.twimg.com/media/ECZN018WwAIJt6X.jpg']",0,15,29,[],[],https://twitter.com/layerto_art/status/1163933729254854656,False,,1,https://pbs.twimg.com/media/ECZNzLPXsAAss9z.jpg,,,,,,,[],,,,
1163689208386588674,1163689208386588674,2019-08-20 11:18:22 IST,2019-08-20,11:18:22,+0530,739268242997272576,dastn_,new twittèr @dastnx,,hErE’s A hIsToRy LeSsOn : Neon Mal Set dZ  Saw Naive High Vale Ivory HE Colt(as a meme) Ivory (Lead)  Set 2K Coven (Lead) XO Ridiculous (Squad)  Heal (Semi-Lead) Ice,en,[],[],[],6,0,7,[],[],https://twitter.com/dastn_/status/1163689208386588674,False,,0,,,,,,,,[],,,,
1163519465314762752,1163515403143983104,2019-08-20 00:03:52 IST,2019-08-20,00:03:52,+0530,1050075428910706693,actualhurry,Ahurrykara 🌸🗡️ grad school prog,,@chalcoyong Shin's a beta but Vale is an alpha but Orsa is an omega. How dooooes he do it?,en,[],[],[],2,0,10,[],[],https://twitter.com/ActualHurry/status/1163519465314762752,False,,0,,,,,,,,"[{'screen_name': 'chalcoyong', 'name': 'Deep Stoned Crypt 420', 'id': '924470072'}]",,,,
1163187872557608963,1163167796567711745,2019-08-19 02:06:14 IST,2019-08-19,02:06:14,+0530,895596201114038274,vale_elina,Elina Vale,,"@JosephJMiccolis If someone is a man or identifies as one, he's a real man. Same goes for women.",en,[],[],[],0,0,5,[],[],https://twitter.com/vale_elina/status/1163187872557608963,False,,0,,,,,,,,"[{'screen_name': 'JosephJMiccolis', 'name': 'J.Micc', 'id': '1001621842627612672'}]",,,,
1163048987664027649,1163048987664027649,2019-08-18 16:54:21 IST,2019-08-18,16:54:21,+0530,1615096280,justindavies96,Justin Davies,,"Overheard platform talk at Cardiff Central.  ""That ain't the Ebbw Vale train is it?!"" ""It is aye"" ""F*** me, that's a posh one""",en,[],[],[],3,4,89,[],[],https://twitter.com/JustinDavies96/status/1163048987664027649,False,,0,,,,,,,,[],,,,
1162730687465758722,1162730687465758722,2019-08-17 19:49:33 IST,2019-08-17,19:49:33,+0530,15922513,danielperrone,Daniel Perrone ♔,,Matéria do “Notícias do Tricolor” sobre o São Paulo S/A que conta com minha participação. Vale a pena ler:  https://t.co/cGDur70OqA,pt,[],['https://www.noticiasdotricolor.com.br/2019/08/17/sao-paulo-s-a-entenda-toda-historia-opinioes/'],[],3,10,130,[],[],https://twitter.com/danielperrone/status/1162730687465758722,False,,0,,,,,,,,[],,,,
1162556766279704576,1162556766279704576,2019-08-17 08:18:26 IST,2019-08-17,08:18:26,+0530,1124316474464555008,gekijous,cain ♡ RE-RAISE BRUH MOMENT,,"Here's my part for the #i7flashbang!  I was paired with @chenqiing with their re:vale fic, Frigid Flame! :) The link to the fic will be in the replies once my partner uploads it! ⬇️⬇️⬇️ Please do go read it though, it's a really good fic 😤😤😤  https://t.co/lebB6Rb279",en,"[{'screen_name': 'chenqiing', 'name': '🖤🖤🖤', 'id': '1346667121091235843'}]",[],['https://pbs.twimg.com/media/ECI7NMsU8AEc3D3.png'],1,10,19,['i7flashbang'],[],https://twitter.com/gekijous/status/1162556766279704576,False,,1,https://pbs.twimg.com/media/ECI7NMsU8AEc3D3.png,,,,,,,[],,,,
1162389366137901057,1162360938084913152,2019-08-16 21:13:15 IST,2019-08-16,21:13:15,+0530,2273651093,shaun_loft,shaun loft,,"@hollingtonlions @AfcUckfield @midsussexleague @AfcUckfieldTown @vale_jamie The “2nd team “ are not associated to @AfcUckfieldTown anymore. Just the first team and the under 23’s are part of our set up. I  agree though ,it’s a disgrace that they can’t get a side on the first day of the season, knowing the hard work you guys put in🤷‍♂️",en,"[{'screen_name': 'afcuckfieldtown', 'name': 'afc uckfield town', 'id': '1099624087'}]",[],[],3,0,5,[],[],https://twitter.com/shaun_loft/status/1162389366137901057,False,,0,,,,,,,,"[{'screen_name': 'hollingtonlions', 'name': 'Hollington United Community F.C', 'id': '820569603424354304'}, {'screen_name': 'AfcUckfield', 'name': 'AFC Uckfield Reserves', 'id': '856134344166998017'}, {'screen_name': 'midsussexleague', 'name': 'Official Mid Sussex Football League ⚽️', 'id': '835872883511525376'}, {'screen_name': 'AfcUckfieldTown', 'name': 'AFC Uckfield Town', 'id': '1099624087'}, {'screen_name': 'vale_jamie', 'name': 'Jamie Vale', 'id': '3074475262'}]",,,,
1162377253910695936,1162377253910695936,2019-08-16 20:25:07 IST,2019-08-16,20:25:07,+0530,825370712831455232,formerlygolden,Nicola J.,,"“Shark Attack” - Grouplove  “Beware The Dog” - The Griswolds “Trying To Be Cool” - Phoenix Up First, NPR News Leviathan Wakes, James S.A. Corey  “The Great Golden Hand” - Welcome to Night Vale  #fridaymorningmix  https://t.co/lMwn5EUkI9",en,[],[],['https://pbs.twimg.com/media/ECGX8elW4AAuAsh.jpg'],1,0,8,['fridaymorningmix'],[],https://twitter.com/formerlygolden/status/1162377253910695936,False,,1,https://pbs.twimg.com/media/ECGX8elW4AAuAsh.jpg,,,,,,,[],,,,
1161985050960945152,1161985050960945152,2019-08-15 18:26:39 IST,2019-08-15,18:26:39,+0530,20045580,fiocruz,Fiocruz,,"Começou o seminário “Desastre da Vale S.A. em Brumadinho: seis meses de impactos e ações”. Acompanhe a transmissão ao vivo, o evento acontece hoje e amanhã (15 e 16/8), em Brumadinho.   https://t.co/oeIqSlbUKf",pt,[],['https://www.cmbrumadinho.mg.gov.br/'],[],1,8,20,[],[],https://twitter.com/fiocruz/status/1161985050960945152,False,,0,,,,,,,,[],,,,
1161963199798927361,1161963199798927361,2019-08-15 16:59:49 IST,2019-08-15,16:59:49,+0530,968397895,lordpicaro,Pícaro,,"Vale, ¡me dicen por el pinganillo que somos ya 8000 pícar@s a bordo!  Espero poder seguir sacándole una sonrisa a vuestros días grises.  ¡Mil besos y gracias!  https://t.co/MCXeKTmetQ",es,[],[],['https://pbs.twimg.com/tweet_video_thumb/ECAfXdLXoAATRbv.jpg'],12,0,43,[],[],https://twitter.com/Lordpicaro/status/1161963199798927361,False,,1,https://pbs.twimg.com/tweet_video_thumb/ECAfXdLXoAATRbv.jpg,,,,,,,[],,,,
1161895269769854979,1161895269769854979,2019-08-15 12:29:53 IST,2019-08-15,12:29:53,+0530,1691400888,jimoutoffaf,Jim Harris’s Sixth Census,,"Currently in the queue for #ENGvAUS at @HomeOfCricket... but setting off soon, round the corner to Maida Vale, to #PauseforThought with @amolrajan at @BBCRadio2  Mostly thinking about beautiful human people, so here’s a hello to top #BHP @realpipwilson  https://t.co/QyFn77pxSO",en,"[{'screen_name': 'homeofcricket', 'name': ""lord's cricket ground"", 'id': '4380591'}, {'screen_name': 'amolrajan', 'name': 'amol rajan', 'id': '38162820'}, {'screen_name': 'bbcradio2', 'name': 'bbc radio 2', 'id': '798277'}, {'screen_name': 'realpipwilson', 'name': 'pipwilsonbhp', 'id': '60945888'}]",[],['https://pbs.twimg.com/media/EB_hku4XUAE7zdS.jpg'],3,0,11,"['engvaus', 'pauseforthought', 'bhp']",[],https://twitter.com/jimoutoffaf/status/1161895269769854979,False,,1,https://pbs.twimg.com/media/EB_hku4XUAE7zdS.jpg,,,,,,,[],,,,
1161739335303094272,1161559207319134209,2019-08-15 02:10:16 IST,2019-08-15,02:10:16,+0530,207236627,liz_niter,Liz Maria,,@Haddad_Fernando @alexandreneto Vilas boas de tantas maldades n aprendeu nada  esta ficando até s a voz com problemas graves de saúde mas n aprende a lição de fazer tantas ruindades contra seu próprio país contra seu povo e sua soberania...esta pagando um preço alto/será q vale a pena destruir tudo pela poder?,pt,[],[],[],0,3,8,[],[],https://twitter.com/liz_niter/status/1161739335303094272,False,,0,,,,,,,,"[{'screen_name': 'Haddad_Fernando', 'name': 'Fernando Haddad', 'id': '354095556'}, {'screen_name': 'alexandreneto', 'name': 'Alexandre Neto - #BrazilianAlligator', 'id': '40804123'}]",,,,
1161676344029274112,1161676340585816071,2019-08-14 21:59:57 IST,2019-08-14,21:59:57,+0530,1043162623959805952,pericajavagain,Jav,,Me and says it’s cause he was stuck in Del Rio cause he was dropping off some girl and his truck over heated. 😂😂 man when I say my partner no vale verga it’s cause I mean it! He’s a rare bread man! Lol This is an every pay day routine! 😩,en,[],[],[],1,1,12,[],[],https://twitter.com/PericaJavAgain/status/1161676344029274112,False,,0,,,,,,,,[],,,,
1161636368713474049,1161612767079649280,2019-08-14 19:21:07 IST,2019-08-14,19:21:07,+0530,1327516022,campanapablo,Pablo Campana Sáenz,,Vale recalcar que está alianza fortalece los lazos entre la Promotora Inmobiliaria Millenium S.A. y @mpichincha para beneficio de todos los ecuatorianos 💪🇪🇨,es,"[{'screen_name': 'mpichincha', 'name': 'mutualista pichincha', 'id': '391358409'}]",[],[],2,6,36,[],[],https://twitter.com/CampanaPablo/status/1161636368713474049,False,,0,,,,,,,,[],,,,
1161447754083647488,1161447754083647488,2019-08-14 06:51:37 IST,2019-08-14,06:51:37,+0530,85508831,thecalebbond,Caleb Bond,,Research continually shows we are drinking less and less. Yet the public health lobby and associated puritans carry on like it's a bigger problem than ever. Leave me and my McLaren Vale shiraz alone.  https://t.co/VbwTjeFDZ8,en,[],['https://cbnd.me/2Z4s0Fg'],[],12,7,60,[],[],https://twitter.com/TheCalebBond/status/1161447754083647488,False,,0,,,,,,,,[],,,,
