id,conversation_id,created_at,date,time,timezone,user_id,username,name,place,tweet,language,mentions,urls,photos,replies_count,retweets_count,likes_count,hashtags,cashtags,link,retweet,quote_url,video,thumbnail,near,geo,source,user_rt_id,user_rt,retweet_id,reply_to,retweet_date,translate,trans_src,trans_dest
1060185257230643200,1060185257230643200,2018-11-07 20:30:37 IST,2018-11-07,20:30:37,+0530,20457806,jnjnews,Johnson & Johnson,,"At #JNJ, we believe human health and environmental health go hand in hand. That’s why our Chairman &amp; CEO Alex Gorsky is taking the @BizRoundtable Sustainability Challenge, sharing how J&amp;J is #EmbracingSustainability and inviting @Cisco CEO @ChuckRobbins to do the same.  https://t.co/RfdwlA4Fwk",en,"[{'screen_name': 'bizroundtable', 'name': 'business roundtable', 'id': '44682276'}, {'screen_name': 'cisco', 'name': 'cisco', 'id': '15749983'}, {'screen_name': 'chuckrobbins', 'name': 'chuck robbins', 'id': '16810559'}]",[],[],2,6,28,"['jnj', 'embracingsustainability']",[],https://twitter.com/JNJNews/status/1060185257230643200,False,,1,https://pbs.twimg.com/ext_tw_video_thumb/1060185171884998657/pu/img/3qBHxPCCGFzT3p9W.jpg,,,,,,,[],,,,
1056576386419310593,1056576386419310593,2018-10-28 21:30:15 IST,2018-10-28,21:30:15,+0530,20457806,jnjnews,Johnson & Johnson,,Are you a nurse? @MariaMenounos wants to help bring your innovative idea to life. She's partnering with #JNJ for a #QuickFireChallenge to invite nurses to submit ideas to help address health challenges for a chance to receive $100K in funding:  https://t.co/WF5lrzmntR  https://t.co/sQje40rlqG,en,"[{'screen_name': 'mariamenounos', 'name': 'maria menounos', 'id': '29555251'}]",['https://goo.gl/7iXbPw'],['https://pbs.twimg.com/media/Dqm2n44XcAASI8T.jpg'],2,17,32,"['jnj', 'quickfirechallenge']",[],https://twitter.com/JNJNews/status/1056576386419310593,False,,1,https://pbs.twimg.com/media/Dqm2n44XcAASI8T.jpg,,,,,,,[],,,,
1055459044666818560,1055459044666818560,2018-10-25 19:30:20 IST,2018-10-25,19:30:20,+0530,20457806,jnjnews,Johnson & Johnson,,#JNJ VP of Global Public Health Cat Oyler conquered open heart surgery in 2018. See how she's bringing the same fighting spirit to help the company's efforts to #endTB:  https://t.co/nZyQ4Trr4H  https://t.co/alwcz6nP79,en,[],['https://goo.gl/8cQeQK'],['https://pbs.twimg.com/media/DqW-aDuX4AAAU4o.jpg'],0,12,22,"['jnj', 'endtb']",[],https://twitter.com/JNJNews/status/1055459044666818560,False,,1,https://pbs.twimg.com/media/DqW-aDuX4AAAU4o.jpg,,,,,,,[],,,,
1054849417600212992,1054849417600212992,2018-10-24 03:07:53 IST,2018-10-24,03:07:53,+0530,20457806,jnjnews,Johnson & Johnson,,#JNJ VP of Talent Acquisition @sjoerdgehring joins @TheMuse's Kathryn Minshew and @textio's Jensen Harris to discuss how to spot and lure innovative talent in a crowded marketplace. @FastCompany #FCFestival  https://t.co/MOKLugEnLY,en,"[{'screen_name': 'sjoerdgehring', 'name': 'sjoerd gehring', 'id': '27606741'}, {'screen_name': 'themuse', 'name': 'the muse', 'id': '334984155'}, {'screen_name': 'textio', 'name': 'textio', 'id': '2830198794'}, {'screen_name': 'fastcompany', 'name': 'fast company', 'id': '2735591'}]",[],['https://pbs.twimg.com/media/DqOT9GxXgAU82ge.jpg'],0,10,31,"['jnj', 'fcfestival']",[],https://twitter.com/JNJNews/status/1054849417600212992,False,,1,https://pbs.twimg.com/media/DqOT9GxXgAU82ge.jpg,,,,,,,[],,,,
1052992466792656896,1052992466792656896,2018-10-19 00:09:02 IST,2018-10-19,00:09:02,+0530,20457806,jnjnews,Johnson & Johnson,,"Today is #SpiritDay, a day of solidarity &amp; acceptance for #LGBTQ youth. Ashley McEvoy, #JNJ EVP &amp; Worldwide Chairman, Medical Devices, discusses her involvement with @TrevorProject, an organization that promotes suicide prevention efforts with LGBTQ youth:  https://t.co/x2E6Nb9yBf",en,"[{'screen_name': 'trevorproject', 'name': 'the trevor project', 'id': '18916728'}]",['https://goo.gl/oqDZk4'],[],0,15,31,"['spiritday', 'lgbtq', 'jnj']",[],https://twitter.com/JNJNews/status/1052992466792656896,False,,0,,,,,,,,[],,,,
1052197509509079041,1052197509509079041,2018-10-16 19:30:09 IST,2018-10-16,19:30:09,+0530,20457806,jnjnews,Johnson & Johnson,,#JNJ Chairman &amp; CEO Alex Gorsky on $JNJ's Q3 2018 financial performance:  https://t.co/FCgygAKE69,en,[],[],['https://pbs.twimg.com/media/DpooDuSXcAA9hwV.jpg'],0,8,38,['jnj'],['jnj'],https://twitter.com/JNJNews/status/1052197509509079041,False,,1,https://pbs.twimg.com/media/DpooDuSXcAA9hwV.jpg,,,,,,,[],,,,
1052150155879825408,1052150155879825408,2018-10-16 16:21:59 IST,2018-10-16,16:21:59,+0530,20457806,jnjnews,Johnson & Johnson,,$JNJ reports Q3 2018 performance results. See the release for full financial data &amp; non-GAAP reconciliations:  https://t.co/9dl4uDMJb0 #earnings  https://t.co/1dsP1yxzWL,en,[],['https://goo.gl/bnR3mS'],['https://pbs.twimg.com/media/Dpn8_XbWkAAZjm7.jpg'],0,7,26,['earnings'],['jnj'],https://twitter.com/JNJNews/status/1052150155879825408,False,,1,https://pbs.twimg.com/media/Dpn8_XbWkAAZjm7.jpg,,,,,,,[],,,,
1048853187715682304,1048853187715682304,2018-10-07 14:01:01 IST,2018-10-07,14:01:01,+0530,46279037,wolfganggartner,Wolfgang Gartner,,"non-music-related fun fact:  Johnson &amp; Johnson owns the rights to medical Ketamine (Esketamine, as the final drug formulation is called).  Phase 3 trials just completed, for multiple psychiatric conditions. bout to buy me some JNJ stock.",en,[],[],[],5,7,84,[],[],https://twitter.com/wolfganggartner/status/1048853187715682304,False,,0,,,,,,,,[],,,,
1048636021267730433,1048636021267730433,2018-10-06 23:38:04 IST,2018-10-06,23:38:04,+0530,20457806,jnjnews,Johnson & Johnson,,"We’re proud of our commitment to supporting women, like Jennifer Taubert, EVP, Worldwide Chairman, Pharmaceuticals, #JNJ. She's been named one of @FortuneMagazine’s Most Powerful Women for a third year in a row. Learn about her career at J&amp;J and her goals:  https://t.co/SpxNAWif4M  https://t.co/4TnbqkUwBT",en,"[{'screen_name': 'fortunemagazine', 'name': 'fortune', 'id': '25053299'}]",['http://goo.gl/WMkPAb'],['https://pbs.twimg.com/media/Do2A51XXkAMPKy5.jpg'],1,14,50,['jnj'],[],https://twitter.com/JNJNews/status/1048636021267730433,False,,1,https://pbs.twimg.com/media/Do2A51XXkAMPKy5.jpg,,,,,,,[],,,,
1046238836462948352,1046238836462948352,2018-09-30 08:52:31 IST,2018-09-30,08:52:31,+0530,20457806,jnjnews,Johnson & Johnson,,"Together with innovative researchers, frontline health workers and our partners who are #changinghumanhealth to #makeHIVhistory, we are proud to announce that large-scale testing of the #HIV vaccine is now under way in 5 African countries, including South Africa. #JNJ  https://t.co/jBbZOiGPrg",en,[],[],[],0,18,57,"['changinghumanhealth', 'makehivhistory', 'hiv', 'jnj']",[],https://twitter.com/JNJNews/status/1046238836462948352,False,,1,https://pbs.twimg.com/ext_tw_video_thumb/1046238774097784833/pu/img/4LxHl_okdGaBHah6.jpg,,,,,,,[],,,,
1046193329057280001,1046193329057280001,2018-09-30 05:51:41 IST,2018-09-30,05:51:41,+0530,20457806,jnjnews,Johnson & Johnson,,"#JNJ CSO Dr. Paul Stoffels started his career in Africa at the very beginning of the HIV epidemic. Here, he shares the strides that have been made in HIV treatment and care and what must still be done to #makeHIVhistory:  https://t.co/ozHrlJh3op #changinghumanhealth #GlobalCitizen  https://t.co/iSz0UgBEXL",en,[],['https://goo.gl/1wtTw4'],['https://pbs.twimg.com/media/DoTTSbTW0AE_C_1.jpg'],2,31,69,"['jnj', 'makehivhistory', 'changinghumanhealth', 'globalcitizen']",[],https://twitter.com/JNJNews/status/1046193329057280001,False,,1,https://pbs.twimg.com/media/DoTTSbTW0AE_C_1.jpg,,,,,,,[],,,,
1045410898322616320,1045410898322616320,2018-09-28 02:02:35 IST,2018-09-28,02:02:35,+0530,149283471,carmendominicci,Carmen Dominicci,,"Feliz de estar de vuelta en Nueva York, gracias a Johnson &amp; Johnson! como parte del #livehealthylivewell retreat ! Ahora salgo para  los Jlabs @jnj a conocer un tiburón de #Sharktank en  #jnj 🎉  https://t.co/WuYrKbhMfy",es,"[{'screen_name': 'jnj', 'name': 'jnj', 'id': '15232363'}]",[],['https://pbs.twimg.com/media/DoILqi0U8AAQ6ff.jpg'],13,3,110,"['livehealthylivewell', 'sharktank', 'jnj']",[],https://twitter.com/carmendominicci/status/1045410898322616320,False,,1,https://pbs.twimg.com/media/DoILqi0U8AAQ6ff.jpg,,,,,,,[],,,,
1045331559392432129,1045331559392432129,2018-09-27 20:47:19 IST,2018-09-27,20:47:19,+0530,20457806,jnjnews,Johnson & Johnson,,"#JNJ is proud to announce a new collaboration with @CEPIvaccines and @JennerInstitute to advance vaccines for #MERS, #Nipah and #Lassa, the latest example of our commitment to addressing pandemic threats:  https://t.co/IaFlW8UHYt  https://t.co/jFLOlNtpND",en,"[{'screen_name': 'cepivaccines', 'name': 'cepi', 'id': '784351656355897344'}, {'screen_name': 'jennerinstitute', 'name': 'jenner institute', 'id': '3364000629'}]",['https://goo.gl/9AgB82'],['https://pbs.twimg.com/media/DoHDgz2XgAUCI1x.jpg'],0,22,31,"['jnj', 'mers', 'nipah', 'lassa']",[],https://twitter.com/JNJNews/status/1045331559392432129,False,,1,https://pbs.twimg.com/media/DoHDgz2XgAUCI1x.jpg,,,,,,,[],,,,
1045080272973295621,1045080272973295621,2018-09-27 04:08:48 IST,2018-09-27,04:08:48,+0530,20457806,jnjnews,Johnson & Johnson,,TB is one of the greatest public health emergencies today. So it’s time to start treating it like one. #JNJ CSO Paul Stoffels pens an @CNBC op-ed and shares why J&amp;J and our partners are committed to helping #endTB forever. #UNHLMTB  https://t.co/Yli9K6cXF7  https://t.co/JktLymFACY,en,"[{'screen_name': 'cnbc', 'name': 'cnbc', 'id': '20402945'}]",['https://goo.gl/5miUgX'],['https://pbs.twimg.com/media/DoDeSo-XcAEsYda.jpg'],1,17,24,"['jnj', 'endtb', 'unhlmtb']",[],https://twitter.com/JNJNews/status/1045080272973295621,False,,1,https://pbs.twimg.com/media/DoDeSo-XcAEsYda.jpg,,,,,,,[],,,,
1045038447659012096,1045038447659012096,2018-09-27 01:22:36 IST,2018-09-27,01:22:36,+0530,20457806,jnjnews,Johnson & Johnson,,#JNJ Chairman and CEO Alex Gorsky joined @MedTechCon today as a featured speaker at the Super CEOs as Super Heroes session. He shared how military veterans like himself can serve as innovative thinkers in the #medtech space. #MedTechCon  https://t.co/09H6Ake6v2,en,"[{'screen_name': 'medtechcon', 'name': 'the medtech conference', 'id': '121131407'}]",[],['https://pbs.twimg.com/media/DoC47fVVAAEvIvV.jpg'],0,11,24,"['jnj', 'medtech', 'medtechcon']",[],https://twitter.com/JNJNews/status/1045038447659012096,False,,1,https://pbs.twimg.com/media/DoC47fVVAAEvIvV.jpg,,,,,,,[],,,,
1044733288684953606,1044733288684953606,2018-09-26 05:10:00 IST,2018-09-26,05:10:00,+0530,20457806,jnjnews,Johnson & Johnson,,"WATCH: #JNJ Chairman &amp; CEO, Alex Gorsky, on healthy communities, access to technology and innovation &amp; J&amp;J’s role in improving human health as part of the @UN #SDGs at the @wef. #wefimpact  https://t.co/yJgYVG4pDG",en,"[{'screen_name': 'un', 'name': 'united nations', 'id': '14159148'}, {'screen_name': 'wef', 'name': 'world economic forum', 'id': '5120691'}]",[],[],1,18,40,"['jnj', 'sdgs', 'wefimpact']",[],https://twitter.com/JNJNews/status/1044733288684953606,False,,1,https://pbs.twimg.com/ext_tw_video_thumb/1044733234515529728/pu/img/hvdVtUiGH3YVkH42.jpg,,,,,,,[],,,,
1044627333536206848,1044627333536206848,2018-09-25 22:08:59 IST,2018-09-25,22:08:59,+0530,20457806,jnjnews,Johnson & Johnson,,"We’re honored to be named a top 10 Best Company by @_workingmother_. Meet Tonja Danowski, VP, Business Development, @JNJVision, #JNJ’s 2018 #WorkingMother of the Year, and learn how she balances career and motherhood:  https://t.co/2TltIvl8My #WM100Best  https://t.co/7z0fqQ2qtf",en,"[{'screen_name': '_workingmother_', 'name': 'working mother', 'id': '39523386'}, {'screen_name': 'jnjvision', 'name': 'johnson & johnson vision', 'id': '1912211052'}]",['http://goo.gl/jsGZDR'],[],0,9,23,"['jnj', 'workingmother', 'wm100best']",[],https://twitter.com/JNJNews/status/1044627333536206848,False,,1,https://pbs.twimg.com/ext_tw_video_thumb/1044627281103245324/pu/img/8jhU-YnbEoZrdFdM.jpg,,,,,,,[],,,,
1044270283425746946,1044270283425746946,2018-09-24 22:30:11 IST,2018-09-24,22:30:11,+0530,20457806,jnjnews,Johnson & Johnson,,.@LATINAStyleMag named #JNJ Company of the Year for 2018 for our work providing career opportunities to Latinas in the U.S. #JNJ Chairman &amp; CEO Alex Gorsky discusses the significance of the recognition:  https://t.co/nTeVxnIv0V #BelongatJNJ #HispanicHeritageMonth  https://t.co/1DbF167ykB,en,"[{'screen_name': 'latinastylemag', 'name': 'latina style inc.', 'id': '330489425'}]",['https://goo.gl/HBZNT3'],['https://pbs.twimg.com/media/Dn3-SbkXcAAwHYC.jpg'],1,19,36,"['jnj', 'jnj', 'belongatjnj', 'hispanicheritagemonth']",[],https://twitter.com/JNJNews/status/1044270283425746946,False,,1,https://pbs.twimg.com/media/Dn3-SbkXcAAwHYC.jpg,,,,,,,[],,,,
1044217589394821121,1044217589394821121,2018-09-24 19:00:48 IST,2018-09-24,19:00:48,+0530,20457806,jnjnews,Johnson & Johnson,,"Congrats to Jennifer Taubert, EVP, Worldwide Chairman, Pharmaceuticals at #JNJ for being named to @FortuneMagazine's 2018 list of powerhouse leaders. Learn about her accomplishments and what she's hoping to achieve next in her new role:  https://t.co/w1cdRpguxI #FortuneMPW  https://t.co/uf9WHrJPfh",en,"[{'screen_name': 'fortunemagazine', 'name': 'fortune', 'id': '25053299'}]",['https://goo.gl/WMkPAb'],['https://pbs.twimg.com/media/Dn3OXPbWkAA7hx2.jpg'],0,29,89,"['jnj', 'fortunempw']",[],https://twitter.com/JNJNews/status/1044217589394821121,False,,1,https://pbs.twimg.com/media/Dn3OXPbWkAA7hx2.jpg,,,,,,,[],,,,
1043515320240095232,1043515320240095232,2018-09-22 20:30:14 IST,2018-09-22,20:30:14,+0530,20457806,jnjnews,Johnson & Johnson,,Meet Johnson &amp; Johnson – the cutest member of the #JNJ team. He was adopted by the @JanssenGlobal team in China as part of a partnership that aims to protect giant pandas. Learn about this initiative &amp; its focus on animal conservation:  https://t.co/jJjKt9zrSJ  https://t.co/SI0JT0aUVT,en,"[{'screen_name': 'janssenglobal', 'name': 'janssen global', 'id': '2474345197'}]",['https://goo.gl/kknhbT'],['https://pbs.twimg.com/media/DntPpy3UUAAACfP.jpg'],0,18,50,['jnj'],[],https://twitter.com/JNJNews/status/1043515320240095232,False,,1,https://pbs.twimg.com/media/DntPpy3UUAAACfP.jpg,,,,,,,[],,,,
1041812839235837953,1041812839235837953,2018-09-18 03:45:11 IST,2018-09-18,03:45:11,+0530,20457806,jnjnews,Johnson & Johnson,,"In the 1980s, patients with AIDS were kept quarantined and in isolation, until nurses defied convention and embraced them with compassion. #JNJ honors nurses #changinghumanhealth. Learn more:  https://t.co/cSGsrJ0g3R #NursesChangeLives  https://t.co/PjnptwPcZo",en,[],['http://nursing.jnj.com'],[],1,11,41,"['jnj', 'changinghumanhealth', 'nurseschangelives']",[],https://twitter.com/JNJNews/status/1041812839235837953,False,,1,https://pbs.twimg.com/ext_tw_video_thumb/1041812812467773441/pu/img/ukR_C3VpMOBJJ9K1.jpg,,,,,,,[],,,,
1041733615942610945,1041733615942610945,2018-09-17 22:30:23 IST,2018-09-17,22:30:23,+0530,20457806,jnjnews,Johnson & Johnson,,"Nurses have always been on the front lines of #changinghumanhealth. Since 1897, #JNJ has been proud to advocate for and support the nursing profession. Learn more about @JNJNursing:  https://t.co/cSGsrJ0g3R #NursesChangeLives  https://t.co/2rv0xUrpcc",en,"[{'screen_name': 'jnjnursing', 'name': 'johnson & johnson nursing', 'id': '563190439'}]",['http://nursing.jnj.com'],[],1,49,90,"['changinghumanhealth', 'jnj', 'nurseschangelives']",[],https://twitter.com/JNJNews/status/1041733615942610945,False,,1,https://pbs.twimg.com/ext_tw_video_thumb/1041733583977828353/pu/img/4wt7Dt4cCkrMZl7g.jpg,,,,,,,[],,,,
1040399345437294593,1040399345437294593,2018-09-14 06:08:28 IST,2018-09-14,06:08:28,+0530,7517052,howardlindzon,SPAC Lindzon,,Apple and Johnson and Johnson are my first two 'birth to death' companies/brands....can you name a few more for my new ETF? $jnj $aapl,en,[],[],[],35,1,25,[],"['jnj', 'aapl']",https://twitter.com/howardlindzon/status/1040399345437294593,False,,0,,,,,,,,[],,,,
1039591933637734400,1039591933637734400,2018-09-12 00:40:06 IST,2018-09-12,00:40:06,+0530,20457806,jnjnews,Johnson & Johnson,,"#JNJ's Chief Diversity &amp; Inclusion Officer, @WandaBHope, shares her story and how #JNJ's culture of belonging landed the company a top spot on @DiversityInc's list for 2018:  https://t.co/i3PCsad1kU #NDA18 #BelongatJNJ  https://t.co/0g7lCAB4gw",en,"[{'screen_name': 'wandabhope', 'name': 'wanda bryant hope', 'id': '2755808153'}, {'screen_name': 'diversityinc', 'name': '@diversityinc', 'id': '18027109'}]",['https://goo.gl/i4UUmv'],['https://pbs.twimg.com/media/Dm1fWmQW4AAeZqr.jpg'],2,14,45,"['jnj', 'jnj', 'nda18', 'belongatjnj']",[],https://twitter.com/JNJNews/status/1039591933637734400,False,,1,https://pbs.twimg.com/media/Dm1fWmQW4AAeZqr.jpg,,,,,,,[],,,,
1038047744781377537,1038047744781377537,2018-09-07 18:24:03 IST,2018-09-07,18:24:03,+0530,1652541,reuters,Reuters,,Johnson &amp; Johnson to work with the Indian government to compensate patients who suffered from artificial hip implants recalled eight years ago  https://t.co/JsRhEQvJVF by @adityakalra $JNJ  https://t.co/uCWJjHIwXv,en,"[{'screen_name': 'adityakalra', 'name': 'aditya kalra', 'id': '79530637'}]",['https://reut.rs/2Cs4AUj'],['https://pbs.twimg.com/media/Dmfi7DJWsAU2WGD.jpg'],4,25,38,[],['jnj'],https://twitter.com/Reuters/status/1038047744781377537,False,,1,https://pbs.twimg.com/media/Dmfi7DJWsAU2WGD.jpg,,,,,,,[],,,,
1036992423468171265,1036992423468171265,2018-09-04 20:30:34 IST,2018-09-04,20:30:34,+0530,20457806,jnjnews,Johnson & Johnson,,"Calling all women in STEM: The #JNJ #WiSTEM2D Scholars Award application is officially open! We’re accepting submissions until Sept 25, so apply here:  https://t.co/y09bH4bgFE  https://t.co/iKCdsi184Q",en,[],['http://goo.gl/kTRZUD'],[],1,40,53,"['jnj', 'wistem2d']",[],https://twitter.com/JNJNews/status/1036992423468171265,False,,1,https://pbs.twimg.com/ext_tw_video_thumb/1036992348851503106/pu/img/UwV0-oIHMufFf9Ak.jpg,,,,,,,[],,,,
1033715722403438593,1033715722403438593,2018-08-26 19:30:08 IST,2018-08-26,19:30:08,+0530,20457806,jnjnews,Johnson & Johnson,,"1886: 8 of our first 14 employees were female 2018: Women make up 50% of our workforce  On #WomensEqualityDay, take a look back at #JNJ's 132-year history of championing women around the globe:  https://t.co/rZWmAdmVDq #DiscoverJNJ  https://t.co/2cj6t1r6Si",en,[],['https://goo.gl/KbpPPk'],['https://pbs.twimg.com/media/Dlh--IiWsAIcKBR.jpg'],1,26,58,"['womensequalityday', 'jnj', 'discoverjnj']",[],https://twitter.com/JNJNews/status/1033715722403438593,False,,1,https://pbs.twimg.com/media/Dlh--IiWsAIcKBR.jpg,,,,,,,[],,,,
1033413724277825538,1033413724277825538,2018-08-25 23:30:06 IST,2018-08-25,23:30:06,+0530,20457806,jnjnews,Johnson & Johnson,,"We’re proud that 19% of the 160 JLABS startups are led by women, and in honor of #WomensEqualityDay, we’re spotlighting these leaders. Hear from the woman creating kits to make cervical cancer detection easier:  https://t.co/DBXNG89HRe #JNJ  https://t.co/qdepZt7PZB",en,[],['http://goo.gl/ECJDqm'],['https://pbs.twimg.com/media/DldsThsXsAANrPC.jpg'],4,32,71,"['womensequalityday', 'jnj']",[],https://twitter.com/JNJNews/status/1033413724277825538,False,,1,https://pbs.twimg.com/media/DldsThsXsAANrPC.jpg,,,,,,,[],,,,
1031904272487776256,1031904272487776256,2018-08-21 19:32:05 IST,2018-08-21,19:32:05,+0530,20457806,jnjnews,Johnson & Johnson,,"#JNJ is proud to be on @FortuneMagazine's 2018 #ChangeTheWorld list for helping train surgeons, paramedics and other healthcare providers around the globe through the @JNJInstitute:  https://t.co/3u80M3qlCf  https://t.co/hqHHXi2Tjg",en,"[{'screen_name': 'fortunemagazine', 'name': 'fortune', 'id': '25053299'}, {'screen_name': 'jnjinstitute', 'name': 'j&j institute', 'id': '916361655881289728'}]",['https://goo.gl/8GiQFH'],[],0,30,55,"['jnj', 'changetheworld']",[],https://twitter.com/JNJNews/status/1031904272487776256,False,,1,https://pbs.twimg.com/ext_tw_video_thumb/1031904205055959041/pu/img/6ntbjvBEDuFUaXdY.jpg,,,,,,,[],,,,
1029008674541527041,1029008674541527041,2018-08-13 19:46:00 IST,2018-08-13,19:46:00,+0530,20457806,jnjnews,Johnson & Johnson,,"On the heels of his recent trip to #SouthAfrica, #JNJ Chairman &amp; CEO Alex Gorsky shares his insights into the company's commitment to #HIV and TB prevention, oncology care, maternal health &amp; more essential health innovations in Sub-Saharan Africa:  https://t.co/Eeg3IRkWpG  https://t.co/vI4V7iLmBx",en,[],['https://goo.gl/B2wPhG'],['https://pbs.twimg.com/media/DkfF73ZWwAU26EW.jpg'],7,16,50,"['southafrica', 'jnj', 'hiv']",[],https://twitter.com/JNJNews/status/1029008674541527041,False,,1,https://pbs.twimg.com/media/DkfF73ZWwAU26EW.jpg,,,,,,,[],,,,
1026877527623524352,1026877527623524352,2018-08-07 22:37:35 IST,2018-08-07,22:37:35,+0530,20457806,jnjnews,Johnson & Johnson,,"#JNJ is proud to partner with @GlblCtzn for NYC’s #GlobalCitizen Festival as we continue our mission to change the trajectory of #HealthforHumanity. Join us, @theweeknd, @iamCardiB, @JanetJackson and more on Sept. 29th:  https://t.co/DBYwNmvpkO  https://t.co/Q4jZcJf9e3",en,"[{'screen_name': 'glblctzn', 'name': 'global citizen', 'id': '596893898'}, {'screen_name': 'theweeknd', 'name': 'the weeknd', 'id': '255388236'}, {'screen_name': 'iamcardib', 'name': 'iamcardib', 'id': '866953267'}, {'screen_name': 'janetjackson', 'name': 'janet jackson', 'id': '52939106'}]",['http://glblctzn.me/gcfnyc2018'],[],7,24,90,"['jnj', 'globalcitizen', 'healthforhumanity']",[],https://twitter.com/JNJNews/status/1026877527623524352,False,,1,https://pbs.twimg.com/ext_tw_video_thumb/1026877404965289984/pu/img/6euC1llxctVfghf7.jpg,,,,,,,[],,,,
1022511904441475074,1022511904441475074,2018-07-26 21:30:10 IST,2018-07-26,21:30:10,+0530,20457806,jnjnews,Johnson & Johnson,,"""When you empower one woman, she can empower another and another."" – #JNJ Global Head, Strategy &amp; Ops, Global External Innovation, Cat Oyler on the value of investing in #WomeninSTEM. See how we're helping the next generation of female leaders:  https://t.co/dtTpzxsx90 #WiSTEM2D  https://t.co/z3GCqhhpeH",en,[],['http://goo.gl/aQswTK'],['https://pbs.twimg.com/media/DjCxKEhXsAEXreb.jpg'],0,17,44,"['jnj', 'womeninstem', 'wistem2d']",[],https://twitter.com/JNJNews/status/1022511904441475074,False,,1,https://pbs.twimg.com/media/DjCxKEhXsAEXreb.jpg,,,,,,,[],,,,
1021790793781129218,1021790793781129218,2018-07-24 21:44:43 IST,2018-07-24,21:44:43,+0530,20457806,jnjnews,Johnson & Johnson,,"Along with @EltonOfficial and @KensingtonRoyal, #JNJ is proud to join fellow founding partners of the @MenStar Coalition, a global coalition focused on expanding diagnosis and treatment of #HIV in men:  https://t.co/V6oMRtV07k #AIDS2018 #makeHIVhistory  https://t.co/aeBxPZJUTy",en,"[{'screen_name': 'eltonofficial', 'name': 'elton john', 'id': '174593833'}, {'screen_name': 'kensingtonroyal', 'name': 'the duke and duchess of cambridge', 'id': '2812768561'}, {'screen_name': 'menstar', 'name': 'menstar coalition', 'id': '1017351807700557824'}]",['https://goo.gl/mjmHeB'],['https://pbs.twimg.com/media/Di4hT4IW4AAN0Je.jpg'],2,18,45,"['jnj', 'hiv', 'aids2018', 'makehivhistory']",[],https://twitter.com/JNJNews/status/1021790793781129218,False,,1,https://pbs.twimg.com/media/Di4hT4IW4AAN0Je.jpg,,,,,,,[],,,,
1021394560843476993,1021394560843476993,2018-07-23 19:30:14 IST,2018-07-23,19:30:14,+0530,20457806,jnjnews,Johnson & Johnson,,"Meet #JNJ's @SchuitemakerH, a trailblazing researcher who’s devoted her career to a preventative vaccine for #HIV–and is closer than ever! Learn about her fascinating journey and the latest research she's presenting @iasociety's #AIDS2018:  https://t.co/Cr4lV2Cgj3 #makeHIVhistory  https://t.co/s0yaRHOOBF",en,"[{'screen_name': 'schuitemakerh', 'name': 'hanneke schuitemaker', 'id': '866028485680267264'}, {'screen_name': 'iasociety', 'name': 'ias - international aids society', 'id': '46158711'}]",['https://goo.gl/NcmbFt'],['https://pbs.twimg.com/media/Diy48KEW0AEi0Au.jpg'],1,19,69,"['jnj', 'hiv', 'aids2018', 'makehivhistory']",[],https://twitter.com/JNJNews/status/1021394560843476993,False,,1,https://pbs.twimg.com/media/Diy48KEW0AEi0Au.jpg,,,,,,,[],,,,
1019929888344731648,1019929888344731648,2018-07-19 18:30:09 IST,2018-07-19,18:30:09,+0530,20457806,jnjnews,Johnson & Johnson,,"Twenty-two simple, 7-minute workouts in one free download. Get the award-winning #JNJ app that has over 3 million downloads and keeps you active on the go:  https://t.co/uhDhx3bqCb  https://t.co/bCn1ZCrkSl",en,[],['http://goo.gl/fZ1f8E'],['https://pbs.twimg.com/tweet_video_thumb/DieE01xX0AAzsBj.jpg'],0,5,26,['jnj'],[],https://twitter.com/JNJNews/status/1019929888344731648,False,,1,https://pbs.twimg.com/tweet_video_thumb/DieE01xX0AAzsBj.jpg,,,,,,,[],,,,
1019695837830664194,1019695837830664194,2018-07-19 03:00:07 IST,2018-07-19,03:00:07,+0530,20457806,jnjnews,Johnson & Johnson,,#JNJ Global Head of Health Technology Marc Leibowitz speaks at Fortune @brainstormtech on how J&amp;J is using tech to reimagine the future of healthcare for people everywhere. #fortunetech  https://t.co/w261YWSPgj  https://t.co/tm8oyfruu7,en,"[{'screen_name': 'brainstormtech', 'name': 'fortune brainstorm tech', 'id': '3430078515'}]",['https://goo.gl/XE71wB'],['https://pbs.twimg.com/media/Diav9alX0AAT8S4.jpg'],0,17,31,"['jnj', 'fortunetech']",[],https://twitter.com/JNJNews/status/1019695837830664194,False,,1,https://pbs.twimg.com/media/Diav9alX0AAT8S4.jpg,,,,,,,[],,,,
