id,conversation_id,created_at,date,time,timezone,user_id,username,name,place,tweet,language,mentions,urls,photos,replies_count,retweets_count,likes_count,hashtags,cashtags,link,retweet,quote_url,video,thumbnail,near,geo,source,user_rt_id,user_rt,retweet_id,reply_to,retweet_date,translate,trans_src,trans_dest
967111847852769280,967111847852769280,2018-02-24 00:30:07 IST,2018-02-24,00:30:07,+0530,20457806,jnjnews,Johnson & Johnson,,Congratulations to #JNJ's Caroline Pavis for being named a 2017 @weworkforhealth Champion. Learn more about her work with online health advocates through @HealtheVoices:  https://t.co/cGUr3rLRgU  https://t.co/0IxmSHZGQD,en,"[{'screen_name': 'weworkforhealth', 'name': 'we work for health', 'id': '33629051'}, {'screen_name': 'healthevoices', 'name': 'healthevoices', 'id': '3008571198'}]",['https://goo.gl/nnT8ap'],['https://pbs.twimg.com/media/DWvfGZ0U0AA0CHO.jpg'],0,8,37,['jnj'],[],https://twitter.com/JNJNews/status/967111847852769280,False,,1,https://pbs.twimg.com/media/DWvfGZ0U0AA0CHO.jpg,,,,,,,[],,,,
966719277255544833,966719277255544833,2018-02-22 22:30:11 IST,2018-02-22,22:30:11,+0530,20457806,jnjnews,Johnson & Johnson,,"""Our Credo is our overall strategic plan."" – #JNJ Worldwide VP Michael Sneed talks the importance of #corporatepurpose and how to introduce it into your organization:  https://t.co/fde5e37F6w  https://t.co/wQLQ2zOdjS",en,[],['https://goo.gl/J3V9TE'],['https://pbs.twimg.com/media/DWp6DsHX0AAEum7.jpg'],0,7,31,"['jnj', 'corporatepurpose']",[],https://twitter.com/JNJNews/status/966719277255544833,False,,1,https://pbs.twimg.com/media/DWp6DsHX0AAEum7.jpg,,,,,,,[],,,,
966462540577431552,966462540577431552,2018-02-22 05:30:00 IST,2018-02-22,05:30:00,+0530,17813899,stanfordgsb,Stanford Graduate School of Business,,"“Use every mistake as an opportunity. Be transparent and embrace failure. Most important, be resilient. Don’t admire the problem, but the opportunities that the problem provides.” – #JNJ Chairman &amp; CEO Alex Gorsky #IndusDilemma @JNJnews",en,"[{'screen_name': 'jnjnews', 'name': 'johnson & johnson', 'id': '20457806'}]",[],[],2,62,119,"['jnj', 'indusdilemma']",[],https://twitter.com/StanfordGSB/status/966462540577431552,False,,0,,,,,,,,[],,,,
966447450855759872,966447450855759872,2018-02-22 04:30:02 IST,2018-02-22,04:30:02,+0530,17813899,stanfordgsb,Stanford Graduate School of Business,,"#JNJ Chairman &amp; CEO Alex Gorsky on self-care: “The healthier and more energetic you are as a person, the better you will be at home and work. Build healthy habits. Take care of yourself. Make time to reenergize and manage work-life balance.” #IndusDilemma @JNJnews",en,"[{'screen_name': 'jnjnews', 'name': 'johnson & johnson', 'id': '20457806'}]",[],[],1,14,20,"['jnj', 'indusdilemma']",[],https://twitter.com/StanfordGSB/status/966447450855759872,False,,0,,,,,,,,[],,,,
966402144893992960,966402144893992960,2018-02-22 01:30:00 IST,2018-02-22,01:30:00,+0530,17813899,stanfordgsb,Stanford Graduate School of Business,,"“We’re always thinking, ‘How can we continuously disrupt ourselves?’ Because, as I see it, we have two options: be changed, or lead change. We are constantly doing the latter, always on the hunt for new innovation.” – #JNJ Chairman &amp; CEO Alex Gorsky #IndusDilemma @JNJnews",en,"[{'screen_name': 'jnjnews', 'name': 'johnson & johnson', 'id': '20457806'}]",[],[],0,28,30,"['jnj', 'indusdilemma']",[],https://twitter.com/StanfordGSB/status/966402144893992960,False,,0,,,,,,,,[],,,,
966387070431350784,966387070431350784,2018-02-22 00:30:06 IST,2018-02-22,00:30:06,+0530,20457806,jnjnews,Johnson & Johnson,,#JNJ is proud to announce a new #3Dbioprinting research laboratory at @tcddublin affiliated with @ambercentre to advance the design &amp; delivery of healthcare solutions. Learn more:  https://t.co/3InKslRGhn  https://t.co/sfLjPRnvcM,en,"[{'screen_name': 'tcddublin', 'name': 'trinity college dublin', 'id': '31537951'}, {'screen_name': 'ambercentre', 'name': 'amber', 'id': '1951328072'}]",['https://goo.gl/NqzcZJ'],['https://pbs.twimg.com/media/DWlL6ugX4AAiWe9.jpg'],0,26,56,"['jnj', '3dbioprinting']",[],https://twitter.com/JNJNews/status/966387070431350784,False,,1,https://pbs.twimg.com/media/DWlL6ugX4AAiWe9.jpg,,,,,,,[],,,,
962733000978026496,962733000978026496,2018-02-11 22:30:08 IST,2018-02-11,22:30:08,+0530,20457806,jnjnews,Johnson & Johnson,,Increasing the number of women and girls in #STEM is a #JNJ business imperative. Hear from a J&amp;J leader on how we’re making it happen:  https://t.co/aVAeYbA8hM #WomenInScience  https://t.co/l2Khigw6xF,en,[],['http://goo.gl/EmckFr'],['https://pbs.twimg.com/media/DVxQj6cXcAABegN.jpg'],0,26,49,"['stem', 'jnj', 'womeninscience']",[],https://twitter.com/JNJNews/status/962733000978026496,False,,1,https://pbs.twimg.com/media/DVxQj6cXcAABegN.jpg,,,,,,,[],,,,
961686867937775616,961686867937775616,2018-02-09 01:13:11 IST,2018-02-09,01:13:11,+0530,20457806,jnjnews,Johnson & Johnson,,Congrats to #JNJ's Duda Kertesz for being named a Top Corporate #Latina Executive of the Year and #JNJ's HOLA for being recognized as a Top Employee Resource Group by @LATINAStyleMag! #LS502018 #LatinaExecutives  https://t.co/sH6PS2CLjk,en,"[{'screen_name': 'latinastylemag', 'name': 'latina style inc.', 'id': '330489425'}]",[],['https://pbs.twimg.com/media/DViZG6wWkAIEX2o.jpg'],1,5,25,"['jnj', 'latina', 'jnj', 'ls502018', 'latinaexecutives']",[],https://twitter.com/JNJNews/status/961686867937775616,False,,1,https://pbs.twimg.com/media/DViZG6wWkAIEX2o.jpg,,,,,,,[],,,,
960905962969354245,960905962969354245,2018-02-06 21:30:08 IST,2018-02-06,21:30:08,+0530,20457806,jnjnews,Johnson & Johnson,,"It can be found on some 800 #JNJ buildings and is even set in stone! Look back on the history and evolution of Our Credo, our #corporateresponsibility statement, celebrating its diamond anniversary this year:  https://t.co/kM1UlMa3Gz #CSR  https://t.co/cb9OldnOnn",en,[],['http://goo.gl/2EKTza'],['https://pbs.twimg.com/media/DVXS4TrW0AACJqc.jpg'],0,12,39,"['jnj', 'corporateresponsibility', 'csr']",[],https://twitter.com/JNJNews/status/960905962969354245,False,,1,https://pbs.twimg.com/media/DVXS4TrW0AACJqc.jpg,,,,,,,[],,,,
960166094039322625,960166094039322625,2018-02-04 20:30:10 IST,2018-02-04,20:30:10,+0530,20457806,jnjnews,Johnson & Johnson,,"On #WorldCancerDay, we're proud to introduce  https://t.co/nVPqRaFmfe, a one-stop destination that can help #cancer patients cope with their diagnosis:  https://t.co/ehlcIKdVnI #WeCanICan #JNJ  https://t.co/oSRfZ3xmpE",en,[],"['http://Cancer.com', 'https://goo.gl/4jtzcz']",['https://pbs.twimg.com/media/DVMx-NdW4AE8PKf.jpg'],0,9,30,"['worldcancerday', 'cancer', 'wecanican', 'jnj']",[],https://twitter.com/JNJNews/status/960166094039322625,False,,1,https://pbs.twimg.com/media/DVMx-NdW4AE8PKf.jpg,,,,,,,[],,,,
959894293136707584,959894293136707584,2018-02-04 02:30:08 IST,2018-02-04,02:30:08,+0530,20457806,jnjnews,Johnson & Johnson,,Imagine a world in which we can diagnose an #autoimmune disease before it hits. See how surprising #JNJ research is paving the way to a potential cure:  https://t.co/c08pxrtjln  https://t.co/SB4pZF1fqk,en,[],['http://goo.gl/sDSFop'],['https://pbs.twimg.com/media/DVI6xVXWkAA809J.jpg'],1,19,37,"['autoimmune', 'jnj']",[],https://twitter.com/JNJNews/status/959894293136707584,False,,1,https://pbs.twimg.com/media/DVI6xVXWkAA809J.jpg,,,,,,,[],,,,
957312286686875651,957312286686875651,2018-01-27 23:30:09 IST,2018-01-27,23:30:09,+0530,20457806,jnjnews,Johnson & Johnson,,"From 1886 to today, we’re celebrating the anniversaries of 13 life-changing #healthcare inventions created by #JNJ throughout our history:  https://t.co/GlPW2xcxMm #DiscoverJNJ  https://t.co/AKhQxErV9X",en,[],['http://goo.gl/KSnrZX'],['https://pbs.twimg.com/media/DUkOc04WkAE8LB4.jpg'],0,18,44,"['healthcare', 'jnj', 'discoverjnj']",[],https://twitter.com/JNJNews/status/957312286686875651,False,,1,https://pbs.twimg.com/media/DUkOc04WkAE8LB4.jpg,,,,,,,[],,,,
956543833436803074,956543833436803074,2018-01-25 20:36:36 IST,2018-01-25,20:36:36,+0530,20457806,jnjnews,Johnson & Johnson,,"As #JNJ leaders attend #Davos this week, #JNJ CSO Paul Stoffels weighs in on the next great global healthcare challenge:  https://t.co/raYbRyLiia #WEF18 #MentalHealth  https://t.co/N1H3z3Y9In",en,[],['https://goo.gl/QGHP9h'],['https://pbs.twimg.com/media/DUZTi6eXUAA31N8.jpg'],2,20,28,"['jnj', 'davos', 'jnj', 'wef18', 'mentalhealth']",[],https://twitter.com/JNJNews/status/956543833436803074,False,,1,https://pbs.twimg.com/media/DUZTi6eXUAA31N8.jpg,,,,,,,[],,,,
956290315995918336,956290315995918336,2018-01-25 03:49:13 IST,2018-01-25,03:49:13,+0530,20457806,jnjnews,Johnson & Johnson,,"We are deeply saddened to hear about our @SavetheChildren partners in Jalalabad, Afghanistan, whose humanitarian work reaches almost 1.4 million children. Our thoughts are with them during this difficult time. #JNJ  https://t.co/YwqVNEm7h6",en,"[{'screen_name': 'savethechildren', 'name': 'save the children us', 'id': '14055301'}]",['https://twitter.com/SavetheChildren/status/956214429967900673'],[],5,24,59,['jnj'],[],https://twitter.com/JNJNews/status/956290315995918336,False,https://twitter.com/SavetheChildren/status/956214429967900673,0,,,,,,,,[],,,,
955769779368837121,955769779368837121,2018-01-23 17:20:47 IST,2018-01-23,17:20:47,+0530,20457806,jnjnews,Johnson & Johnson,,$JNJ reports 4Q 2017 financial results. See release for full financial data &amp; non-GAAP reconciliations:  https://t.co/KdEOB29KTm  https://t.co/TCRjLVMvn1,en,[],['http://goo.gl/STNCKq'],['https://pbs.twimg.com/media/DUOTjDqX0AAyxGr.jpg'],1,24,37,[],['jnj'],https://twitter.com/JNJNews/status/955769779368837121,False,,1,https://pbs.twimg.com/media/DUOTjDqX0AAyxGr.jpg,,,,,,,[],,,,
955153043338784768,955153043338784768,2018-01-22 00:30:06 IST,2018-01-22,00:30:06,+0530,20457806,jnjnews,Johnson & Johnson,,"Taking time off work has been linked with stress reduction, heart disease prevention, better sleep &amp; improved productivity once you return! Here’s how to make the most of your vacation time &amp; other #employeebenefits:  https://t.co/8JBlcxS6hJ #JNJ  https://t.co/VQwMqGalX8",en,[],['http://goo.gl/Td8kgs'],['https://pbs.twimg.com/media/DUFioP9WsAEBu4n.jpg'],0,13,41,"['employeebenefits', 'jnj']",[],https://twitter.com/JNJNews/status/955153043338784768,False,,1,https://pbs.twimg.com/media/DUFioP9WsAEBu4n.jpg,,,,,,,[],,,,
954405704110104576,954405704110104576,2018-01-19 23:00:26 IST,2018-01-19,23:00:26,+0530,20457806,jnjnews,Johnson & Johnson,,#JNJ is proud to be a top 20 company on @FortuneMagazine’s World’s #MostAdmired Companies list for a 16th consecutive year – the highest-ranked healthcare company to make the list. See why:  https://t.co/s7UEq7kh4Z  https://t.co/YrTrTSsf6T,en,"[{'screen_name': 'fortunemagazine', 'name': 'fortune', 'id': '25053299'}]",['http://goo.gl/3DddnL'],['https://pbs.twimg.com/media/DT667dUXUAAvmH-.jpg'],147,70,157,"['jnj', 'mostadmired']",[],https://twitter.com/JNJNews/status/954405704110104576,False,,1,https://pbs.twimg.com/media/DT667dUXUAAvmH-.jpg,,,,,,,[],,,,
953643123351187457,953643123351187457,2018-01-17 20:30:13 IST,2018-01-17,20:30:13,+0530,20457806,jnjnews,Johnson & Johnson,,"From health-tracking #wearables to kid-friendly antibiotics, meet the winners of #JNJ's #GenH Challenge:  https://t.co/oerZ0XZS5h  https://t.co/XIkJVl2OKs",en,[],['https://goo.gl/HfGhKS'],['https://pbs.twimg.com/media/DTwFXYQX4AA7Oa_.jpg'],0,12,24,"['wearables', 'jnj', 'genh']",[],https://twitter.com/JNJNews/status/953643123351187457,False,,1,https://pbs.twimg.com/media/DTwFXYQX4AA7Oa_.jpg,,,,,,,[],,,,
953492099466481664,953492099466481664,2018-01-17 10:30:06 IST,2018-01-17,10:30:06,+0530,20457806,jnjnews,Johnson & Johnson,,Hear how @JNJInnovation's #JLABS is helping to support this 26-year-old's #startup:  https://t.co/Q4sjF4jfaq #JNJ #JLABSTMC  https://t.co/N0UMByXay8,en,"[{'screen_name': 'jnjinnovation', 'name': 'johnson & johnson innovation', 'id': '1260044826'}]",['https://goo.gl/vmAVg1'],['https://pbs.twimg.com/media/DTt8ArHX0AER6eC.jpg'],0,15,20,"['jlabs', 'startup', 'jnj', 'jlabstmc']",[],https://twitter.com/JNJNews/status/953492099466481664,False,,1,https://pbs.twimg.com/media/DTt8ArHX0AER6eC.jpg,,,,,,,[],,,,
952993815551504390,952993815551504390,2018-01-16 01:30:06 IST,2018-01-16,01:30:06,+0530,20457806,jnjnews,Johnson & Johnson,,Women and minorities continue to be severely underrepresented in science and engineering jobs. Check out the #JNJ program on a mission to even that balance:  https://t.co/bn2l5JdCDj #STEM  https://t.co/LeOmIhgJB2,en,[],['http://goo.gl/v5SaVd'],['https://pbs.twimg.com/media/DTm20tFX4AAZtxa.jpg'],1,23,28,"['jnj', 'stem']",[],https://twitter.com/JNJNews/status/952993815551504390,False,,1,https://pbs.twimg.com/media/DTm20tFX4AAZtxa.jpg,,,,,,,[],,,,
952631427325157376,952631427325157376,2018-01-15 01:30:05 IST,2018-01-15,01:30:05,+0530,20457806,jnjnews,Johnson & Johnson,,Hear the inspiring story of a Syrian #refugee turned #JNJ scientist:  https://t.co/qlxsqGh9V9  https://t.co/48uWeGHG1k,en,[],['https://goo.gl/Rdr9OS'],['https://pbs.twimg.com/media/DThtO7dW4AEU2W_.jpg'],0,9,28,"['refugee', 'jnj']",[],https://twitter.com/JNJNews/status/952631427325157376,False,,1,https://pbs.twimg.com/media/DThtO7dW4AEU2W_.jpg,,,,,,,[],,,,
952344543915139073,952344543915139073,2018-01-14 06:30:07 IST,2018-01-14,06:30:07,+0530,20457806,jnjnews,Johnson & Johnson,,"#JNJ Chairman and CEO Alex Gorsky addresses @WestPoint_USMA, #USMA2019 students who are poised to be future leaders at their 500th Night Banquet, to mark 500 nights until their graduation &amp; commissioning.  https://t.co/ZblFl6C1iv",en,"[{'screen_name': 'westpoint_usma', 'name': 'u.s. military academy at west point', 'id': '249844732'}]",[],['https://pbs.twimg.com/media/DTdoUDbWsAE9bwk.jpg'],1,24,63,"['jnj', 'usma2019']",[],https://twitter.com/JNJNews/status/952344543915139073,False,,1,https://pbs.twimg.com/media/DTdoUDbWsAE9bwk.jpg,,,,,,,[],,,,
951853811844505601,951853811844505601,2018-01-12 22:00:07 IST,2018-01-12,22:00:07,+0530,20457806,jnjnews,Johnson & Johnson,,"From dental floss to contact lenses, check out the 13 #JNJ inventions are all marking milestone anniversaries in 2018:  https://t.co/7X8I86cUmT #DiscoverJNJ  https://t.co/4vsf5XfWU9",en,[],['https://goo.gl/LGhKp5'],['https://pbs.twimg.com/media/DTWp_pJW0AARH5M.jpg'],0,27,44,"['jnj', 'discoverjnj']",[],https://twitter.com/JNJNews/status/951853811844505601,False,,1,https://pbs.twimg.com/media/DTWp_pJW0AARH5M.jpg,,,,,,,[],,,,
951197043883683840,951197043883683840,2018-01-11 02:30:22 IST,2018-01-11,02:30:22,+0530,20457806,jnjnews,Johnson & Johnson,,"""We're doubling down on our commitment to health technology innovation."" Hear from #JNJ Global Head of Health Technology Marc Leibowitz on #DigitalHealthCES. #CES2018  https://t.co/W9UFVK6PkF",en,[],[],[],0,22,32,"['jnj', 'digitalhealthces', 'ces2018']",[],https://twitter.com/JNJNews/status/951197043883683840,False,,1,https://pbs.twimg.com/ext_tw_video_thumb/951197010987663360/pu/img/EY3hayDM5VlRUuQH.jpg,,,,,,,[],,,,
950864791756853249,950864791756853249,2018-01-10 04:30:07 IST,2018-01-10,04:30:07,+0530,20457806,jnjnews,Johnson & Johnson,,"Tune in at 8PM EST this evening to hear #JNJ WWC Pharm @joaquinduato, @PhRMA’s @steveubl and @Allergan’s @brentlsaunders discuss the tough questions facing the healthcare industry at #JPMHC18:  https://t.co/Bi4y2dXAjq  https://t.co/5T0wMKq6V9",en,"[{'screen_name': 'joaquinduato', 'name': 'joaquin duato', 'id': '2494541167'}, {'screen_name': 'phrma', 'name': 'phrma', 'id': '116748080'}, {'screen_name': 'steveubl', 'name': 'stephen j. ubl', 'id': '3152287149'}, {'screen_name': 'brentlsaunders', 'name': 'brent saunders', 'id': '3014302521'}]",['http://goo.gl/U9R9R2'],['https://pbs.twimg.com/media/DTImfOZVAAA1KzC.jpg'],0,10,26,"['jnj', 'jpmhc18']",[],https://twitter.com/JNJNews/status/950864791756853249,False,,1,https://pbs.twimg.com/media/DTImfOZVAAA1KzC.jpg,,,,,,,[],,,,
950817273723355136,950817273723355136,2018-01-10 01:21:18 IST,2018-01-10,01:21:18,+0530,20457806,jnjnews,Johnson & Johnson,,ICYMI #JNJ Chairman &amp; CEO Alex Gorsky joined a Q&amp;A with #investors at #JPMHC18 to discuss the company's performance. Listen here:  https://t.co/IS2zfOhGIl  https://t.co/UadRBQeIfJ,en,[],"['https://goo.gl/yN7hSw', 'https://twitter.com/jpmorgan/status/950539500454727680']",[],0,12,27,"['jnj', 'investors', 'jpmhc18']",[],https://twitter.com/JNJNews/status/950817273723355136,False,https://twitter.com/jpmorgan/status/950539500454727680,0,,,,,,,,[],,,,
950800364818878465,950800364818878465,2018-01-10 00:14:06 IST,2018-01-10,00:14:06,+0530,20457806,jnjnews,Johnson & Johnson,,ICYMI #JNJ Chairman &amp; CEO Alex Gorsky talked with @JPMorgan's Michael Weinstein about #JNJ's pharmaceutical business and the future of global healthcare. Catch it here:  https://t.co/8LuuWCP2SA #JPMHC18  https://t.co/bjDtXd0uPi,en,"[{'screen_name': 'jpmorgan', 'name': 'j.p. morgan', 'id': '1155522630'}]","['https://goo.gl/a5a55P', 'https://twitter.com/jpmorgan/status/950538497768677376']",[],0,10,20,"['jnj', 'jnj', 'jpmhc18']",[],https://twitter.com/JNJNews/status/950800364818878465,False,https://twitter.com/jpmorgan/status/950538497768677376,0,,,,,,,,[],,,,
950767946246344704,950767946246344704,2018-01-09 22:05:17 IST,2018-01-09,22:05:17,+0530,20457806,jnjnews,Johnson & Johnson,,ICYMI #JNJ Chairman &amp; CEO Alex Gorsky appeared on @CNBC's @SquawkStreet with @megtirrell at #JPMHC18 to discuss #JNJ's 2017 performance and outlook for 2018. Watch here:  https://t.co/fWWgwZD3fD  https://t.co/9iRricNy6p,en,"[{'screen_name': 'cnbc', 'name': 'cnbc', 'id': '20402945'}, {'screen_name': 'squawkstreet', 'name': 'squawk on the street', 'id': '106498703'}, {'screen_name': 'megtirrell', 'name': 'meg tirrell', 'id': '47678782'}]",['https://goo.gl/v93KX6'],['https://pbs.twimg.com/media/DTHOaEjXcAEu2Jj.jpg'],0,14,22,"['jnj', 'jpmhc18', 'jnj']",[],https://twitter.com/JNJNews/status/950767946246344704,False,,1,https://pbs.twimg.com/media/DTHOaEjXcAEu2Jj.jpg,,,,,,,[],,,,
949038519556739073,949038519556739073,2018-01-05 03:33:10 IST,2018-01-05,03:33:10,+0530,20457806,jnjnews,Johnson & Johnson,,Will you be at #CES2018? Looking forward to this session on how we’re innovating to transform healthcare for all. #JNJ  https://t.co/ZxOPTMLguH,en,[],['https://twitter.com/dhsummit/status/948966103518187521'],[],0,7,27,"['ces2018', 'jnj']",[],https://twitter.com/JNJNews/status/949038519556739073,False,https://twitter.com/dhsummit/status/948966103518187521,0,,,,,,,,[],,,,
948298111230734336,948298111230734336,2018-01-03 02:31:02 IST,2018-01-03,02:31:02,+0530,20457806,jnjnews,Johnson & Johnson,,Congratulations to #JNJ VP Talent Acquisition @sjoerdgehring on his recognition as a top person in HR Tech! We’ll be at #CES2018 discussing how #tech is transforming the hiring process at J&amp;J and beyond. Follow along at @JNJCareers!  https://t.co/p6O4bX8V0u,en,"[{'screen_name': 'sjoerdgehring', 'name': 'sjoerd gehring', 'id': '27606741'}, {'screen_name': 'jnjcareers', 'name': 'jnj careers', 'id': '360238082'}]",['https://twitter.com/ERE_net/status/946735268148776961'],[],0,12,41,"['jnj', 'ces2018', 'tech']",[],https://twitter.com/JNJNews/status/948298111230734336,False,https://twitter.com/ERE_net/status/946735268148776961,0,,,,,,,,[],,,,
946032956849770497,946032956849770497,2017-12-27 20:30:08 IST,2017-12-27,20:30:08,+0530,20457806,jnjnews,Johnson & Johnson,,"Find out why a 5-minute stroll, once an hour, at work should be at the top of your to-do list in the #newyear:  https://t.co/1hw0BISGtc #JNJ  https://t.co/K3eS3HdHvc",en,[],['https://goo.gl/h6BrT1'],['https://pbs.twimg.com/media/DSD79cVWkAAy2ai.jpg'],0,15,26,"['newyear', 'jnj']",[],https://twitter.com/JNJNews/status/946032956849770497,False,,1,https://pbs.twimg.com/media/DSD79cVWkAAy2ai.jpg,,,,,,,[],,,,
943919792179892224,943919792179892224,2017-12-22 00:33:10 IST,2017-12-22,00:33:10,+0530,20457806,jnjnews,Johnson & Johnson,,#JNJ Chairman &amp; CEO Alex Gorsky has been named the new Chairman of the @American_Heart CEO Roundtable:  https://t.co/4NJbl6X3ga #HeartCEOs  https://t.co/4ar3gpi4Vz,en,"[{'screen_name': 'american_heart', 'name': 'american heart association', 'id': '105242077'}]",['https://goo.gl/MEkSvY'],['https://pbs.twimg.com/media/DRl6DAkWkAAv2bd.jpg'],2,23,59,"['jnj', 'heartceos']",[],https://twitter.com/JNJNews/status/943919792179892224,False,,1,https://pbs.twimg.com/media/DRl6DAkWkAAv2bd.jpg,,,,,,,[],,,,
943496245858979842,943496245858979842,2017-12-20 20:30:08 IST,2017-12-20,20:30:08,+0530,20457806,jnjnews,Johnson & Johnson,,ICYMI: #JNJ Chairman &amp; CEO Alex Gorsky shared why J&amp;J stands with Dreamers and supports a permanent fix to the #DACA program. Read more on why we value diverse voices in driving innovation and finding life-saving cures:  https://t.co/yuGagyl4M2 #DreamActNow  https://t.co/smyv0pR3Zq,en,[],['http://goo.gl/MKfeqh'],['https://pbs.twimg.com/media/DRf41ZiXcAA7Hig.jpg'],2,26,47,"['jnj', 'daca', 'dreamactnow']",[],https://twitter.com/JNJNews/status/943496245858979842,False,,1,https://pbs.twimg.com/media/DRf41ZiXcAA7Hig.jpg,,,,,,,[],,,,
943179168006725632,943179168006725632,2017-12-19 23:30:11 IST,2017-12-19,23:30:11,+0530,20457806,jnjnews,Johnson & Johnson,,"Three fellow co-workers, two artificial knees, one immense mountain and zero degree conditions. #JNJ Human Performance Institute Co-Founder Dr. @JackGroppel shares his #Kilimanjaro experience:  https://t.co/XqXvjkDhK7  https://t.co/wj58KyANm7",en,"[{'screen_name': 'jackgroppel', 'name': 'jack', 'id': '38342263'}]",['http://goo.gl/kmr3Ez'],['https://pbs.twimg.com/media/DRbYc_7X0AAiFsr.jpg'],7,11,32,"['jnj', 'kilimanjaro']",[],https://twitter.com/JNJNews/status/943179168006725632,False,,1,https://pbs.twimg.com/media/DRbYc_7X0AAiFsr.jpg,,,,,,,[],,,,
943167446072152065,943167446072152065,2017-12-19 22:43:37 IST,2017-12-19,22:43:37,+0530,20457806,jnjnews,Johnson & Johnson,,"#JNJ has donated more than $2 million to aid #HurricaneMaria victims. See how our employees have helped by assembling 2,400 hygiene kits w/ @mapintl:  https://t.co/PeCSeCBtIE  https://t.co/r2chHrcrOU",en,"[{'screen_name': 'mapintl', 'name': 'map international', 'id': '18192895'}]",['https://goo.gl/aDx54a'],[],1,12,31,"['jnj', 'hurricanemaria']",[],https://twitter.com/JNJNews/status/943167446072152065,False,,1,https://pbs.twimg.com/ext_tw_video_thumb/943167347195568129/pu/img/cvKkE9QSmlmE5wiq.jpg,,,,,,,[],,,,
943130067768610816,943130067768610816,2017-12-19 20:15:05 IST,2017-12-19,20:15:05,+0530,20457806,jnjnews,Johnson & Johnson,,"At #JNJ, we are committed to opening our hearts &amp; minds to a diverse range of the brightest, most innovative people we can find. The #DACA program ensures that our friends &amp; family who came, worked hard, invested, &amp; thrived in the U.S. can remain here, at home. #DreamActNow  https://t.co/qDhFL4MNgo",en,[],[],['https://pbs.twimg.com/media/DRary9YX4AAxlWH.jpg'],3,14,34,"['jnj', 'daca', 'dreamactnow']",[],https://twitter.com/JNJNews/status/943130067768610816,False,,1,https://pbs.twimg.com/media/DRary9YX4AAxlWH.jpg,,,,,,,[],,,,
943117140529315840,943117140529315840,2017-12-19 19:23:43 IST,2017-12-19,19:23:43,+0530,20457806,jnjnews,Johnson & Johnson,,#JNJ Chairman &amp; CEO Alex Gorsky announced #JNJ is joining the Coalition for the American Dream &amp; will support a fix to the #DACA program that protects Dreamers. Learn how this is a part of our longstanding commitment to global diversity:  https://t.co/yuGagy3tns #DreamActNow  https://t.co/t5e2zcCfNa,en,[],['http://goo.gl/MKfeqh'],['https://pbs.twimg.com/media/DRXeUyYU8AA2ahv.jpg'],6,35,76,"['jnj', 'jnj', 'daca', 'dreamactnow']",[],https://twitter.com/JNJNews/status/943117140529315840,False,,1,https://pbs.twimg.com/media/DRXeUyYU8AA2ahv.jpg,,,,,,,[],,,,
941706438216429568,941706438216429568,2017-12-15 21:58:05 IST,2017-12-15,21:58:05,+0530,20457806,jnjnews,Johnson & Johnson,,"#JNJ is proud to be No.4 on @WSJ’s inaugural list of the 250 Most Effectively Managed U.S. Companies, highlighting our service to workers, customers, &amp; shareholders:  https://t.co/PTMLr1MhfC  https://t.co/enKFsAnCyP",en,"[{'screen_name': 'wsj', 'name': 'the wall street journal', 'id': '3108351'}]",['http://goo.gl/dEXBBL'],['https://pbs.twimg.com/media/DRGdAv0UEAACFFE.jpg'],2,5,43,['jnj'],[],https://twitter.com/JNJNews/status/941706438216429568,False,,1,https://pbs.twimg.com/media/DRGdAv0UEAACFFE.jpg,,,,,,,[],,,,
941691674534858752,941691674534858752,2017-12-15 20:59:25 IST,2017-12-15,20:59:25,+0530,20457806,jnjnews,Johnson & Johnson,,"A diaper that can detect type 1 diabetes, an app that acts as a digital midwife &amp; a baby box that can help improve infant sleep. Hear more about the winners of the @JanssenGlobal &amp; @JNJInnovation Next-Gen #BabyBox #QuickFireChallenge:  https://t.co/iHYjM0BfTh #JNJ #JLABS  https://t.co/7CK63odxtt",en,"[{'screen_name': 'janssenglobal', 'name': 'janssen global', 'id': '2474345197'}, {'screen_name': 'jnjinnovation', 'name': 'johnson & johnson innovation', 'id': '1260044826'}]",['http://goo.gl/jGmzKG'],['https://pbs.twimg.com/media/DRGPlEvVAAUEU5f.jpg'],3,50,67,"['babybox', 'quickfirechallenge', 'jnj', 'jlabs']",[],https://twitter.com/JNJNews/status/941691674534858752,False,,1,https://pbs.twimg.com/media/DRGPlEvVAAUEU5f.jpg,,,,,,,[],,,,
941352159215484929,941352159215484929,2017-12-14 22:30:18 IST,2017-12-14,22:30:18,+0530,20457806,jnjnews,Johnson & Johnson,,The force is strong with #JNJ's new #StarWars-themed BAND-AID® Brand adhesive bandages. Meet the master behind them:  https://t.co/x0luy0thCh #TheLastJedi  https://t.co/MlYInTznV5,en,[],['https://goo.gl/T3JyMb'],['https://pbs.twimg.com/media/DRBazH_WAAI2USF.jpg'],0,15,36,"['jnj', 'starwars', 'thelastjedi']",[],https://twitter.com/JNJNews/status/941352159215484929,False,,1,https://pbs.twimg.com/media/DRBazH_WAAI2USF.jpg,,,,,,,[],,,,
